,0
0,"Insider Sell: Airbnb Inc's Chief Accounting Officer David Bernstein Sells 3,402 Shares"
1,Booking Holdings Stock Is Up Almost 50% This Year. Can It Keep Flying Higher?
2,"Airbnb, Inc. (ABNB) Sees a More Significant Dip Than Broader Market: Some Facts to Know"
3,Trucking fintech company Tank Payments nets economic empowerment prize
4,"Aristotle Balogh, CTO of Airbnb Inc, Sells 2,750 Shares"
5,Airbnb to Announce Third Quarter 2023 Results
6,Signal Says Don't Sweat Airbnb Stock's Pullback
7,3 Unstoppable Growth Stocks to Buy and Hold Forever
8,A Legislative Revolt Is Taking Place Against Airbnb All Over Europe
9,"Canada targets Airbnb, others to ease rental shortage"
