,0
0,Abbott Stock Is Rising. Earnings Beat and Guidance Was Strong.
1,"Abbott Raises Outlook, Boosted By 'Whopping' Growth Of Diabetes Device"
2,Abbott (ABT) Beats Q3 Earnings and Revenue Estimates
3,Ally Financial (ALLY) Q3 Earnings Beat EstimatesZacks
4,Johnson & Johnson (JNJ) Q3 Earnings and Revenues Surpass EstimatesZacks
5,"UPDATE 2-Abbott profit beats on strong sales of medical devices, diagnostics"
6,Abbott says market overestimating sales hit from weight-loss drugs
7,Abbott profit beats on strong sales of glucose monitoring system
8,Abbott Reports Third-Quarter 2023 Results and Raises Midpoint of Full-Year EPS Guidance Range
9,Intuitive Surgical (ISRG) to Post Q3 Earnings: What's in Store?
10,Should You Buy Abbott (ABT) Ahead of Earnings?
11,Abbott (ABT) Beats Q3 Earnings and Revenue EstimatesZacks
12,Why AT&T (T) Might Surprise This Earnings SeasonZacks
13,"Earn Extra Cash On ABT Stock Earnings, But Careful With This Risk"
