,0
0,ADM (ADM) Upgraded to Strong Buy: Here's Why
1,What Makes Chart Industries (GTLS) a New Strong Buy StockZacks
2,All You Need to Know About Health Catalyst (HCAT) Rating Upgrade to Strong BuyZacks
3,Earnings Preview: Archer Daniels Midland (ADM) Q3 Earnings Expected to Decline
4,Earnings Preview: Texas Instruments (TXN) Q3 Earnings Expected to DeclineZacks
5,Earnings Preview: Hawaiian Holdings (HA) Q3 Earnings Expected to DeclineZacks
6,"Zacks.com featured highlights Rev Group, CVR Energy, Cardinal Health, Commercial Vehicle and Archer Daniels Midland"
7,Archer Daniels Midland (ADM) Outpaces Stock Market Gains: What You Should Know
8,5 Stocks That Brokers Favor Despite the Ongoing Uncertainty
9,What Does Archer-Daniels-Midland Company's (NYSE:ADM) Share Price Indicate?
10,ADM Partners with the E.O. Wilson Biodiversity Foundation to Advance Biodiversity Research and Education
11,Best Dividend Aristocrats According to Analysts
12,"ADM to Release Third Quarter Financial Results Oct. 24, 2023"
13,Archer-Daniels-Midland Company (NYSE:ADM) is largely controlled by institutional shareholders who own 80% of the company
