,0
0,Tracing Ownership Trends of The AES Corp(AES)
1,Decoding Ownership and Performance: The AES Corp(AES)
2,AES Participating in Two Clean Hydrogen Hubs Awarded Funding by US Department of Energy
3,Are Options Traders Betting on a Big Move in AES Corporation (AES) Stock?
4,Implied Volatility Surging for DISH Network (DISH) Stock OptionsZacks
5,Is the Options Market Predicting a Spike in Commercial Metals (CMC) Stock?Zacks
6,"Shareholders in AES (NYSE:AES) have lost 49%, as stock drops 12% this past week"
7,Unraveling The AES Corp (AES)'s Potential Underperformance: A Deep Dive into Key Metrics
8,AES Announces Quarterly Dividend
9,Paramount Global an Underperform due to 'weak balance sheet': 4 big analyst cuts
10,"AES Announces Third Quarter 2023 Financial Review Conference Call to be Held on Friday, November 3, 2023 at 10:00 a.m. ET"
11,Is The AES Corp (AES) Set to Underperform? Analyzing the Factors Limiting Growth
