,0
0,These 2 Finance Stocks Could Beat Earnings: Why They Should Be on Your Radar
1,How to Boost Your Portfolio with Top Medical Stocks Set to Beat EarningsZacks
2,How to Boost Your Portfolio with Top Auto-Tires-Trucks Stocks Set to Beat EarningsZacks
3,American International Group (AIG) Could Be a Great Choice
4,Are You Looking for a High-Growth Dividend Stock?Zacks
5,Why The First Bancshares (FBMS) is a Great Dividend Stock Right NowZacks
6,20 Best Value Investing YouTube Channels
7,Why American International Group (AIG) Could Beat Earnings Estimates Again
8,Will ServiceNow (NOW) Beat Estimates Again in Its Next Earnings Report?Zacks
9,Will Copa Holdings (CPA) Beat Estimates Again in Its Next Earnings Report?Zacks
10,Radian Group (RDN) Rises 40% YTD: Can It Retain the Bull Run?
11,AIG reshuffles leadership to focus on underwriting business
12,AIG Announces Business Leadership Appointments to Drive Next Phase of Profitable Growth
13,Should You Buy Lemonade (LMND) Stock for Better Returns Now?
14,"Zacks Industry Outlook Highlights MetLife, American International, The Hartford Financial Services, Everest and MGIC Investment"
15,5 Multiline Insurers Worth Buying Despite Industry Challenges
