,0
0,Why Earnings Season Could Be Great for Alaska Air Group (ALK)
1,Why AT&T (T) Might Surprise This Earnings SeasonZacks
2,Why State Street (STT) Might Surprise This Earnings SeasonZacks
3,"Transportation Stocks' Q3 Earnings Due on Oct 19: UNP, ALK & AAL"
4,Earnings Preview: JetBlue Airways (JBLU) Q3 Earnings Expected to Decline
5,Fuel Costs Likely to Hurt American Airlines' (AAL) Q3 Earnings
6,Alaska Air Group (ALK) Declines More Than Market: Some Information for Investors
7,Is a Beat in Store for Alaska Air (ALK) in Q3 Earnings?
8,Why Earnings Season Could Be Great for Alaska Air Group (ALK)Zacks
9,What's in Store for Canadian National (CNI) in Q3 Earnings?Zacks
10,"Are Investors Undervaluing Alaska Air Group, Inc. (NYSE:ALK) By 35%?"
11,Alaska Air Group (ALK) Expected to Beat Earnings Estimates: Can the Stock Move Higher?
12,Why Earnings Season Could Be Great for Alaska Air Group (ALK)Zacks
13,Dow Inc. (DOW) Expected to Beat Earnings Estimates: Can the Stock Move Higher?Zacks
14,Alaska Airlines makes a key change to its beverage service
15,Why Investors Need to Take Advantage of These 2 Transportation Stocks Now
16,How to Boost Your Portfolio with Top Finance Stocks Set to Beat EarningsZacks
17,Want Better Returns? Don't Ignore These 2 Computer and Technology Stocks Set to Beat EarningsZacks
