,0
0,"Allstate Announces September and Third Quarter 2023 Catastrophe Losses, Implemented Rates and Prior Year Reserve Reestimates"
1,Allstate (ALL) Soars 3.8%: Is Further Upside Left in the Stock?
2,Allstate Corp's Meteoric Rise: Unpacking the 25% Surge in Just 3 Months
3,Exclusive-Activist hedge fund Trian targets insurer Allstate-sources
4,Why Allstate Stock Zoomed Nearly 6% Skyward on Friday
5,Allstate to Discuss Third Quarter 2023 Earnings With Investors
6,Allstate Debuts Coaching Mural to Develop Youth Soccer Players
7,Allstate (ALL) Continues Auto Rate Hikes to Boost Profits
8,Allstate Announces August 2023 Catastrophe Losses and Implemented Rates
9,Allstate and AFCA Reveal the 2023 Good Works Team
