,0
0,13 Best Video Surveillance and Private Security Stocks to Buy
1,"If EPS Growth Is Important To You, Allegion (NYSE:ALLE) Presents An Opportunity"
2,1 Magnificent S&P 500 Dividend Stock Down 20% to Buy and Hold Forever
3,"Allegion Schedules Conference Call, Webcast to Announce 2023 Third-Quarter Results"
4,Strength in Aerospace Segment Aids Barnes (B) Amid Cost Woes
5,Reasons Why You Should Avoid Betting on Allegion (ALLE) Now
6,"Allegion's New 2023 Multifamily Living Trends Report Unveils What Multifamily Renters Desire, Expect and Are Willing to Pay More For in Their Residences"
7,Unveiling Allegion PLC's Dividend Dynamics: A Comprehensive Analysis
8,Should We Be Delighted With Allegion plc's (NYSE:ALLE) ROE Of 45%?
9,Allegion Appoints Susan (Sue) L. Main to Board of Directors
