,0
0,Where Will AMD Stock Be in 5 Years?
1,6 Of The Year's Best Stocks Are Crashing Now (Including Tesla)
2,"What Intel, AMD, and Super Micro Computer Stock Investors Should Know About Recent Chip Updates"
3,"Estimating The Intrinsic Value Of Advanced Micro Devices, Inc. (NASDAQ:AMD)"
4,AMD Introduces New AMD Ryzen Threadripper 7000 Series Processors and Ryzen Threadripper PRO 7000 WX-Series Processors for the Ultimate Workstation
5,AMD Introduces Fastest AMD Radeon Laptop Graphics Ever Developed
6,Alienware's latest gaming laptop is the first to feature AMD's Radeon RX 7900M GPUEngadget
7,AMD's Radeon RX 7900M is its most powerful mobile GPU yetEngadget
8,2 Artificial Intelligence (AI) Stocks to Buy Now That Could Soar Like Nvidia
9,2 Tech Stocks You Can Buy and Hold for the Next Decade
10,"What ASML, AMD, and Nvidia Stock Investors Should Know About Recent Semiconductor Updates"
11,AMD Steps Up to Nvidia: Unleashing Consumer GPU Power for AI Development
