,0
0,Possible Bearish Signals With Ameriprise Financial Insiders Disposing Stock
1,Daniel Wilson: How I Built My $4.9 Billion Ameriprise Practice
2,Ameriprise Financial Announces Schedule for Third Quarter 2023 Investor Conference Call
3,25 Biggest Publicly Traded Asset Managers
4,Ameriprise Financial's (NYSE:AMP) five-year total shareholder returns outpace the underlying earnings growth
5,Why Ameriprise Financial Services (AMP) is a Top Value Stock for the Long-Term
6,Advisor With $170 Million in Assets Joins Ameriprise Financial to Fulfill Growth Aspirations
7,"Thirteen Ameriprise Financial Advisors Recognized on Barron’s ""2023 Top Independent Financial Advisors"" Ranking"
8,Ameriprise Financial Matching Public Donations to Feeding America Now Through Oct. 31
9,Plan and Profit: 3 Retirement Advisory Stocks Worth Your Investment
