,0
0,OptimizeRx Corp. (OPRX) Surges 13.0%: Is This an Indication of Further Gains?
1,"Insider Sell: Ansys Inc President and CEO Ajei Gopal Sells 30,728 Shares"
2,"Ansys to Release Third Quarter 2023 Earnings on November 1, 2023"
3,Ansys Congratulates Oracle Red Bull Racing on Historic Championship Season
4,Ansys Earns Two Best Workplaces in Europe Awards
5,Those who invested in ANSYS (NASDAQ:ANSS) five years ago are up 87%
6,Ansys Named in U.S. News & World Report's 2024 Best Companies to Work For in Technology
7,"Keysight, Synopsys, and Ansys Accelerate RFIC Semiconductor Design with New Reference Flow for TSMC’s Advanced 4nm RF FinFET Process"
8,"Keysight, Synopsys, and Ansys Accelerate RFIC Semiconductor Design with New Reference Flow for TSMC's Most Advanced 4nm RF FinFET Process"
9,Unveiling the Investment Potential of Ansys Inc (ANSS): A Comprehensive Analysis of Financial ...
