,0
0,Has AvalonBay Communities (AVB) Outpaced Other Finance Stocks This Year?
1,Smart Defense: 7 REITs to Shield Your Portfolio From Today’s Turbulence
2,Want Better Returns? Don't Ignore These 2 Finance Stocks Set to Beat Earnings
3,Want Better Returns? Don't Ignore These 2 Basic Materials Stocks Set to Beat EarningsZacks
4,How to Find Strong Finance Stocks Slated for Positive Earnings SurprisesZacks
5,"AvalonBay Communities, Inc. Announces Third Quarter 2023 Earnings Release Date"
6,Assessing AvalonBay Communities Inc's Dividend Sustainability: A Deep Dive
7,"The Zacks Analyst Blog Highlights Welltower, AvalonBay Communities, SBA Communications Corp. and Essential Properties Realty Trust"
8,"AvalonBay Communities: Great Business, Horrible Price"
9,4 REITs to Consider as Economic Growth Projections Move North
10,Is Mid-America Apartment (MAA) an Apt Portfolio Pick Right Now?
11,Are Finance Stocks Lagging  AvalonBay Communities (AVB) This Year?
