,0
0,Broadcom and VMware Announce Election Deadline for VMware Stockholders to Elect Merger Consideration
1,VMware Shares Fall on Worries China Could Block Broadcom DealBarrons.com
2,Will Biden AI Chip Curbs On China Derail Broadcom-VMware Deal?Investor's Business Daily
3,Will Biden AI Chip Curbs On China Derail Broadcom-VMware Deal?
4,Nvidia’s AI Backlog Will Spare Pain From China Bans—For Now
5,"Why Nvidia, Intel, Broadcom, and Other Artificial Intelligence (AI) Semiconductor Stocks Crumbled Tuesday Morning"
6,"Nvidia, Chip Stocks Drop After U.S. Curbs Exports"
7,Nvidia and Other Chip Stocks Remain Under Pressure After U.S. Export CurbsThe Wall Street Journal
8,"U.S. Tightens Curbs on AI Chip Exports to China, Widening Rift With Nvidia and IntelThe Wall Street Journal"
9,VMware Shares Fall on Worries China Could Block Broadcom Deal
10,Why VMware Stock Just Dropped 7%
11,VMware Shares Fall on Worries China Could Block Broadcom DealBarrons.com
12,Will Biden AI Chip Curbs On China Derail Broadcom-VMware Deal?Investor's Business Daily
13,Jim Cramer’s 10 Best AI Stocks
14,Unveiling Broadcom (AVGO)'s Value: Is It Really Priced Right? A Comprehensive Guide
15,"Johnson & Johnson Is Falling, but This Tech Stock Is Really Getting Hit Hard"
