,0
0,Why American Water Works (AWK) is a Top Dividend Stock for Your Portfolio
1,Are You Looking for a High-Growth Dividend Stock?Zacks
2,American Homes 4 Rent (AMH) is a Top Dividend Stock Right Now: Should You Buy?Zacks
3,"Illinois American Water Awards Nearly $85,000 in Firefighter Grants"
4,"Pennsylvania American Water Awards $85,000 to Local Fire Departments"
5,Positive Signs As Multiple Insiders Buy American Water Works Company Stock
6,"Down -16.07% in 4 Weeks, Here's Why American Water Works (AWK) Looks Ripe for a Turnaround"
7,"Down -37.74% in 4 Weeks, Here's Why Vera Therapeutics, Inc. (VERA) Looks Ripe for a TurnaroundZacks"
8,"Down -20.51% in 4 Weeks, Here's Why Insulet (PODD) Looks Ripe for a TurnaroundZacks"
9,American Water's (AWK) Pennsylvania Arm to Invest in Expansion
10,"American Water to Discuss Third Quarter 2023 Earnings and Initiation of 2024 Earnings Guidance on November 2, 2023"
11,California American Water: Monterey Peninsula Water Management District Moves Forward with Risky Resolution
12,"American Water Charitable Foundation and New Jersey American Water Partner with Upstream Alliance to Help Improve Access to Environmental Education in Camden, N.J."
13,Q4 2023 Strategy: The 7 Best Stocks to Stabilize Your Portfolio in Market Turmoil
