,0
0,The Best Warren Buffett Stocks You Can Buy With Huge Passive Income Potential
1,Warren Buffett Owns Over $28 Billion of This Beaten-Down Stock. Here's Why It's a No-Brainer Buy Right Now
2,"Warren Buffett Could Have Bought Any of 60 Nasdaq 100 Companies With $71 Billion. Instead, He Piled It All Into 1 Stock."
3,Think Bank of America Stock Is Too Risky? Listen to What the CEO Just Said
4,Wall Street banks are no longer touting 'green shoots' in dealmaking
5,Wall Street’s Green Shoots Risk Wilting
6,Bank of America Declares Fourth-Quarter 2023 Stock Dividend
7,Bank of America vs. Wells Fargo: Growth and Customer-Centric Innovation
8,"Earnings This Week: Tesla, Netflix, Procter & Gamble"
9,Bank of America Corporation (NYSE:BAC) Q3 2023 Earnings Call Transcript
