,0
0,Baxter and 5 More Medical Device Stocks Primed for a Comeback
1,"""Baxter International (BAX) Stock: A Hidden Value Trap? Unpacking the Risks and Rewards"""
2,Baxter Launches Digital Image Capture Capability for PanOptic Plus Ophthalmoscope
3,Why Investors Punished Baxter International Stock Today
4,Ozempic Kidney Trial Sinks Dialysis Stocks
5,Is Baxter International Inc (BAX) Set to Underperform? Analyzing the Factors Limiting Growth
6,Is Baxter International (BAX) Too Good to Be True? A Comprehensive Analysis of a Potential ...
7,Dialysis Providers Are the Top Decliners in the S&P 500 Wednesday
8,Baxter International (NYSE:BAX) shareholders have endured a 51% loss from investing in the stock three years ago
9,Baxter Appoints Joel Grade Chief Financial Officer
