,0
0,BD Names Greg Rodetis as Senior Vice President of Investor Relations
1,"BD, Casella Complete Industry-First Pilot Recycling 40,000 Pounds of Used Medical Devices"
2,Is Becton Dickinson (NYSE:BDX) Using Too Much Debt?
3,BD to Announce Fiscal 2023 Fourth Quarter and Full Year Financial Results
4,"Will Becton, Dickinson and Company (BDX) Benefit from FDA Approval for its Alaris Infusion Pump?"
5,Here's Why Becton Dickinson (NYSE:BDX) Has Caught The Eye Of Investors
6,Investors in Becton Dickinson (NYSE:BDX) have seen returns of 20% over the past year
7,"Estimating The Fair Value Of Becton, Dickinson and Company (NYSE:BDX)"
8,"With 90% institutional ownership, Becton, Dickinson and Company (NYSE:BDX) is a favorite amongst the big guns"
9,Azenta Announces CFO Transition
