,0
0,Biogen Inc. (BIIB) Falls More Steeply Than Broader Market: What Investors Need to Know
1,Wall Street Analysts See a 25.44% Upside in Biogen Inc. (BIIB): Can the Stock Really Move This High?
2,Wall Street Analysts Predict a 35.36% Upside in Dutch Bros (BROS): Here's  What You Should KnowZacks
3,Does Jazz (JAZZ) Have the Potential to Rally 47.29% as Wall Street Analysts Expect?Zacks
4,The past five years for Biogen (NASDAQ:BIIB) investors has not been profitable
5,7 Low-Volatility Stocks to Buy if You’re a Concerned Investor
6,Eli Lilly Sparks As Rival Novo Says Diabetes Drug Could Treat Kidney Disease — But Is Lilly Stock A Buy?
7,Will Biogen Inc. (BIIB) Beat Estimates Again in Its Next Earnings Report?
8,Biogen Inc. (BIIB) Falls More Steeply Than Broader Market: What Investors Need to KnowZacks
9,Why Vertex (VRTX) is Poised to Beat Earnings Estimates AgainZacks
10,Biogen Inc. (BIIB) Advances But Underperforms Market: Key Facts
11,Biogen Inc. (NASDAQ:BIIB) is favoured by institutional owners who hold 89% of the company
12,How Much Will Your Medicare Part B Premiums Increase Next Year?
13,Biogen Inc. (BIIB) Stock Sinks As Market Gains: What You Should Know
