,0
0,"Bank of NY Mellon, Dollar Tree, VF Corp: Trending Stocks"
1,Bank of New York Mellon Stock Jumps After Earnings Beat
2,Why Bank of New York Mellon Stock Dropped and Then Popped Today
3,The Bank of New York Mellon Corporation (BK) Q3 Earnings and Revenues Surpass EstimatesZacks
4,BNY Mellon Stock Rises After Earnings Beat. Thank Higher Interest Rates.Barrons.com
5,The Bank of New York Mellon Corporation (BK) Q3 Earnings: Taking a Look at Key Metrics Versus Estimates
6,Johnson & Johnson (JNJ) Reports Q3 Earnings: What Key Metrics Have to SayZacks
7,Goldman (GS) Reports Q3 Earnings: What Key Metrics Have to SayZacks
8,"Bank of New York Mellon Corp (BK) Reports Q3 2023 Earnings of $1.0 Billion, EPS up 213%"
9,BNY Mellon Stock Rises After Earnings Beat. Thank Higher Interest Rates.
10,The Bank of New York Mellon Corporation (BK) Q3 Earnings and Revenues Surpass Estimates
11,The Charles Schwab Corporation (SCHW) Tops Q3 Earnings EstimatesZacks
12,The Bank of New York Mellon Corporation (BK) Q3 Earnings: Taking a Look at Key Metrics Versus EstimatesZacks
13,"BNY Mellon (BK) Q3 Earnings Beat, Revenues & AUM Increase Y/Y"
14,BNY Mellon Declares Dividends
15,BNY Mellon Reports Third Quarter 2023 Results
