,0
0,"Bitcoin surges above $30,000 after a wild week for crypto investors"
1,BlackRock-backed US carbon pipeline scrapped in face of opposition
2,Scaramucci: BlackRock ETF approval will drive $31 million bitcoin
3,"UPDATE 1-Bitcoin hits two-month high above $30,000 in volatile week"
4,Is iShares Investment Grade Bond Factor ETF (IGEB) a Strong ETF Right Now?
5,Is iShares MSCI USA Quality Factor ETF (QUAL) a Strong ETF Right Now?Zacks
6,Is Nuveen ESG Small-Cap ETF (NUSC) a Strong ETF Right Now?Zacks
7,BlackRock Rolls Out Target-Date ETFs for Savers With No Company Plan
8,Train strikes could last another six months as RMT members back further action
9,"BlackRock, JPMorgan crypto bull run could push bitcoin price to $200,000"
10,"Saba Capital Management, L.P. Boosts Stake in Blackrock CA Muni Income Tr"
11,BlackRock Transforms Access to Retirement Solutions for Millions of Americans
