,0
0,Neoadjuvant Opdivo (nivolumab) with Chemotherapy Provides Benefits for Patients with Resectable Non-Small Cell Lung Cancer Across PD-L1 Expression Levels with Three-Year Follow Up in CheckMate -816 Trial
1,Opdivo (nivolumab) in Combination with Cisplatin-Based Chemotherapy Followed by Opdivo Demonstrates Significant Survival Benefits for Cisplatin-Eligible Patients with Unresectable or Metastatic Urothelial Carcinoma in Phase 3 CheckMate -901 Trial
2,Perioperative Regimen of Neoadjuvant Opdivo (nivolumab) and Chemotherapy Followed by Adjuvant Opdivo Shows Significant Improvement in Event-Free Survival for Patients with Resectable Non-Small Cell Lung Cancer in Phase 3 CheckMate -77T Trial
3,2 Biotech Stocks That Could Make You Richer
4,Bristol Myers Squibb (BMY) Outpaces Stock Market Gains: What You Should Know
5,U.S. Food and Drug Administration Approves Opdivo® (nivolumab) as Adjuvant Treatment for Eligible Patients with Completely Resected Stage IIB or Stage IIC Melanoma1
6,Is Bristol Myers Squibb Stock a Buy Now?
7,"With 78% institutional ownership, Bristol-Myers Squibb Company (NYSE:BMY) is a favorite amongst the big guns"
8,"Biotech Stock Roundup: BMY Grabs MRTX, AKRO Down on Study Data, ALNY Faces Setback"
9,"Bristol Myers Squibb to Showcase Data Demonstrating Improved Outcomes in Earlier Stages of Cancer, Durable Long-Term Benefits with Opdivo-Based Regimens, and Addressing High Unmet Needs in Multiple Tumor Types at ESMO 2023"
