,0
0,Boston Scientific: Bridging Cultural and Language Barriers at Work Through Mentoring
1,Boston Scientific Stock Sees IBD RS Rating Improve To 74
2,Boston Scientific's (BSX) Wavewriter Alpha SCS Gets FDA's Nod
3,Be Wary Of Boston Scientific (NYSE:BSX) And Its Returns On Capital
4,QuidelOrtho (QDEL) Reports Solid Preliminary Q3 Revenues
5,"Walgreens Boots (WBA) Q4 Earnings Miss Estimates, Margins Down"
6,Is Boston Scientific (BSX) Stock Outpacing Its Medical Peers This Year?
7,5 Medical Product Stocks to Buy Amid Industry Recovery
8,"Neogen's (NEOG) Q1 Earnings Miss Estimates, Margins Rise"
9,Unveiling Boston Scientific (BSX)'s Value: Is It Really Priced Right? A Comprehensive Guide
