,0
0,"The Zacks Analyst Blog Highlights Visa, AbbVie, BHP Group, Caterpillar and Boston Scientific"
1,"Top Research Reports for Visa, AbbVie & BHP"
2,Is Boston Scientific Corporation (BSX) a Compelling Name in the Medical Device Universe?
3,"Insider Sell: EVP, Human Resources Wendy Carruthers Sells 11,671 Shares of Boston Scientific Corp"
4,Boston Scientific: Bridging Cultural and Language Barriers at Work Through Mentoring
5,Boston Scientific Stock Sees IBD RS Rating Improve To 74
6,Boston Scientific's (BSX) Wavewriter Alpha SCS Gets FDA's Nod
7,Be Wary Of Boston Scientific (NYSE:BSX) And Its Returns On Capital
8,QuidelOrtho (QDEL) Reports Solid Preliminary Q3 Revenues
9,"Walgreens Boots (WBA) Q4 Earnings Miss Estimates, Margins Down"
