,0
0,Why BorgWarner (BWA) Outpaced the Stock Market Today
1,BorgWarner (BWA) Declines More Than Market: Some Information for Investors
2,Is BorgWarner Inc. (NYSE:BWA) Potentially Undervalued?
3,12 Best Automotive Stocks To Buy Now
4,"The Zacks Analyst Blog Highlights General Motors, Ford and StellantisZacks"
5,Ford Makes A Rare Move In A Desperate Attempt To End The UAW StrikeBenzinga
6,BorgWarner (BWA) Dips More Than Broader Markets: What You Should Know
7,13 Best Auto Components and Parts Stocks to Buy Now
8,BorgWarner (BWA) Gains As Market Dips: What You Should Know
9,Unveiling BorgWarner (BWA)'s Value: Is It Really Priced Right? A Comprehensive Guide
10,Webcast Alert: BorgWarner 2023 Third Quarter Results Conference Call
11,BorgWarner (BWA) Stock Sinks As Market Gains: What You Should Know
