,0
0,BorgWarner (BWA) Ascends While Market Falls: Some Facts to Note
1,Why BorgWarner (BWA) Outpaced the Stock Market Today
2,BorgWarner (BWA) Declines More Than Market: Some Information for Investors
3,Is BorgWarner Inc. (NYSE:BWA) Potentially Undervalued?
4,12 Best Automotive Stocks To Buy Now
5,BorgWarner (BWA) Dips More Than Broader Markets: What You Should Know
6,13 Best Auto Components and Parts Stocks to Buy Now
7,BorgWarner (BWA) Gains As Market Dips: What You Should Know
8,Unveiling BorgWarner (BWA)'s Value: Is It Really Priced Right? A Comprehensive Guide
9,Webcast Alert: BorgWarner 2023 Third Quarter Results Conference Call
