,0
0,Blackstone stock falls on earnings miss
1,Blackstone Inc. (NYSE:BX) Q3 2023 Earnings Call Transcript
2,"Company News for Oct 20, 2023"
3,"Company News for Oct 19, 2023Zacks"
4,Blackstone Inc. (BX) Q3 Earnings and Revenues Lag EstimatesZacks
5,Trending tickers: Bitcoin | Tesla | AT&T | Blackstone
6,Heard on the Street Recap: Five-Alarm Chilling
7,Q3 2023 Blackstone Inc Earnings Call
8,"Blackstone Profit Drops 12% on Deal Slump, Shares Tumble"
9,Blackstone Inc. (BX) Reports Q3 Earnings: What Key Metrics Have to Say
10,Manpower (MAN) Q3 Earnings: Taking a Look at Key Metrics Versus EstimatesZacks
11,Here's What Key Metrics Tell Us About American Express (AXP) Q3 EarningsZacks
12,UPDATE 1-Blackstone's Q3 earnings miss shows toll of interest rate rises
13,Blackstone’s Earnings Fall Short. Lower Asset Sales Hurt Profit.
14,Blackstone Earnings Rise Despite a Dip in Asset SalesThe Wall Street Journal
15,Blackstone Inc. (BX) Q3 Earnings and Revenues Lag EstimatesZacks
