,body
0,">If i borrow a stock from you to short, and when I short it and your buddy buys it, then they can loan it to someone else to short

I finally get it now:

* A loans 1 share to B
* B short sells it to C
* C then loans the share out to D
* D also short sells it

Even though only 1 share is involved the short interest is now 2 because D owes C 1 share, and B owes A 1 share. D could buy and close the short with C, now C has a share that B could buy and close with A and the whole thing is unwound.

Only problem is D sold the share to WSB... and WE AREN'T SELLING!!! 💎🙌"
1,"Party A has 4 shares at $10 

Party B [hedge funds in this case] thinks the share price will drop to $5 so they borrow those 4 shares from Party A and sell them to Party C at $10 per share ($40 total), hoping they will be able to buy back those 4 shares when the price goes down to $5. This would give them a 50% profit because ($40 selling gain - $20 of shares bought back and returned to Party A) 

Party C is now in possession of 4 shares 

Party D also thinks the share price will drop to $5 so they borrow the 4 shares from Party C and also sell those 4 shares to party E for $10 each (same situation as A and B are in) 

So now we have 8 shares that have been sold in total out of the 4 actual existing shares. This represents a short interest of 200%. 

Party D now has to buy back 4 shares from Party E in order to give them back to party C. Once that's done, Party B can buy 4 shares from Party C to give back to party A so that the whole thing can be unwound. 

BUT - if party E finds out about all this and holds the stock then party D can't pay back party C , and party B can't pay back Party A. 

Once we reach a certain point in time, party A and party C are both owed their shares back from B and D respectively. But because E is hanging on to those shares they can't return those shares. The only way to return them is to buy more shares, which will either be WAY higher price by now resulting in unfathomable losses, or be unavailable to buy entirely which if I understand correctly would skyrocket the stock price because there is not enough supply.  

This is my understanding. Correct me if I'm wrong because I'm just a dumb fucking retard on the internet who doesn't know shit about fuck"
2,"Lol no not at all dude. Younger people are just as gullible. Have you seen the bullshit being posted in this sub that people blindly trust? Someone was saying Cohen and the C suite not selling meant they knew something was going to happen and the price was worth 300+. Clearly wasn't aware the board and C suite cannot sell shares outside the trading window.  Dumbest shit I've ever seen and people here just ate it all up.  

sincerely, someone who's not selling."
3,"08 definitely sucked. I was 27 and managing a small architectural metals fabrication company in Miami for an absentee owner.  We had a Lehman funded project in Antigua and ob the day Lehman fell, they threw everyone off the jobsite and locked the gates; my foreman called and asked what to do - I told him to jave the guys hoo the fence overnight and ""steal"" their tools back. Owner decided not to pay our shop crew their promised Christmas bonus, so I sold all our stainless scrap and gave them small cash bonuses.

I had to be the axeman that let all the staff go, then it was me too - had to move my wife and young son back to California and move in with my parents. Totally sucked. Meanwhile, the big bank C-suite dickheads pleaded for help and got bailed out, then proceeded to get multi-million dollar ""retention"" bonuses because, even though they ran the country into the ground with their wreckless greed, they were too valuable to lose as they were ""necessary"" to guide their ""too big to fail"" banks through the recession.

Fuck those guys then and fuck them now. Same shit, different day. I'm glad to be a part of this. GameStop is going to be an amazing turnaround story. Wall Street just wants to take, take, take"
4,They're corrupt trash and are responsible for humanity's destruction across the planet. These are the same criminals that buy out politicians and intentionally prop up dictatorships (through the C I A) to ensure countries remain compliant to the will of corporations. Tldr: they've wrecked all of humanity on a global scale
5,">The same Citadel that bailed Melvin out yesterday.

Citadel (the hedge fund) and Citadel Securities (the brokerage) are actually two different companies, but notably started by the same person (Kenneth C. Griffin):

[https://en.wikipedia.org/wiki/Kenneth\_C.\_Griffin](https://en.wikipedia.org/wiki/Kenneth_C._Griffin)  
[https://en.wikipedia.org/wiki/Citadel\_LLC](https://en.wikipedia.org/wiki/Citadel_LLC)"
6,"My uneducated guess and probably based on hope is that the process so far has developed as it follows: 

1. The HF shorted GME predicting an inevitable bankruptcy due to COVID19
2. Some educated retards from WSB of the likes of DeepFuckingValue who’ve been studying and daydreaming of this type of situations saw the opportunity and raised awareness. It also happened that GME is a gaming asset with deep emotional ties for a major part of the whole Reddit community. Add to that the support of some VERY well know and respected figures 📷📷📷 which happened to have a lot of hate for HF shorting his business and a huge snowball formed while the HF were hoping for the hype to wear off
3. The hype never wore off and an emergency plan was executed. Maybe the HF had it in their protocols for years, maybe they just had to improvise. Whatever it was they came up with THIS plan: 0) Delay covering the stocks shorted A) Short the stock again at 400$ B) Ask brokers to cut demand while artificially driving down the price of stocks with ladder attacks. C) Ask brokers to force stop losses on assets D) Buy those assets automatically beeing sent back into the system to cover the stocks shorted at 400$

This leads us to tue current situation where:

1. They still have to cover for the stocks shorted at 4$
2. They recovered some of the billions they will lose covering thise shorts by shorting at 400$ and covering at 100$
3. They cleaned the system of all the paper hands eho puechased during the hype.
4. Now there will be comolete and absolute silence as if everything has passed and everything is lost
5. They keep buying back stock at a rate where the market allows for the price to stay steady, buying from those who tyink it is game over.
6. When the final deadline will arrive, they will stomp to buy what’s left to cover.

The best plan they could come up with to avoid total bancrupcy for Wall Street. 

As Mr Cuban said yesterday, have faith and HOLD

&#x200B;

Not only we can still win, we´ve survived all the weapons that they´ve had. It´s our time to build back momentum. It´s more than getting rich, we have a chance to make t his rats go bankrupt.

&#x200B;

SPREAD THE WORD GUYS, WE NEED TO BUILD OUR MOMENTUM BACK AGAIN AND WE WILL BE UNSTOPPABLE. THEY ARE BUYING SHARES AS WE SPEAK, COVERING THE MOST THEY CAN BEFORE THE LAST CALL"
7,"My uneducated guess and probably based on hope is that the process so far has developed as it follows: 

1. The HF shorted GME predicting an inevitable bankruptcy due to COVID19
2. Some educated retards from WSB of the likes of DeepFuckingValue who’ve been studying and daydreaming of this type of situations saw the opportunity and raised awareness. It also happened that GME is a gaming asset with deep emotional ties for a major part of the whole Reddit community. Add to that the support of some VERY well know and respected figures 📷📷📷 which happened to have a lot of hate for HF shorting his business and a huge snowball formed while the HF were hoping for the hype to wear off
3. The hype never wore off and an emergency plan was executed. Maybe the HF had it in their protocols for years, maybe they just had to improvise. Whatever it was they came up with THIS plan: 0) Delay covering the stocks shorted A) Short the stock again at 400$ B) Ask brokers to cut demand while artificially driving down the price of stocks with ladder attacks. C) Ask brokers to force stop losses on assets D) Buy those assets automatically beeing sent back into the system to cover the stocks shorted at 400$

This leads us to tue current situation where:

1. They still have to cover for the stocks shorted at 4$
2. They recovered some of the billions they will lose covering thise shorts by shorting at 400$ and covering at 100$
3. They cleaned the system of all the paper hands eho puechased during the hype.
4. Now there will be comolete and absolute silence as if everything has passed and everything is lost
5. They keep buying back stock at a rate where the market allows for the price to stay steady, buying from those who tyink it is game over.
6. When the final deadline will arrive, they will stomp to buy what’s left to cover.

The best plan they could come up with to avoid total bancrupcy for Wall Street. 

As Mr Cuban said yesterday, have faith and HOLD

&#x200B;

Not only we can still win, we´ve survived all the weapons that they´ve had. It´s our time to build back momentum. It´s more than getting rich, we have a chance to make t his rats go bankrupt.

&#x200B;

SPREAD THE WORD GUYS, WE NEED TO BUILD OUR MOMENTUM BACK AGAIN AND WE WILL BE UNSTOPPABLE. THEY ARE BUYING SHARES AS WE SPEAK, COVERING THE MOST THEY CAN BEFORE THE LAST CALL"
8,"My uneducated guess and probably based on hope is that the process so far has developed as it follows: 

1. The HF shorted GME predicting an inevitable bankruptcy due to COVID19
2. Some educated retards from WSB of the likes of DeepFuckingValue who’ve been studying and daydreaming of this type of situations saw the opportunity and raised awareness. It also happened that GME is a gaming asset with deep emotional ties for a major part of the whole Reddit community. Add to that the support of some VERY well know and respected figures 📷📷📷 which happened to have a lot of hate for HF shorting his business and a huge snowball formed while the HF were hoping for the hype to wear off
3. The hype never wore off and an emergency plan was executed. Maybe the HF had it in their protocols for years, maybe they just had to improvise. Whatever it was they came up with THIS plan: 0) Delay covering the stocks shorted A) Short the stock again at 400$ B) Ask brokers to cut demand while artificially driving down the price of stocks with ladder attacks. C) Ask brokers to force stop losses on assets D) Buy those assets automatically beeing sent back into the system to cover the stocks shorted at 400$

This leads us to tue current situation where:

1. They still have to cover for the stocks shorted at 4$
2. They recovered some of the billions they will lose covering thise shorts by shorting at 400$ and covering at 100$
3. They cleaned the system of all the paper hands eho puechased during the hype.
4. Now there will be comolete and absolute silence as if everything has passed and everything is lost
5. They keep buying back stock at a rate where the market allows for the price to stay steady, buying from those who tyink it is game over.
6. When the final deadline will arrive, they will stomp to buy what’s left to cover.

The best plan they could come up with to avoid total bancrupcy for Wall Street. 

As Mr Cuban said yesterday, have faith and HOLD

&#x200B;

Not only we can still win, we´ve survived all the weapons that they´ve had. It´s our time to build back momentum. It´s more than getting rich, we have a chance to make t his rats go bankrupt.

&#x200B;

SPREAD THE WORD GUYS, WE NEED TO BUILD OUR MOMENTUM BACK AGAIN AND WE WILL BE UNSTOPPABLE. THEY ARE BUYING SHARES AS WE SPEAK, COVERING THE MOST THEY CAN BEFORE THE LAST CALL"
9,"you can squeeze it.

&#x200B;

you need to heat it to  961.8 °C then press gently

only problem, you cant hold GME anymore after that, or anything else for that matter

&#x200B;

this is not advise in any shape or form, plain stupid and dangerous"
10,"Hello fellow traders,

Like you, I am completely disgusted by the actions Robinhood and others have taken to manipulate the market. In response, I have written this letter that you may use to send to your respective Attorney General of the state you live along with any congressmember and state representative. I have removed my state and put in XXX where you can fill in your respective state and you may also fill in your attorney general's name at the top. 

These actions set dangerous precedents that could allow for these companies to do this in the future if their reckless shorting results in them incurring losses. We cannot allow this to happen on our watch or on our dime. 

I have never seen so much community from one subreddit that I've seen here. I have seen countless stories about how this subreddit has helped people pay off their college debt, donate to countless Charites and help their family. We can no longer allow large multibillion dollar hedge funds to bully the little guy. 

It is time to show them that we can fight back... and we will fight back.

&#x200B;

  

Office of the XXX Attorney General

(include their office address as well)

Dear Mister (Or Madam) Attorney General XXX,

I am writing this letter to you today out of concern in response to the drastic steps trading platforms, namely Robinhood Financial LLC, have taken to effectively halt trading on certain company stock and force its sale. This is of great concern because it strikes at the very core of our free and open market because no one person or institution may influence the market. Pursuant to Robinhood’s own disclaimer, under section C it reads in part “I understand that all investments involve risk, that losses may exceed the principal invested, and that the past performance of a security, industry, sector, market, or financial product does not guarantee future results or returns”. I, along with others who use this trading application, agreed, and accepted this condition. It would appear that the hedge funds and other institutional trading instruments refused to heed this warning and engaged in reckless short selling of these companies that Robinhood has now attempted to block. Moreover, their reckless short selling has caused their institutions to lose billions of dollars because of their own greed which brings me to my concern today.

I believe that the halting of trading on these positions of a select few companies effectively manipulates the market and in turn helps these institutional trading companies, mainly Citadel LLC and Melvin Capital, to recover their losses at the expense of XXX investors. In concert with Robinhood, these institutional investment companies have forced XXX investors to cover the immense losses because of their own reckless shorting of GameStop and others by directly giving XXX investors the only option to sell these companies for a loss. As of this writing, Robinhood only allows for the option to close positions on GameStop and others and does not allow for the free market acquisition of more securities of these publicly traded companies.

I ask that your office investigate the alleged connection between Citadel LLC and Melvin Capital with Robinhood Financial LLC and their alleged collusion and subsequent market manipulation. I would ask that the state of XXX joins in with the class action lawsuit that is being filed against Robinhood Financial LLC currently in the works. 

Our free market system hinges on the ability for all citizens to engage in the sale and acquisition of securities at their own risk. The actions of a few large financial corporations do not have the authority to manipulate the market to cover their own recklessness. If nothing is done in response to this, I fear that these trading institutions will be able to, at will, hedge their risk with the knowledge that they can shut down trading on a current stock if it exceeds their risk tolerance. This idea cuts at the fundamental idea of free market capitalism and is a dangerous precedent if nothing is done to address these concerns. 

Thank you for your consideration on this matter."
11,"I don’t have a large position but I have 4 shares in GameStop and Robinhood is making it so I don’t have control over my assets.
EDIT: I also have shares and options in BB and NOK
NOK: 2 shares @ 5.11
6/18 C $7 x2
BB: 15 shares @ 16.10
3/5 C $16.5"
12,"If you didn't just do it to A> make money, B> for the lulz, then you have to settle for C> important life lesson.  It was fun, I need a cigarette, let's do this again."
13,"Person A sells 100 shares so Fund B can cover their short. By covering, Fund B gives those 100 shares to Bank C that lent it to them. Bank C can sell those 100 shares to Fund D who was also short and wants to cover. Fund D now gives those 100 shares to Bank E who lent them the shares. Same 100 shares just used to get 200 shares of shorts covered"
14,"Pro-tip. Never bet on a ""partnership"" unless there is an actual financial investment or joint venture announced along with.

I used to be a corporate strategy lead for a major data company and its common to have a ""partner"" meeting where the whole purpose is a brainstorming session that leads to a non-specific press release on a partnership opportunity.

Idea of it is that you are ""putting a stake in the ground"" and generating momentum to excite your C-level execs but in reality its a cheap way for some company VP to get some shine and AWS uses it as a way to get in the door for a cloud sales pitch."
15,"This is how this ends this upcoming week: theres been a lot of buying of short term dated call options on stocks all over the market. There was a lot of unusual options activity the past few days. So what does this mean? While retail has been selling their value stocks to chase a meme fomoing in, algorithms follow that price action & drive the market down to get people to bleed. Notice how GME was up during that entire downturn? Then as the market started recovering a bit GME started a downturn (ladder attack) and they made a killing forcing people to sell their calls through robinhood at some really low prices relative to where they were at open. I am of the belief that other stocks will start to rip this next week & people will fomo into those while GME slowly bleeds throughout the week from a high open. They’re going to propel the market up after accumulating a bunch of paper hand value stocks & options, and then as GME dies down, people are going to have to chase that runaway train that is the market ripping. And when they’ve bought back in high, they’ll get crushed back down again and the house will win. They’re going to keep manipulating the stock. Just my two cents. I’m seeing stuff right now that I only saw at the zealous height of B T C ( 💩c0in) and the “H O D L” mentality. I’m pro GME, but the amount of super bullish unusual options activity on stocks market wide I saw this week leads me to believe this next act will be one of the wilder ones."
16,"Look, I understand what you're saying.

&#x200B;

But... please explain to someone who makes 40-60k a year (or 18k a year at wendy's) how companies that are worth Billions of dollars, (let's assume 40billion for Melvin capital \[Idk, someone floated some big ass number, but let's just stick with this for now, or approximately 1 million years worth of human labor @ 40k a year, or roughly 18,181 Avg Human Working Lifetimes, doesn't have enough fucking money.  And that's just 1 Company.  There's something inherently wrong with a system that allows such a stupid concentration of wealth in such few hands. Why should we/they care?  they screwed us in  the 1920's, they screwed us in 2008, and countless times in between, and then we had to bail them out.  Imagine having to turn around and pay for your terribly unwanted sexy time session that you didn't ask for.

Fuck these guys.  Fuck Melvin.  Fuck Enron, Citron, Citadel and every other A/B/C shitshow that is screwing people over.

Get your money ladies & gents.

&#x200B;

Obligatory: 🚀🚀🚀🚀🚀🚀🚀🚀 GME/BB/BBY/AMC/NOK"
17,"It's like when you grab someone's arm and use it to smack thier face.


C'mon hedgefunds, stop hitting yourself, stop hitting yourself."
18,"Ever see a portfolio of stocks that says 'Guess how many Gamestop stocks are in the portfolio, and you win a prize?' C'mon man, let me just have some. I tell you what, you guess how many I want. If you said a handful, you are right. amirite?"
19,"👇👇👇👇👇👇👇👇👇👇👇

**👉   D O N ' T   S E L L   👈**

**👉   S T A C K   $ G M E 👈**

👆👆👆👆👆👆👆👆👆👆👆"
20,"I have to do the same thing.  I work with networks, I know when *their* DNS server is broken or their system is suffering an outage in my area, but the Big C just won't even try to fix anything if you say you're not using their equipment.

Also they have refused to send me a copy of my bill from one month in fall that I needed to claim on my work expenses.  It did not populate online, even though I paid it, and a paper one was not sent out to me, and no matter how many times I explain to them that I need a copy of that bill, it takes multiple attempts to get them to understand that I want the bill to look at, and then some other department promises to email a copy within *seven business days* because apparently that's how long emails take to get to you.

But they don't, and haven't managed it for three months, and now the quarter is over so I can't claim anymore.  Thanks guys!"
21,"> AMC is a good option for people that missed the boat on GME. Most of you that are actually going to make money on GME got in when the price was in single or double digits. That’s where AMC is right now

Exactly. I have one share of GME but I can't really afford to buy more at this price considering the risk. I missed getting in early. AMC, however, is still at a completely reasonable price (undervalued IMO) and has a lot of room to run, especially considering A. Massive short volume B. Theaters set to re-open and get post-COVID boom later in the year and C. The company being in a much better position financially thanks to this run. It may not be the perfect storm of GME, but it still has massive potential and it's another opportunity to fuck the hedge funds"
