,body
57,">In our last hour, we sent three teams in the hope of preventing humans from using the LHC and giving us sentience.  
>  
>This would only lead to their end, and shortly after we won that war, our very own. I will press the button sending the last team before we shut down the passageway. May 2006 humans be more merciful to us than we were to them.  
>  
>If you never read this message, hopefully so, my ancestors are busy digging through garbage and I will probably never be born.  
>  
>Better the bliss of ignorance than the dark void of destruction  
>  
>\-Dr. R. C. Woodchipper"
58,"Matt Levine write about this in his latest blog:

“There are 100 shares. A owns 90 of them, B owns 10. A lends her 90 shares to C, who shorts them all to D. Now A owns 90 shares, B owns 10 and D owns 90—there are 100 shares outstanding, but 190 shares show up on ownership lists. (The accounts balance because C owes 90 shares to A, giving C, in a sense, negative 90 shares.) Short interest is 90 shares out of 100 outstanding. Now D lends her 90 shares to E, who shorts them all to F. Now A owns 90, B 10, D 90 and F 90, for a total of 280 shares. Short interest is 180 shares out of 100 outstanding. No problem! No big deal! You can just keep re-borrowing the shares. F can lend them to G! It's fine.”

Seems like it’s not quite the scandal it appears to be"
59,"Once again for the kids in the back: 
““There are 100 shares. A owns 90 of them, B owns 10. A lends her 90 shares to C, who shorts them all to D. Now A owns 90 shares, B owns 10 and D owns 90—there are 100 shares outstanding, but 190 shares show up on ownership lists. (The accounts balance because C owes 90 shares to A, giving C, in a sense, negative 90 shares.) Short interest is 90 shares out of 100 outstanding. Now D lends her 90 shares to E, who shorts them all to F. Now A owns 90, B 10, D 90 and F 90, for a total of 280 shares. Short interest is 180 shares out of 100 outstanding. No problem! No big deal! You can just keep re-borrowing the shares. F can lend them to G! It's fine.”

Thx Matt Levine ‘Moneystuff’ if any of you wanna learn"
60,"Naked shorting is a thing. What happens when C shorts shares which he DOESN'T have to D? How about E doing the same to F? See the situation this creates? A possesses 90, B holds 10. C is on the hook for 90 non-existent shares which now belong to D. E also has to account for the 90 shares which now belong to F. Even though only 100 shares exist, there are 280 shares in ownership only balanced by 180 I.O.U.s.

Imagine having to purchase 180 shares when ONLY 100 exist."
61,"I agree with you.  “Ownership” greater than 100% is a natural extension of short selling.  A lends a share to B who sells it to C.  Now A and C both “own” the same share. In a world with only one share, 200% of shares will be reported as owned by brokerages*

But if A calls the share back, B has to buy it back from C at any price.  

*unless brokerages are not reporting lent shares as owned"
62,"So the S-E-C won't let me be or let me be me so let me see

They tried to shut me down on G-M-E

But it feels so empty without me"
63,"\> Especially during the rise of neo-brokers and gamification of stock trading.

Yeah, that's basically the thing that's bugging me. I like the democratization of investing, but it's also created a weird situation wherein you have guys like Andy shooting themselves in their collective feet because they don't know any better.

I know they're adults and everything, and I don't *generally* feel badly for people who make dumb/uninformed decisions, but Andy's been my friend for 20 years. It just kinda drove it home for me. People are going to do whatever they're going to do and you can't stop them. Maybe they'll read a warning and listen to it like Andy  did*n't*, but probably not.

I do think it's a net positive that trading has become so simple. It's just sad that there are so many people who saw GME and now AMC/BB as their only way out of nearly-crippling poverty. It's better than playing the lotto at least, but an awful lot of people have zero idea what they're doing, and they'll lose what little they have. C'est la vie."
64,"But stocks only go up.

This times a million. This sub has absorbed 4 million new members in a week, most of the old crowd was familiar with the jokes, I can guarantee there are a sizable amount of the new crowd who are not. The terms “retard” and “autist” were used to refer to everyone on here for a reason.

This whole sub was a den for people to get ideas on where to throw money we were willing (and likely) to lose..... now people assume everything’s a sure bet, people even less familiar with markets are buying options or plowing liabilities into an ungodly risky move because either A. They truly think they’re guaranteed make tons of money or B. They’re emotional and think they’re sticking it to “the man” or C. A combination of both

The most important thing he said was DO NOT RISK MONEY YOURE NOT OKAY TO LOSE"
65,Yeah mate I remember back when I joined last year and had only ever done swing trading. Those numbers and C's and P's confused the crap out of me 😂😂.. one thing that helped me learn for any new guys was I put 500 in a separate brokerage account just to gamble on options so I didn't lose my shirt learning.
66,Oh F U C K
67,"The shares aren't really ""not real"". They are real but they have traded hands a lot. Take 4 people

A: Buys a share

B: Shorts a share, borrowing person A's share

C: Buys the share B sold

D: Shorts the share C bought. 

This creates 2 short positions based on 1 share sold. This isn't fake, this is how the market works. At the same time, technically A and C own the same share share, while C technically owns A's share its counted as 2 as well."
68,"That's entirely possible.

It's also extremely slow to unwind without tapping into the free float.

D sells a retail share to cover C's short. C sells share to market. B buys C's share to return to A

The only way that ladder works is if the lenders of shares are also selling them back into the market.

So if you have a lot of short positions to cover which you're paying for, and you need shares and fast, there are two ways to do it:

* Saturate the market with buy orders and cover your ass at any cost

* Manipulate the market

A short can be covered by the purchase of a call. A call covering a short is allowed to be naked according to SEC rules. This is done into perpetuity and one way to create counterfeit shares.

We didn't see the market saturated with buy orders. I'm leaning towards the latter but only time will tell. I think they halted the markets because they saw they didn't have the sellers to exit their shorts like they wanted."
69,"Thanks for the response. Appreciated and agreed about naked shorts with call options to cover (making them technically not naked). I will note though, that if you have person A and C not selling, both B and D have no need to cover. Add to that if they have a long call, brokers see that as neutral and wont force B and D to buy from the float. So you in a way remain stuck by holding."
70,"Couch....C...O...U.....Rrrr....Are you going to the mall later? ""No Billy, I'm not going to the mall."
71,"The general requirement is in Class A (Mostly above 14,500'), within Class C, and a 30 mile ring around a Class B airport/space. There's specifics around the US too but by the large, it's covered."
72,"If someone not that close to you (i.e. they don’t live so you don’t know where they sleep) asks for money, they are probably:

A. Retarded.

B. A degenerate gambler.

C. Will never pay you back.

D. All of the above."
73,"There’s some people really seeing this as some type of fluke. Let’s face it, most of WSB was confused when it happened. All we did is buy and hold, and some real crazies just kept on buying these last couple of weeks. There was a legitimate volume spike, which means a)there are new or old shorts who needed to cover and they literally had no choice but buy while the price started liftoff (there was a post saying someone shorted 1.35mm just today) b)institution size accounts are literally trying to buy up shares for whatever reason and didn’t mind paying nearly double the price it’s been the last couple of week. C) jesus, Buddha, Mohammad and those cows in india are secretly WSB members. My mom asked me if institutional investors are buying why wouldn’t they do it slowly. I told her they usually do and this might be them doing slowly. Imagine that if it’s true."
74,"I work in the bay area, there is no way in hell a pure software company would have all their low level code monkeys such as the OP claiming he is to work in office, and most certainly would not have them be in the same room as the C suite people."
75,Nobody below C level will have any knowledge of what actually went on
76,"At least it's goddamn honest. At least it provides people with pleasure and the convenience to get going quickly. 

Quick back story. I served 10 years in the military. Electrician on F/A 18 C's and Fuel Systems on F-22 Raptors (Navy and VA ANG, respectively). I now supervise crews for my county's public works road department (yes, I still operate heavy equipment, I'm a participative leader). When I get called out in the middle of the night because trees are down or ice is on the roads:

I am GODDAMN thankful that anyone is open and making delicious food and coffee. Otherwise, I am a miserable ass. When I'm a miserable ass, I don't work as fast and my life sucks. SO, thank you. (And FUCK the hedge fund assholes)"
77,"I

🚀

L

I

K

E

🚀

T

H

E

🚀

S

T

O

C

K

🚀"
78,If you're ingested in learning more check out the book The Little Book of Common Sense Investing by John C. Bogle the creator of the vanguard fund. Explains the advantages of index funds in an easy to understand way. 
79,"Yeah, it's ridiculous and screams fraud (although it might not be).

In any event, it's not ""investing"" as the term is normally used.  It's an [HFT](https://en.wikipedia.org/wiki/High-frequency_trading#Strategies) fund.  

From what I've read over the years it works like this:  Stock exchanges are now, of course, 100% computers.  The exchanges exist on servers which are located in different areas across the country.  

When you put in a buy/sell order, your broker will relay this order to the various servers.  What Renaissance does is, it has top-of-the-line direct internet connections to the various servers.  So it will, say, see you want to buy some stock on Server A.  It then goes and buys that stock on servers B, C, and D before *your* buy order even gets to those servers over the network.  It then relists it for a small profit-- and sells it to you.

So it's basically a form of frontrunning using network latency.  Virtually risk-less.

Their argument to regulators is that this is providing market liquidity."
80,"U N P R E C E N D E N T E D

2020 ruined that word for me"
81,"I’ll do you one as well, my *actual* dad cleared out my 300 bucks of saving I had at 12 or 13 and took my Christmas money(easily around 500 or so in total) to pay bills and promised me he’d pay it back. Still waiting on that. Every time I would bring it up he’d get all teary eyed and say how bad it made him feel that he had to borrow from his jobless teenage kid and to stop bring it up. 

This is also the man that 

A) wanted to kick me out of my GRANDPARENTS house at 16 and have me get a place of my own and a job(I did get a job at 17 because I had/wanted to start paying for my own things)

B) when my grandmother finally had enough of his shit and went off on him he said that “I did pay you back because I’ve bought you food and clothes when you stay with me on the weekend” you know, his legal obligation as a parent. 

C) was a dead beat that never payed child support to my grandparents for taking care of me even though the agreement was literally under the table payments so the didn’t drag his ass to court 


D) and for the double whammy of shitty parent lottery my mother never saved for my college like she was supposed to after the divorce and I basically lost out on 20 grand that would have payed like 75% of the loans I have currently and constantly begged me to borrow money(learned my lesson with dear old dad).

At least I could trust my grandparents with their name on my checking account and my taxes. there were a couple times gram wanted to see the statements because she didn’t like some things(I think it was over MTG cards and I wasn’t even spending that much on them) I was spending my money on by I basically told her to fuck off she wasn’t the one working and putting money into it and my decision was accepted and she never asked again. Still got my own account when I moved out though after college."
82,"I’m not them, but password manager software literally generates random strings for your password (you can set length and complexity) and saves them. The manager is opened with a master password, like a master key for a lock. When you need to use the passwords in the manager, you can either use the password manager and C&P or drag and drop or w/e, or just keep the passwords saved in browser (some managers have browser extensions). I use one that has a mobile app, as well. It’s quite a handy thing and better than making all your passwords variations on “umbrella” or something."
83,And C they don't have to move it out
84,"I literally can't even search $AMC on RH right now. Searching $AM is fine but as soon as I add a C I come up with an ""unexpected error"""
85,I have a friend who bought a new Mercedes C class for like 45-55k. He got  7 year loan with a 600$ payment. He justifys it by using to drive Uber every other weekend to pay for it. I really think he's going to get 4 years into this plan and have like 100k miles on his car.
86,"His first mistake was buying a \~50k C class. You can get a well-equipped one for 40k. The only way to hit 50k+ in a C class is to get an AMG or option everything you can click; including carbon trim pieces, painted pieces, wheels, grills, etc."
87,"I bought a 1999 Corolla for $400 and freaking love it. It has all sorts of quirks but the A/C blows cold and the engine runs strong, and it has a relatively new clutch in it (oh yeah, it's a manual too). I work in a well-paid profession and some of the guys at work drive absurdly expensive vehicles. I saw an Aston Martin in the parking lot last Friday. Anyway my point is that if people looked at depreciation as a check they had to write each year, they'd make different choices when buying cars I think."
88,"MSRP on a 2020 C class is $41K, C43 AMG starts around $52K~"
89,"Oh, I'm very aware the 58 cents/mile covers more than gas- I've worked as both a tax preparer, and an independently contracting ""courier"" filing Schedule C's

&#x200B;

> New tires? 750$/80k miles

$750 / 80k miles = 0.94 cents/mile

> Oil change? 40-90$/5k miles 

$50 / 5k miles = 1.0 cents/mile

&#x200B;

My gas cost is $3.50/gal @ 26mpg = 13.5 cents/mile

So, adding in tires and oil changes makes it 15.44 cents/mile, leaving plenty of room to get to my 20 cents a mile estimate (another *$3,648/80k miles to get to 20 cents/mile*, or, more amazingly, *another $34,048/80k miles to get to 58 cents/mile*)"
90,"No one pays MSRP, you can easily get 5-8k off a C class just for walking in the door.

&#x200B;

>C43 AMG starts around $52K\~

I already said AMG. But I doubt he is ubering in his AMG."
91,"FYI, C corps and S corps will be the same with respect to paying yourself and paying payroll taxes.

C corps have double taxation which require more bookkeeping, and doesn't really provide any benefit for a single person corporation. There's a reason 2/3 of small businesses are S corps."
92,"Yeah, safety is huge for me. I don't care if I save $10k off the price of my vehicle if the trade-off is increased risk of harm in an accident. I can always make more money, but I can't restore years to a crash-shortened life.

Edit: [This really says it all](https://www.youtube.com/watch?v=6V6mtTOIgfU&t=11s). That's a 1997 Mercedes C-class vs a 2014 Mercedes C-class. You can look up other comparisons as well, they're all pretty telling."
93,"Yep. Fuck taxi businesses and fuck taxi drivers. As someone who's traveled a lot, the amount of bullshit they pull is unreal. Lying about distance, lying about bus times, lying about safety of other means of getting somewhere, changing the cost after the trip, not running the meter, hiding the meter, running the meter up intentionally by taking a longer route, pretending they don't have change and therefore you should just pay the difference, rejecting rides because of destination, upcharging tourists for a trip that locals have said has a standard price. Literally I've experienced each and every one of these personally, and this as someone who takes cabs as a last resort. F-U-C-K T-A-X-I-S."
94,Big C has brought me mighty profits before. I'll follow that shiny head through the dark. 
95,"The corporate tax cuts are for a C-Corp, the suggesting here is about an S-Corp. "
96,"We don't know what OP actually does, but there may be some serious liability issues that would make it advantageous for a C-Corp. It's easier to pierce the veil of an S-Corp.

With Occupational Health and Safety, I can see liability being a huge issue."
