,0
0,Quest Diagnostics (DGX) Gains From New Alliances Amid FX Woes
1,"Align (ALGN) Gains From New Launches, Strategic Partnerships"
2,Here's Why You Should Retain QIAGEN (QGEN) Stock for Now
3,Baxter's (BAX) New Launch to Enable Earlier Treatment of Eye
4,"Abbott (ABT) Q3 Earnings and Revenues Surpass, Margins Dip"
5,Here's Why You Should Add DaVita (DVA) Stock to Your Portfolio
6,Cardinal Health Named to 100 Best Corporate Citizens of 2023
7,3 Supercharged Dividend Stocks to Buy if There's a Stock Market Sell-Off
8,"STERIS' (STE) Improved Volume, New Buyouts Drive Growth"
9,PetMeds (PETS) to Advance Pet Care With New Collaboration
