,0
0,12 Best Health Insurance Stocks to Buy
1,Chubb (CB) Earnings Expected to Grow: What to Know Ahead of Next Week's Release
2,Analysts Estimate Hope Bancorp (HOPE) to Report a Decline in Earnings: What to Look Out forZacks
3,Earnings Preview: Independent Bank (IBCP) Q3 Earnings Expected to DeclineZacks
4,Best Dividend Aristocrats According to Analysts
5,Will Chubb (CB) Beat Estimates Again in Its Next Earnings Report?
6,Will AutoNation (AN) Beat Estimates Again in Its Next Earnings Report?Zacks
7,Will UPS (UPS) Beat Estimates Again in Its Next Earnings Report?Zacks
8,Here's Why You Should Stay Invested in AXIS Capital (AXS)
9,Here's Why You Should Buy Employers Holdings (EIG) Stock
10,Old Republic (ORI) Stock Rises 10% YTD: More Upside Left?
11,"Kinsale Capital Group, Inc. (KNSL) Hits Fresh High: Is There Still Room to Run?"
12,Here's Why You Should Consider Investing in Kinsale (KNSL)
13,Chubb (NYSE:CB) shareholders have earned a 22% CAGR over the last three years
