,0
0,Is a Beat in Store for CME Group (CME) This Earnings Season?
1,Are You Looking for a Top Momentum Pick? Why CME Group (CME) is a Great ChoiceZacks
2,"CME in 'strongest position' for deals, CEO says, despite rising competitionReuters"
3,Will CBOE (CBOE) Beat Estimates Again in Its Next Earnings Report?
4,Will Copa Holdings (CPA) Beat Estimates Again in Its Next Earnings Report?Zacks
5,"Zacks Industry Outlook Highlights CME Group, Intercontinental Exchange, Cboe Global Markets, Nasdaq and Coinbase GlobalZacks"
6,Cboe Global Markets Announces 2023/2024 Options Institute Academic Research Grant Program with Sponsors S&P Dow Jones Indices and SpiderRock Advisors
7,Cboe Global Markets And S&P Dow Jones Unveil Credit VIX Indices To Gauge Market Volatility
8,"Zacks Industry Outlook Highlights CME Group, Intercontinental Exchange, Cboe Global Markets, Nasdaq and Coinbase Global"
9,The SEC Has a Plan to Save Smaller Brokers. Ban Exchanges’ Volume Discounts.
10,"Nasdaq's (NDAQ) Q3 Earnings Top, Expense View Tightened"
11,5 Securities and Exchanges to Gain From Increased Trading
12,Cboe Europe Derivatives Secures Support of Key Participants for Single Stock Options Launch
13,CBOE (CBOE) Moves to Buy: Rationale Behind the Upgrade
14,Will CBOE (CBOE) Beat Estimates Again in Its Next Earnings Report?Zacks
15,Select Medical (SEM) Upgraded to Strong Buy: What Does It Mean for the Stock?Zacks
