,0
0,CBOE (CBOE) Moves to Buy: Rationale Behind the Upgrade
1,ADM (ADM) Upgraded to Strong Buy: Here's WhyZacks
2,Assurant (AIZ) Upgraded to Strong Buy: Here's What You Should KnowZacks
3,Is Cboe Global Markets (CBOE) Stock Outpacing Its Finance Peers This Year?
4,Cboe Global Markets Announces New Leadership Appointments to Support Continued Global Growth
5,Volatility Insights: Cboe Global Markets (BATS:CBOE) Introduces The Cboe S&P 500 Dispersion Index (DSPX)
6,Cboe Global Markets Reports Trading Volume for September 2023
7,Cboe Global Markets and S&P Dow Jones Indices to Launch New Credit VIX Indices on October 13
8,Cboe Global Markets Announces Date of Third-Quarter 2023 Earnings Release and Conference Call
9,Exotic Stock Trade Beloved by Hedge Funds on Wall Street’s Radar
10,"S&P 500 Options Quirk Mints Billions, Stirring Manipulation Talk"
11,VIX Index’s Lone Rival Faces Extinction With Petition Denied
