,0
0,1 Growth Stock Down 38% to Buy Right Now
1,Cunard Celebrates Six-Month to Debut of New Ship Queen Anne with spectacular New York event
2,Carnival Corporation (CCL) is Attracting Investor Attention: Here is What You Should Know
3,Is Trending Stock Alphabet Inc. (GOOG) a Buy Now?Zacks
4,Wingstop Inc. (WING) Is a Trending Stock: Facts to Know Before Betting on ItZacks
5,Royal Caribbean and Carnival face more Jimmy Buffett competition
6,"Princess Cruises Makes Dramatic Pricing Change, Now Focused on Unprecedented Savings for Early Bookers on Summer 2024 & 2025"
7,"SEABOURN ANNOUNCES NEW AND EXCITING CULINARY EXPERIENCE ""SOLIS"""
8,Is Carnival Stock a Buy After Falling 30% in 3 Months?
9,Where Will Carnival Corporation Stock Be in 5 Years?
10,Princess Cruises Announces Exclusive Partnership with World's Most Famous Butcher Dario Cecchini
11,3 Stocks to Avoid This Week
