,0
0,Constellation to Play Key Role in $1 Billion Clean Hydrogen Hub Awarded by U.S. Department of Energy
1,KeyState Renewables and Monarch Private Capital Close Nearly $100 Million Tax Equity Financing for Pine Gate Renewables’ Kentucky Solar Project
2,Constellation’s Carbon-free Nuclear Fleet Ran at Near 100% Capacity During Hottest Summer on Record
3,Constellation at Climate Week: Nuclear Energy Is Essential to Accelerating the Transition to a Carbon-Free Economy
4,Constellation Inks Deal With Major U.S. Utility for 100 Percent Hourly Carbon-Free Energy Matching
5,Constellation Earns 2023 Great Place to Work Certification
6,Constellation to File Comments Offering Support for New EPA Guidelines to Reduce Carbon Emissions From Power Plants
7,Constellation Reports Second Quarter 2023 Results
8,Constellation Energy Corporation Declares Dividend
9,Constellation Accepting Applications for 2023 Energy to Educate Grant Program
