,0
0,12 Best Clean Laundry Detergent Brands
1,"Walmart, Costco Stocks Lower as Consumer Staples Shares Wilt to End Week"
2,"Clorox (CLX) Unveils Preliminary Q1 Results, Hurt by Cyber Attack"
3,Church & Dwight to Webcast Discussion of Third Quarter 2023 Earnings Results on November 3
4,"P&G (PG) Gains From Solid Product Portfolio, Pricing Actions"
5,"Estimating The Intrinsic Value Of Church & Dwight Co., Inc. (NYSE:CHD)"
6,"Church & Dwight Issues National Recall of One Specific Lot of TheraBreath Strawberry Splash for Kids 16oz Sold Exclusively on Amazon Between May 31 and September 02, 2023, due to microbial contamination identified as yeast (Candida parapsilosis)."
7,Church & Dwight (CHD) Thrives on Solid Brands & Pricing
8,"Church & Dwight Initiates Voluntary Recall of One Specific Lot of TheraBreath Strawberry Splash for Kids 16oz Sold Exclusively on Amazon Between May 31 and September 02, 2023, due to an Isolated Manufacturing Issue"
9,"Church & Dwight Stock Clears Technical Benchmark, Hitting 80-Plus RS Rating"
