,0
0,How the NBA Plans to Remake Its TV Deals and Score Billions for Its Stars
1,"Ad sales for Paris Olympics pace ahead of previous Games, NBCUniversal says"
2,Comcast and Broadcom to Develop the World’s First AI-Powered Access Network With Pioneering New Chipset
3,Comcast NBCUniversal LIFT Labs Selects 10 Startups for Accelerator on Emerging Enterprise AI Solutions
4,Comcast (CMCSA) to Deploy DOCSIS 4.0 Technology in Colorado
5,Comcast Central Division Appoints Javier Garcia Senior Vice President of Competitive Marketing and Strategy
6,Why Investors Need to Take Advantage of These 2 Consumer Discretionary Stocks Now
7,"Comcast Expands Broadband Network to Pelahatchie, Mississippi"
8,12 Best Dividend Stocks For Passive Income
9,Stock Market Today: Dow falls as rising yields return to put squeeze on stocks
