,0
0,New Discovery Education and Comcast Study Highlights Opportunity for United States Schools to Help Students Overcome Digital Divide
1,Charter Communications (CHTR) Reports Next Week: Wall Street Expects Earnings Growth
2,Chevron (CVX) Expected to Beat Earnings Estimates: Should You Buy?Zacks
3,Analysts Estimate Dana (DAN) to Report a Decline in Earnings: What to Look Out forZacks
4,Netflix Thrived Despite Hollywood Tensions
5,"FCC Revives ‘Net Neutrality,’ Proposes New Regulations for Internet Service"
6,Christine Whitaker Named One of Atlanta Business Chronicle’s Women of Influence
7,COMCAST LAUNCHES LIVE AMERICAN SIGN LANGUAGE INTERPRETING SERVICES AT SIX GREATER PHILADELPHIA XFINITY STORE LOCATIONS
8,Earnings Preview: Comcast (CMCSA) Q3 Earnings Expected to Decline
9,Earnings Preview: Arch Resources (ARCH) Q3 Earnings Expected to DeclineZacks
10,Earnings Preview: Hub Group (HUBG) Q3 Earnings Expected to DeclineZacks
11,Mediacom Communications Partners With Xumo to Bring Xumo Stream Box to Its Broadband Customers
12,"Comcast California Pledges $100,000 in Scholarships to Five Central Valley Community Colleges"
13,Comcast (CMCSA) Stock Moves -0.77%: What You Should Know
