,0
0,Are Finance Stocks Lagging  Fidelity National Financial (FNF) This Year?
1,3 Crypto Stocks to Buy as Bitcoin Attempts Another Rebound
2,"CME Group T-Bill Futures Surpass 6,000 Contracts in First Week of Trading"
3,Unveiling the Investment Potential of CME Group Inc (CME): A Comprehensive Analysis of ...
4,CME Group Reports Sixth Consecutive Record Quarter for Aluminum Futures Volume
5,2 Top Financial Services Stocks to Buy in October
6,CME Head Duffy Warns New Taxes Threaten Chicago’s Recovery
7,BrokerTec Introduces Repo Trading as a Spread to €STR
8,Weakening crop prices and high production costs weigh on farmer sentiment
9,CME Group Reports Second-Highest September and Q3 ADV on Record
