,0
0,CMS Energy to Announce 2023 Third Quarter Results on October 26
1,CMS Energy (CMS) to Transform Coal Farm Into 85 MW Solar Project
2,Consumers Energy Continues Clean Energy Transition with Plans for Solar Project at Former Coal Plant Location
3,Myrna Soto Joins Huntress’ Board of Directors
4,Top 20 Renewable Energy Companies in USA by Revenue
5,CenterPoint (CNP) Rewards Shareholders With a 5.3% Dividend Hike
6,Do Options Traders Know Something About CenterPoint Energy (CNP) Stock We Don't?Zacks
7,Lockheed (LMT) Rewards Shareholders With a 5% Dividend HikeZacks
8,Are You a Value Investor? This 1 Stock Could Be the Perfect Pick
9,Here's Why Hewlett Packard Enterprise (HPE) is a Strong Value StockZacks
10,Why This 1 Value Stock Could Be a Great Addition to Your PortfolioZacks
11,Returns On Capital Signal Tricky Times Ahead For CMS Energy (NYSE:CMS)
12,"Consumers Energy Proposes Renewable Energy Offerings, Providing Greater Access and Affordability to Michiganders"
13,"Senior Vice President Brandon Hofmeister Sells 1,667 Shares of CMS Energy Corp"
