,0
0,CNP or SO: Which Is the Better Value Stock Right Now?
1,Reasons to Add CenterPoint (CNP) to Your Portfolio Right Now
2,"Zacks.com featured highlights include e.l.f. Beauty, Parker-Hannifin, Frontdoor, Patterson-UTI Energy and CenterPoint Energy"
3,Bet on 5 Top-Ranked Stocks With Upgraded Broker Ratings
4,Do Options Traders Know Something About CenterPoint Energy (CNP) Stock We Don't?
5,CenterPoint Energy's (NYSE:CNP) Upcoming Dividend Will Be Larger Than Last Year's
6,5 Stocks to Watch on Recent Dividend Hikes Amid Volatility
7,Unveiling CenterPoint Energy (CNP)'s Value: Is It Really Priced Right? A Comprehensive Guide
8,CenterPoint Energy Appoints New Board Members Thaddeus J. Malik and Ricky A. Raven
9,"CenterPoint Energy, Inc. to Host Webcast of Third Quarter 2023 Earnings Conference Call"
