,0
0,Unearthing The Cooper (COO)'s True Worth: A Comprehensive Examination of Its Market Value
1,Reasons to Retain The Cooper Companies (COO) in Your Portfolio
2,Unveiling the Investment Potential of The Cooper Companies Inc (COO): A Comprehensive Analysis ...
3,CooperCompanies Announces Transfer of Stock Exchange Listing to Nasdaq
4,CooperCompanies to Present at the Baird Healthcare Conference
5,Cord Blood Registry® Announces Thought Leadership Role at Cord Blood Connect
6,"Calculating The Fair Value Of The Cooper Companies, Inc. (NYSE:COO)"
7,Unveiling The Cooper (COO)'s Value: Is It Really Priced Right? A Comprehensive Guide
8,"The Cooper Companies, Inc. (NYSE:COO) Q3 2023 Earnings Call Transcript"
9,"Cooper Companies (COO) Q3 Earnings In Line, '23 Outlook Raised"
