,0
0,"Robust Snacks Unit Aids Campbell Soup (CPB), Costs Woes Hurt"
1,Sovos Brands Stockholders Vote to Approve Acquisition by Campbell
2,Why Campbell Soup Company (NYSE:CPB) Looks Like A Quality Company
3,Surge in obesity drugs like Ozempic has pummeled big food stocks. Is it time to eat them up?
4,Unveiling the Dividend Performance of Campbell Soup Co (CPB)
5,Insider Trouble: 3 Stocks to Exit ASAP
6,13 Cheap Stocks to Buy Today According to Media
7,Ticking Time Bombs: 3 Blue-Chip Stocks to Dump Before the Damage Is Done
8,Campbell Soup (CPB) Benefits From Savings Plan Amid High Costs
9,Campbell Soup (NYSE:CPB) Has Affirmed Its Dividend Of $0.37
