,0
0,5 Safe Stocks to Buy Amid Plummeting U.S. Consumer Sentiment
1,This Pennsylvania trio bought an abandoned school for a $100K and turned it into a packed 31-unit apartment complex — how to invest in residential real estate without all the heavy lifting
2,Camden Property Trust Announces Third Quarter 2023 Earnings Release and Conference Call Dates
3,"Buy This, Not That: 2 Dividend Stocks to Own, 1 to Avoid"
4,Deep Dive: Analyzing the Dividend Performance of Camden Property Trust (CPT)
5,3 Top-Ranked Dividend Stocks: A Smarter Way to Boost Your Retirement Income
6,This Dividend Stock Is Slowing Down to Cruising Speed
7,Camden Property Trust Announces Third Quarter 2023 Dividend
8,Camden Property Trust Announces Participation in BofA Securities 2023 Global Real Estate Conference and Provides Third Quarter 2023 Operating Update
9,America Is A Nation On The Move. Here's How Investors Can Profit From It
