,0
0,"Salesforce Stock Sees Its Composite Rating Rise A Bit More, To 96"
1,Investors Heavily Search Salesforce Inc. (CRM): Here is What You Need to Know
2,Earnings Estimates Moving Higher for APA (APA): Time to Buy?Zacks
3,Earnings Estimates Moving Higher for Hess (HES): Time to Buy?Zacks
4,"Insider Sell: Salesforce Inc's President and CFO Amy Weaver Sells 2,627 Shares"
5,20 States that Drink the Least Alcohol per Capita
6,Insider Sell: Salesforce Inc's President and Chief Engineering Officer Srinivas Tallapragada ...
7,Salesforce.com (CRM) Ascends While Market Falls: Some Facts to Note
8,Jim Cramer’s 10 Best AI Stocks
9,"The Zacks Analyst Blog Highlights Adobe, Salesforce, Workday and Technology Select Sector SPDR"
10,A Look Back at Sales Software Stocks' Q2 Earnings: Freshworks (NASDAQ:FRSH) Vs The Rest Of The Pack
11,14 Best SaaS Stocks To Buy Now
