,0
0,"Intuitive Surgical, WD-40, CSX Corp.: After-hours movers"
1,CSX Corporation (NASDAQ:CSX) Q3 2023 Earnings Call Transcript
2,"CSX Q3 Earnings In Line With Estimates, Revenues Surpass"
3,Third-quarter net earnings slip 24% at CSXFreightWaves
4,CSX (CSX) Matches Q3 Earnings EstimatesZacks
5,"CSX COO says internal, industry collaboration key to capitalize on opportunities"
6,5 Things to Know Before Markets Open
7,"These Stocks Are Moving the Most Today: SolarEdge, Enphase, American Express, Regions, Knight-Swift, HPE, and MoreBarrons.com"
8,"SolarEdge Slashes Its Guidance as Demand in Europe Slows, and Shares PlungeInvestopedia"
9,Q3 2023 CSX Corp Earnings Call
10,Third-quarter net earnings slip 24% at CSX
11,"CSX Q3 Earnings In Line With Estimates, Revenues SurpassZacks"
12,CSX (CSX) Matches Q3 Earnings EstimatesZacks
13,CSX Corp (CSX) Q3 2023 Earnings: Operating Income Drops to $1.3 Billion
14,Third-quarter net earnings slip 24% at CSXFreightWaves
15,CSX (CSX) Q3 Earnings: How Key Metrics Compare to Wall Street EstimatesZacks
16,Union Pacific Stock Rises Despite Profit Decline; CSX Shares Slide
17,CSX Corp profit misses Wall Street estimates on weak freight volumes
