,0
0,"US Steel (X), DuPont Launch COASTALUME for Coastal Environment"
1,DuPont Announces Regular Quarterly Dividend on Common Stock
2,"DuPont introduces higher-adhesion, low-cyclics silicone soft skin adhesive"
3,"U. S. Steel and DuPont Launch COASTALUME™ Product, North America's First GALVALUME® Solution Engineered and Warrantied for Coastal Environments"
4,"U. S. Steel and DuPont™ Launch COASTALUME™ Product, North America’s First GALVALUME® Solution Engineered and Warrantied for Coastal Environments"
5,Make Use of DuPont Analysis & Pick 5 Top Stocks
6,DuPont de Nemours' (NYSE:DD) investors will be pleased with their 2.6% return over the last five years
7,Carlsberg Wins Global Industrial Water Reuse Award Using DuPont Technology
8,"Is DuPont de Nemours, Inc. (NYSE:DD) Trading At A 25% Discount?"
9,"Zacks.com featured highlights Lifeway, EMCOR, Super Micro Computer, Group 1 Automotive and PBF Energy"
