,0
0,DuPont Announces Regular Quarterly Dividend on Common Stock
1,"DuPont introduces higher-adhesion, low-cyclics silicone soft skin adhesive"
2,"U. S. Steel and DuPont Launch COASTALUME™ Product, North America's First GALVALUME® Solution Engineered and Warrantied for Coastal Environments"
3,"U. S. Steel and DuPont™ Launch COASTALUME™ Product, North America’s First GALVALUME® Solution Engineered and Warrantied for Coastal Environments"
4,Make Use of DuPont Analysis & Pick 5 Top Stocks
5,DuPont de Nemours' (NYSE:DD) investors will be pleased with their 2.6% return over the last five years
6,Carlsberg Wins Global Industrial Water Reuse Award Using DuPont Technology
7,"Is DuPont de Nemours, Inc. (NYSE:DD) Trading At A 25% Discount?"
8,"Zacks.com featured highlights Lifeway, EMCOR, Super Micro Computer, Group 1 Automotive and PBF Energy"
9,Unveiling DuPont de Nemours (DD)'s Value: Is It Really Priced Right? A Comprehensive Guide
