,0
0,12 Best Stocks to Buy and Hold According to Bill Gates’ Portfolio
1,Here's Why We Think Deere (NYSE:DE) Is Well Worth Watching
2,"The Zacks Analyst Blog Highlights Adobe, Deere, American Express, Broadcom and Sony"
3,Deere (DE) Stock Moves -0.42%: What You Should Know
4,"Top Stock Reports for Adobe, Deere & American Express"
5,Bill Gates’ Investment Company’s 10 Newest Stock Picks
6,Deere (DE) Declines More Than Market: Some Information for Investors
7,3 Anti-AI Stocks for Old-Fashioned Investors
8,1 Hot Growth Stock to Buy Hand Over Fist
9,3 Stocks That Can Help Build Generational Wealth for Patient Investors
