,0
0,Regional banks still have a profitability problem
1,Discover Financial Services (NYSE:DFS) Q3 2023 Earnings Call Transcript
2,Q3 2023 Discover Financial Services Earnings Call
3,Markets Waver at Midday as Fed Chair Powell Says Inflation 'Is Still Too High'
4,Discover Financial (DFS) Q3 Earnings Miss on Higher Expenses
5,Discover Financial Is On a Path to the Downside
6,Discover Profit Tumbles 33% as Credit-Card Write-Offs Mount
7,Discover Financial Services (DFS) Reports Q3 2023 Earnings: Net Income of $683 Million
8,Discover Financial Services Reports Third Quarter 2023 Net Income of $683 Million or $2.59 Per Diluted Share
9,Can Rising Costs Hurt Discover Financial's (DFS) Q3 Earnings?
10,Can Lower Transactions Affect Western Union's (WU) Q3 Earnings?Zacks
11,Discover Financial (DFS) Q3 Earnings Miss on Higher ExpensesZacks
