,0
0,Disney attorneys want to question former administrator in lawsuit with DeSantis appointees
1,"Amazon Stock (AMZN) Quotes, Company News And Chart Analysis"
2,"This Successful Executive Is Sounding the Alarm on Consumer Spending, and These 2 Popular Consumer Stocks Could Be Making a Big Mistake"
3,Disney World Just Made Some Big Price Changes -- Here's What You Need to Know
4,Walt Disney (DIS) Exceeds Market Returns: Some Facts to Consider
5,Disney Is 100 Now. How Magical Has the Stock’s Performance Been?
6,Disney's plans for ESPN are becoming more clear
7,Disney turns 100. Here’s a look back at price changes over the years—including the $1 ticket when Disneyland opened in 1955
8,Disney (DIS) Teams Up With TikTok to Celebrate 100 Years
9,Disney turns 100 as CEO Bob Iger tries to fix media giant
