,0
0,Is Digital Realty Trust Stock a Buy Now?
1,Digital Realty Schedules Third Quarter 2023 Earnings Release and Conference Call
2,Digital Realty (DLR) Up 26.8% in 6 Months: Will the Trend Last?
3,Unveiling Digital Realty Trust (DLR)'s Value: Is It Really Priced Right? A Comprehensive Guide
4,Don’t Miss the Boom: 7 AI Stocks Set to Explode Higher
5,Digital Realty (DLR) to Offer Access to Oracle EU Sovereign Cloud
6,3 REITs with a Front-Row Seat to the Tech Growth Boom
7,Digital Realty To Provide Seamless Access to Oracle EU Sovereign Cloud
8,Digital Realty Ranks No. 9 on EPA's National Top 100 List of Green Power Users
9,Unveiling the Dividend Story of Digital Realty Trust Inc
