,0
0,4 Good Reasons to Shop at Dollar Stores
1,I’m a Self-Made Millionaire: 7 Items I’ll Only Buy at Dollar Tree
2,I’m a Former Dollar Tree Employee: Here Are 5 Inside Secrets You Should Know
3,Dollar General Stock Is Rebounding: Time to Buy Shares?
4,Move Over Dollar Tree: Here Are 5 Up-and-Coming Discount Stores You Need To Check Out Now
5,Assessing the Ownership Landscape of Dollar Tree Inc(DLTR)
6,20 Best New Items Available at Dollar Tree for Halloween 2023
7,"Bank of NY Mellon, Dollar Tree, VF Corp: Trending Stocks"
8,Unveiling Dollar Tree (DLTR)'s Value: Is It Really Priced Right? A Comprehensive Guide
9,"Dollar Tree, Tesla recall, Nvidia and chip stocks: Trending Tickers"
