,0
0,Caldera Launches VisualRIP Subscription for Large Format Digital Printing
1,Dover (DOV) to Report Q3 Earnings: What's in the Offing?
2,Dover Corporation (DOV) Earnings Expected to Grow: What to Know Ahead of Next Week's Release
3,Dover (DOV) to Report Q3 Earnings: What's in the Offing?Zacks
4,Dow Inc. (DOW) Expected to Beat Earnings Estimates: Can the Stock Move Higher?Zacks
5,"Dover Fueling Solutions Launches DX Promote Auto, a New Industry-Leading Managed Media Service"
6,Best Dividend Aristocrats According to Analysts
7,CDS Visual Wins 2023 SaaS Award
8,Dover (DOV) Inks $680M Contract to Sell DESTACO Business
9,Germany's Stabilus to buy Dover's business unit for $680 mln
10,Dover to Sell DESTACO Business Unit
11,Hillphoenix Earns EPA GreenChill Store Certification Excellence Award for 12th Consecutive Year
