,0
0,"Duke Energy, Tampa Bay Rays Collab Raises $100,000 To Help Florida Customers Pay Their Energy Bills"
1,Duke Energy (DUK) Stock Moves -0.46%: What You Should Know
2,"Duke Energy's 2023 Site Readiness Program helps prepare business, industrial sites in an effort to spark economic growth in Florida"
3,"With 64% institutional ownership, Duke Energy Corporation (NYSE:DUK) is a favorite amongst the big guns"
4,"Duke Energy Progress Receives Approval for New Rates in North Carolina, Implements New Programs To Help Customers"
5,"Duke Energy Foundation Delivers Bright Futures for Hispanic Students With $75,000 Grant to Hispanic Heritage Scholarship Fund"
6,Duke Energy Florida plans to further reduce customer bills in 2024
7,"Duke Energy line technique, talent shine bright as lineworkers capture four awards at International Lineman's Rodeo"
8,Duke Energy (DUK) Advances While Market Declines: Some Information for Investors
9,"Duke Energy Florida, One Tree Planted collaboration encourages customers to support clean energy, restoration efforts through company's community solar program"
