,0
0,Health Insurer Elevance Earnings Beat Wall Street Estimates
1,Elevance Health (ELV) Q3 Earnings Top Estimates
2,Ally Financial (ALLY) Q3 Earnings Beat EstimatesZacks
3,Johnson & Johnson (JNJ) Q3 Earnings and Revenues Surpass EstimatesZacks
4,"UPDATE 3-Health insurer Elevance books $700 mln charge on job cuts, office closures"
5,Elevance Health Reports Third Quarter 2023 Results
6,12 Best Health Insurance Stocks to Buy
7,"Insiders At Elevance Health Sold US$1.2m In Stock, Alluding To Potential Weakness"
8,Why This 1 Momentum Stock Could Be a Great Addition to Your Portfolio
9,Why This 1 Value Stock Could Be a Great Addition to Your PortfolioZacks
10,Are You a Momentum Investor? This 1 Stock Could Be the Perfect PickZacks
11,Badger Meter (BMI) to Post Q3 Earnings: Key Factors to Note
12,Why Earnings Season Could Be Great for Badger Meter (BMI)Zacks
13,Why Badger Meter (BMI) Could Beat Earnings Estimates AgainZacks
14,Factors to Note Ahead of Iridium's (IRDM) Q3 Earnings Release
15,Is a Surprise Coming for Elevance Health (ELV) This Earnings Season?
16,Elevance Health (ELV) Q3 Earnings Top EstimatesZacks
17,Why AT&T (T) Might Surprise This Earnings SeasonZacks
