,0
0,EPAM Announces Date for Third Quarter 2023 Earnings Release and Conference Call
1,EPAM Systems Inc (EPAM): A Deep Dive into Financial Metrics and Competitive Strengths
2,EPAM Systems (EPAM)'s Hidden Bargain: An In-Depth Look at the 25% Margin of Safety Based on its ...
3,EPAM Named as a Top IT Sourcing Vendor in Switzerland
4,EPAM Expands Partnership with Microsoft - Becomes Globally Managed Enterprise Systems Integrator
5,"Estimating The Intrinsic Value Of EPAM Systems, Inc. (NYSE:EPAM)"
6,Can S&P 500 Keep Up Its Winning Momentum? Stock Picks
7,3 S&P 500 Stocks to Sell Before a Crash
8,EPAM Wins 2023 Google Cloud Social Impact Partner of the Year Award in North America
9,EPAM Systems: A Significantly Undervalued Tech Gem?
