,0
0,Earnings Preview: EQT Corporation (EQT) Q3 Earnings Expected to Decline
1,Earnings Preview: South State (SSB) Q3 Earnings Expected to DeclineZacks
2,Coastal Financial Corporation (CCB) to Report Q3 Results: Wall Street Expects Earnings GrowthZacks
3,Unveiling EQT (EQT)'s Value: Is It Really Priced Right? A Comprehensive Guide
4,EQT Increases Base Dividend by Five Percent
5,"EQT (NYSE:EQT) delivers shareholders strong 44% CAGR over 3 years, surging 5.4% in the last week alone"
6,EQT Schedules Third Quarter 2023 Earnings Release and Conference Call
7,Unveiling EQT Corp's True Worth: Is It Really Priced Right? A Comprehensive Guide
8,13 Best American Energy Stocks To Buy Now
9,"EQT, Commonwealth Enter Into a 15-year Tolling LNG Agreement"
10,EQT Announces Tolling Agreement with Commonwealth LNG
11,EQT Corporation (EQT) Stock Price Rebounded in Q2
