,0
0,Looking for Safe Income? This Stock Raised Its Dividend in the Last 3 Recessions.
1,NXRT or ESS: Which Is the Better Value Stock Right Now?
2,Essex Announces Release and Conference Call Dates for Its Third Quarter 2023 Earnings
3,Dividend Aristocrats Ranked By Yield: Top 25
4,Essex Property Trust Inc: A Detailed Analysis of Dividend Performance and Sustainability
5,Don’t Miss the Boom: 7 Dividend Stocks Set to Explode Higher
6,One State Is All It Takes for This Dividend Stock to Excel
7,Unveiling Essex Property Trust (ESS)'s Value: Is It Really Priced Right? A Comprehensive Guide
8,4 big analyst cuts: Polestar Automotive slashed at Barclays as demand weakens
9,Essex Property Trust to Present at The Bank of America Global Real Estate Conference 2023
