,0
0,Eaton’s Focus on “Unleashing the Power of Diverse Perspectives” Highlighted in New Report
1,"Eaton to Announce Third Quarter 2023 Earnings on October 31, 2023"
2,Should You Hold Eaton Corporation (ETN)?
3,"Zacks Industry Outlook Highlights Eaton Corporation, A. O. Smith and EnerSys"
4,3 Manufacturing Electronics Stocks to Gain From Improving Supply Chains
5,Here's Why Investors Should Retain Kennametal (KMT) Stock Now
6,General Electric's (GE) Unit Signs MOC With Ukrhydroenergo
7,"Eaton names Adam Wadecki senior vice president, Internal Audit"
8,Here's Why It Is Worth Investing in Applied Industrial (AIT)
