,0
0,"Eaton to Announce Third Quarter 2023 Earnings on October 31, 2023"
1,Should You Hold Eaton Corporation (ETN)?
2,"Zacks Industry Outlook Highlights Eaton Corporation, A. O. Smith and EnerSys"
3,3 Manufacturing Electronics Stocks to Gain From Improving Supply Chains
4,Here's Why Investors Should Retain Kennametal (KMT) Stock Now
5,General Electric's (GE) Unit Signs MOC With Ukrhydroenergo
6,"Eaton names Adam Wadecki senior vice president, Internal Audit"
7,Here's Why It Is Worth Investing in Applied Industrial (AIT)
8,General Electric (GE) Upgrades Qairokkum Plant in Tajikistan
9,General Electric (GE) Unit Wins Transformer Deal in Germany
