,0
0,Entergy Louisiana Partners With City To Bring Eco-Friendly Transportation to West Monroe
1,"New Customers, Florida Economy to Aid NextEra (NEE) Q3 Earnings"
2,What's in Store for NextEra Energy Partners (NEP) in Q3 Earnings?Zacks
3,Analysts Estimate NextEra Energy Partners (NEP) to Report a Decline in Earnings: What to Look Out forZacks
4,"Entergy Mississippi Supports Arts, Education and Economic Development With Two Major Gifts"
5,"City, Entergy New Orleans Complete Final Installation of Level 2 Public EV Charging Program"
6,An Intrinsic Calculation For Entergy Corporation (NYSE:ETR) Suggests It's 20% Undervalued
7,Entergy Celebrates Educators and Invests $2.2 Million in the Future of Students at the Fried Chicken Festival
8,Utility stocks are on sale; here are Morningstar's top 3 picks
9,Paying It Forward to the Next Generation
10,"Hancock Whitney, Entergy Announce New Relationship To Expand Business Resources to Diverse Business"
11,"Exelon's (EXC) ComEd, Millennium Garages to Add 300 EV Chargers"
