,0
0,Why Entergy (ETR) is a Top Value Stock for the Long-Term
1,Why CenterPoint Energy (CNP) is a Top Value Stock for the Long-TermZacks
2,Here's Why Molina (MOH) is a Strong Value StockZacks
3,Entergy Louisiana Partners With City To Bring Eco-Friendly Transportation to West Monroe
4,"New Customers, Florida Economy to Aid NextEra (NEE) Q3 Earnings"
5,"Entergy Mississippi Supports Arts, Education and Economic Development With Two Major Gifts"
6,"City, Entergy New Orleans Complete Final Installation of Level 2 Public EV Charging Program"
7,An Intrinsic Calculation For Entergy Corporation (NYSE:ETR) Suggests It's 20% Undervalued
8,Entergy Celebrates Educators and Invests $2.2 Million in the Future of Students at the Fried Chicken Festival
9,Utility stocks are on sale; here are Morningstar's top 3 picks
10,Paying It Forward to the Next Generation
11,"Hancock Whitney, Entergy Announce New Relationship To Expand Business Resources to Diverse Business"
