,0
0,"ComEd Hosts Over 2,000 High Schoolers from Northern Illinois to Discover Careers in Energy"
1,ComEd Customers to Benefit from $50M DOE Grant to Increase Power Grid Reliability and Resiliency in Rockford
2,HE vs. EXC: Which Stock Is the Better Value Option?
3,ComEd and SunVest Activate Community Solar Farms in Dekalb and Freeport
4,Rooftop Solar Adoption Accelerating in ComEd Service Territory
5,"You Can't Control Dividend Cuts, but You Can Control What You Do About Them"
6,"Exelon's (EXC) ComEd, Millennium Garages to Add 300 EV Chargers"
7,"ComEd, Millennium Garages Announce Plans For 300 EV Chargers by 2026, Expanding Midwest's Largest Public EV Charging Hub"
8,ComEd Encouraging 75 Latino Students to Pursue Careers in STEM During ComEd STEM Labs
9,Top 20 Renewable Energy Companies in USA by Revenue
