,0
0,Don’t Buy Airline Tickets on Fridays – Here’s Why
1,US fintech Plaid hires first chief financial officer on road to potential IPO
2,Expedia Group uncovers top desired locations for Canadian sports fans and how much they spend to see their teams on the road
3,"With EPS Growth And More, Expedia Group (NASDAQ:EXPE) Makes An Interesting Case"
4,Saving Money With AI: 4 Ways To Use ChatGPT To Find the Cheapest Airline Tickets
5,16 Best Vacations for Seniors with Limited Mobility
6,Expedia (EXPE) Falls More Steeply Than Broader Market: What Investors Need to Know
7,"Expedia Group to Webcast Third Quarter 2023 Results on November 2, 2023"
8,Expedia CEO says customers claim to be worried about climate change. But he isn’t seeing changes in their travel behavior
9,Will Expedia (EXPE) be Able to Create Long-Term Shareholder Value?
