,0
0,History Suggests This Unheralded S&P 500 Dividend Stock Is a No-Brainer to Buy and Hold Forever
1,FactSet (FDS) Rises 11% Year to Date: Here's What to Know
2,2 Top Financial Services Stocks to Buy in October
3,Ad Platform AdMarketplace Expanding NYC HQ With 90 Park Avenue Sublease
4,"FactSet Research Systems Inc CTO Katherine Stepp Sells 1,805 Shares"
5,Reasons to Hold FactSet (FDS) Stock in Your Portfolio Now
6,FactSet Research Systems Inc. (NYSE:FDS) Q4 2023 Earnings Call Transcript
7,FactSet and Irwin Announce Partnership to Deliver Best-in-Class Solution for Investor Relations Professionals
8,FactSet Research Systems Inc (FDS): A Deep Dive into Financial Metrics and Competitive Strengths
9,"FactSet (FDS) Q4 Earnings Miss Estimates, Revenues Surpass"
