,0
0,"Marvell, F5 and Arm Collaborate to Enable First Open Programmable Infrastructure Project Demonstration at 2023 OCP Global Summit"
1,CHGG or FFIV: Which Is the Better Value Stock Right Now?
2,"Insider Sell: Francois Locoh-Donou Sells 2,200 Shares of F5 Inc"
3,F5 Adds Michel Combes to Board of Directors
4,F5 to Report Fourth Quarter and Fiscal Year 2023 Financial Results
5,F5 (FFIV) Moves to Buy: Rationale Behind the Upgrade
6,ADM (ADM) Upgraded to Strong Buy: Here's WhyZacks
7,All You Need to Know About Health Catalyst (HCAT) Rating Upgrade to Strong BuyZacks
8,F5 Provides Cost and Performance Enhancing Technology in Support of Open Source Telemetry Project
9,F5 to Participate in the 2023 Piper Sandler Growth Frontiers Conference
10,Paypal (PYPL) Down 2.6% Since Last Earnings Report: Can It Rebound?
11,Aspen Technology (AZPN) Down 1.4% Since Last Earnings Report: Can It Rebound?
