,0
0,Sitting on Cash? These 2 Stocks Are Great Buys.
1,11 Best Green Stocks To Invest In 2023
2,Analysts Estimate 3M (MMM) to Report a Decline in Earnings: What to Look Out for
3,Dow Inc. (DOW) Expected to Beat Earnings Estimates: Can the Stock Move Higher?Zacks
4,Sherwin-Williams (SHW) Expected to Beat Earnings Estimates: Can the Stock Move Higher?Zacks
5,General Electric: Showing Signs of Promising Progress
6,Can General Electric (GE) Q3 Earnings Beat on Aerospace Boost?
7,Will Increasing Expenses Dent IDEX's (IEX) Q3 Earnings?Zacks
8,What's in Store for Canadian National (CNI) in Q3 Earnings?Zacks
9,General Electric (NYSE:GE) shareholders have earned a 34% CAGR over the last three years
10,General Electric (GE) Commissions Turbine Units in Nigeria
11,7 Top Tech Stocks To Get Behind for Q4
12,General Electric (GE) Unit Wins Gas Turbine Order in China
13,What's Gone Wrong With Defense Stocks in 2023 (and Why They Could Be Buys Now)
