,0
0,Gilead Sciences: Leading With Passion and Purpose: Sandra’s Story
1,Gilead and Assembly Biosciences Establish Partnership to Develop Next-Generation Therapeutics for Serious Viral Diseases
2,Gilead Sciences (GILD) Beats Stock Market Upswing: What Investors Need to Know
3,Jim Simons Stock Portfolio: Top 10 Stock Picks
4,Gilead and Kite Oncology Present Important New Data Across Multiple Difficult-to-Treat Cancers at ESMO Congress 2023
5,Gilead Demonstrates the Impact of Global Collaboration in Advancing HIV Research and Health Equity at EACS 2023
6,2 Dirt Cheap High-Yield Dividend Stocks to Buy Right Now
7,"Gilead Sciences to Release Third Quarter 2023 Financial Results on Tuesday, November 7, 2023"
8,Global CAR T-cell Therapy Market Projected to Reach $83 Billion by 2032
9,"AQR Capital Management: AUM, Performance, Stock Picks"
