,0
0,Institutional owners may consider drastic measures as General Motors Company's (NYSE:GM) recent US$1.4b drop adds to long-term losses
1,"Automakers Raise Wage Offers to 23%, UAW Now Demands More"
2,General Motors raises offer to autoworkers union ahead of UAW bargaining updateAssociated Press Finance
3,GM matches Ford's wage hike to UAW in bid to end US auto strikeReuters
4,TIMELINE-GM presents revised offer to UAW with 23% general wage increase
5,UPDATE 7-GM matches Ford's wage hike to UAW in bid to end US auto strike
6,Is General Motors Co (GM) Too Good to Be True? A Comprehensive Analysis of a Potential Value Trap
7,General Motors Company (GM) is Attracting Investor Attention: Here is What You Should Know
8,Ford Motor Company (F) Is a Trending Stock: Facts to Know Before Betting on ItZacks
9,"Meta Platforms, Inc. (META) is Attracting Investor Attention: Here is What You Should KnowZacks"
10,"Tesla, Ford, and GM struggle amid 'unrealistic' demand expectations for EV trucks"
11,Elon Musk Says Tesla 'Dug Its Own Grave' with CybertruckIEN
12,Elon Musk wants to ‘temper expectations’ on Tesla Cybertruck; thinks it’s ‘our best product ever’Fox Business
13,Even Tesla Needs To Tone Down Its EV Ambitions
14,11 Best Battery Stocks To Buy Heading into 2024
15,Auto giant pausing plant production on this new vehicle line
