,0
0,Generac Announces Third Quarter 2023 Earnings Release Date and Conference Call
1,Here's Why Generac Holdings (GNRC) Fell More Than Broader Market
2,Introducing ecobee Smart Doorbell Camera: Sees What Others Can’t
3,Generac Holdings (GNRC) Rises But Trails Market: What Investors Should Know
4,Unveiling Generac Holdings' (GNRC) True Worth: Is It Really Priced Right? A Comprehensive Guide
5,Generac Holdings Inc.'s (NYSE:GNRC) Stock Has Shown Weakness Lately But Financial Prospects Look Decent: Is The Market Wrong?
6,15 Michael Burry Stocks Other Hedge Funds Like Most
7,Generac Holdings (GNRC) Stock Dips While Market Gains: Key Facts
8,"Generac Holdings Inc CEO Aaron Jagdfeld Sells 5,000 Shares"
9,"Occidental Petroleum, Palantir, Generac: Top Tickers"
