,0
0,Morgan Stanley's profit drops on Wall Street slowdown
1,'I’ve never felt more optimistic' about Goldman Sachs: CEO SolomonYahoo Finance
2,Goldman's profit declines amid costly retreat from consumer bankingYahoo Finance
3,"Earnings preview: Tesla, Netflix, big banks among reports to watch"
4,Accrete AI Honored by Goldman Sachs for Entrepreneurship
5,"The Goldman Sachs Group, Inc. (NYSE:GS) Q3 2023 Earnings Call Transcript"
6,Goldman Sachs (GS) Q3 Earnings and Revenues Beat EstimatesZacks
7,'I’ve never felt more optimistic' about Goldman Sachs: CEO SolomonYahoo Finance
8,Goldman Joins Post-Earnings Bank Bond Spree With Debt Sale
9,Zero Hash Honored by Goldman Sachs for Entrepreneurship
10,"Earnings Tracker: Tesla, Netflix, Procter & Gamble"
11,"Rescale Honored by Goldman Sachs for Entrepreneurship, Joris Poort, Founder and CEO, Among the Most Exceptional Entrepreneurs at 2023 Builders and Innovators Summit"
12,Q3 2023 Goldman Sachs Group Inc Earnings Call
13,Goldman Sachs Sees Profits Plummets Amid Consumer Pivot
14,'I’ve never felt more optimistic' about Goldman Sachs: CEO SolomonYahoo Finance
15,Goldman's profit declines amid costly retreat from consumer bankingYahoo Finance
