,0
0,4 Green Flags for HP's Future
1,Here's My Top Value Stock to Buy Right Now
2,These Stocks Are Moving the Most Today
3,"These Stocks Are Moving the Most Today: Exxon, Pioneer Natural, Silk Road Medical, DaVita, Amgen, Lilly, and More"
4,HP Shares Advance After Reporting Solid 2024 Earnings Guidance and a Dividend Increase
5,"HP (HPQ) Stock Gains on Strong FY24 Outlook, Dividend Hike"
6,Global PC Shipment Falls in Q3: Recovery Expected Soon
7,HP Study: Millennials and Gen X Leading Tech Adoption in Microbusinesses
8,HP Study: Onus on Millennials and Gen X to dispel Gen Z and baby boomer tech doubts
9,"HP Stock Rallies on Solid Profit Forecast, Dividend Hike"
