,0
0,"Henry Schein Completes Acquisition of a Majority Interest in Shield Healthcare, Inc."
1,Are You a Value Investor? This 1 Stock Could Be the Perfect Pick
2,Why Molson Coors Brewing (TAP) is a Top Value Stock for the Long-TermZacks
3,Why PVH (PVH) is a Top Growth Stock for the Long-TermZacks
4,S&P 500 Gains and Losses Today: Index Climbs to Start Week of Key Earnings Reports
5,Markets Jump at Midday to Begin a Week of Key Corporate Earnings Reports
6,Is Henry Schein Inc (HSIC) Modestly Undervalued? A Comprehensive Analysis of Its Market Value
7,Here's Why Henry Schein (HSIC) is a Strong Growth Stock
8,Are You a Value Investor? This 1 Stock Could Be the Perfect PickZacks
9,Here's Why A.O. Smith (AOS) is a Strong Growth StockZacks
10,Henry Schein Provides Information on Cybersecurity Incident
11,"Are Henry Schein, Inc.'s (NASDAQ:HSIC) Fundamentals Good Enough to Warrant Buying Given The Stock's Recent Weakness?"
12,HSIC vs. MMSI: Which Stock Is the Better Value Option?
13,4 Stocks to Buy From the Prospering Dental Supplies Industry
