,0
0,CenterWell Senior Primary Care Bringing Personalized Care to Virginia Seniors
1,Humana’s Medicare Advantage Footprint in New Jersey Complete
2,Are Strong Financial Prospects The Force That Is Driving The Momentum In Humana Inc.'s NYSE:HUM) Stock?
3,12 Best Health Insurance Stocks to Buy
4,Why Humana (HUM) is a Top Growth Stock for the Long-Term
5,Why Owens Corning (OC) is a Top Growth Stock for the Long-TermZacks
6,Are You a Growth Investor? This 1 Stock Could Be the Perfect PickZacks
7,"Humana and USAA Expand Relationship to Offer High-Quality, Affordable Medicare Advantage Plans Designed with Veterans in Mind"
8,3 Defensive Stocks to Buy As Interest Rates Continue to Climb
9,Humana Tennessee Medicare Advantage HMO Plan Achieves Highest Quality Rating for 2024
10,Humana Kentucky Medicare Advantage HMO Plan Scores Top 5-Star Rating Third Year in a Row
11,"Popular Humana HMO Plan, Offered in Multiple States, Attains Highest Quality Rating"
