,0
0,11 Best Quantum Computing Stocks To Buy Now
1,Here's Why IBM (IBM) Gained But Lagged the Market Today
2,5 Safe Stocks to Buy Amid Plummeting U.S. Consumer Sentiment
3,3 Artificial Intelligence (AI) Stocks With More Upside Than Nvidia
4,Nvidia’s AI Chip Exports to China Are Under Threat: ReportBarrons.com
5,Nvidia Stock Tumbles as U.S. Tightens Restrictions on AI Chip Exports to ChinaBarrons.com
6,Wall Street’s ‘Cobol Cowboys’ are spread thin fixing legacy tech—but AI may soon ride to the rescue
7,"Where to Invest $100,000 Right Now"
8,Dow ETF in Focus Ahead of Q3 Earnings
9,"Biden to meet with Target, IBM and other CEOs"
10,"UPDATE 1-Biden to meet with Target, IBM and other CEOs"
11,HPE or IBM: Which Is the Better Value Stock Right Now?
12,J or TT: Which Is the Better Value Stock Right Now?Zacks
13,NJDCY or OLED: Which Is the Better Value Stock Right Now?Zacks
