,0
0,IFF Launches Sound Logo to Illustrate Multi-sensory Dimensions of Scent
1,New Strong Sell Stocks for October 18th
2,New Strong Sell Stocks for October 20thZacks
3,New Strong Sell Stocks for October 19thZacks
4,Why International Flavors' (IFF) Stock is Down 27% in a Year
5,IFF Secures Regulatory Approval for Use of 2'-FL HMO in China
6,IFF to Reveal Breakthrough Science at AAPS 2023 PharmaSci 360
7,IFF Features New Excipient Formulations at CPHI 2023
8,IFF Spotlights Pioneering Dietary Supplement Innovations at SupplySide West 2023
9,Are Investors Undervaluing International Flavors & Fragrances Inc. (NYSE:IFF) By 33%?
10,International Flavors & Fragrances Inc (IFF): A Deep Dive into Its Performance Potential
11,International Flavors & Fragrances (IFF) Stock: A Hidden Value Trap? Unpacking the Risks ...
