,0
0,Biden admin. expands curbs on shipments of AI chips to China
1,Nvidia and Other Chip Stocks Remain Under Pressure After U.S. Export Curbs
2,"Nvidia, Chip Stocks Drop After U.S. Curbs ExportsThe Wall Street Journal"
3,"U.S. Tightens Curbs on AI Chip Exports to China, Widening Rift With Nvidia and IntelThe Wall Street Journal"
4,Micron Stock: Memory Chip Prices Are Bouncing Back
5,Intel's PC Chip Business Still Has 1 Big Problem
6,"The Zacks Analyst Blog Highlights Pinterest, On Semiconductor, Intel, Alphabet and Meta Platforms"
7,Nvidia Is Doubling Its Pace of Innovation: Will It Leave Challengers in the Dust?
8,Is It Too Late to Buy AMD Stock?
9,UPDATE 1-Nvidia details advanced AI chips blocked by new export controls
10,Nvidia details advanced AI chips blocked by new export controlsReuters
11,Nvidia Stock Pulls Back Further After AI Chip Curbs — Is It A Buy?Investor's Business Daily
12,"U.S. Tightens Curbs on AI Chip Exports to China, Widening Rift With Nvidia and Intel"
13,Nvidia Stock Tumbles On New U.S. Trade Restrictions With ChinaInvestor's Business Daily
14,"Nvidia, Chip Stocks Drop After U.S. Curbs ExportsThe Wall Street Journal"
15,Here's Why Intel (INTC) Fell More Than Broader Market
