,0
0,15 States with No Income Tax or Sales Tax
1,Intuit (INTU) Sees a More Significant Dip Than Broader Market: Some Facts to Know
2,Is Intuit (INTU) Outperforming Other Computer and Technology Stocks This Year?
3,"Intuit Introduces QuickBooks Bill Pay, Expanding Money Platform to Deliver Business-to-Business Payments with AP Automation"
4,10 Best States to Start an LLC
5,Intuit (INTU) Rises Yet Lags Behind Market: Some Facts Worth Knowing
6,"Intuit Announces its Coalfield Solar Fund First Year Winners, Building a More Sustainable Future for Virginia and West Virginia"
7,Q4 Stock Predictions: 3 Tech Stocks Ready to Roar Into 2024
8,10 Tax Free Retirement Countries for US Citizens
9,"Insider Sell: Director Raul Vazquez Sells 1,938 Shares of Intuit Inc"
