,0
0,Invesco (IVZ) Reports Next Week: Wall Street Expects Earnings Growth
1,Is Invesco Comstock A (ACSTX) a Strong Mutual Fund Pick Right Now?
2,Should You Invest in the Invesco Building & Construction ETF (PKB)?
3,Should You Invest in the First Trust NASDAQ Semiconductor ETF (FTXL)?Zacks
4,Should You Invest in the Vanguard Consumer Discretionary ETF (VCR)?Zacks
5,Is Invesco Gold & Special Minerals A (OPGSX) a Strong Mutual Fund Pick Right Now?
6,Should Invesco S&P MidCap 400 Pure Growth ETF (RFG) Be on Your Investing Radar?
7,Is Invesco DB US Dollar Index Bullish ETF (UUP) a Strong ETF Right Now?
8,Is JPMorgan Diversified Return Emerging Markets Equity ETF (JPEM) a Strong ETF Right Now?Zacks
9,Is ProShares S&P 500 Dividend Aristocrats ETF (NOBL) a Strong ETF Right Now?Zacks
10,Is Hedging With ETF Indexes a Relevant Strategy?
11,How To Master Index Investing
12,ETFs vs. Index Funds vs. Mutual Funds: Do You Really Know How They're Different?SmartAsset
13,What is a bond ETF and is it a good investment?Bankrate
14,Homebuilder ETFs Tumble: What Lies Ahead?
15,Investors Strike It Rich On A Commodity Up More Than Oil And Gold
