,0
0,Slowing Rates Of Return At Juniper Networks (NYSE:JNPR) Leave Little Room For Excitement
1,Juniper (JNPR) Boosts Security Portfolio With Advanced Features
2,Juniper Networks Unveils the Industry’s First Distributed Security Services Architecture for Unmatched Scalability and Operational Simplicity
3,PayNet Banks On AI-Driven Network by Juniper Networks to Drive Expansion of Malaysia’s National Payments Infrastructure
4,NANOG Selects Juniper Networks as New Official Network Connectivity Equipment Provider for Upcoming Conferences
5,Decoding Juniper Networks (JNPR)'s Valuation: A Comprehensive Analysis of Its Market Worth
6,"Midday movers: PepsiCo, Unity, Rivian Automotive and more"
7,Corning slashed at JPMorgan on tepid recovery: 4 big analyst cuts
8,7 Tech Stocks That Also Pay You to Own Them
9,"Market Today: Mixed Results for Major Indices, Aehr Test Systems Beats Q1 Estimates, Beverage ..."
