,0
0,Procter & Gamble Stock and 2 Other Analyst Picks in the Crumbling Staples Sector
1,KDP vs. BROS: Which Stock Is the Better Value Option?
2,5 Large-Cap Stocks to Buy on the Dip for Q4 2023
3,Keurig Dr Pepper (KDP) Stock: A Hidden Value Trap? Unpacking the Risks and Rewards
4,"Here's Why Keurig Dr Pepper, Inc (KDP) is Poised for a Turnaround After Losing -11.59% in 4 Weeks"
5,"Down -15.15% in 4 Weeks, Here's Why You Should You Buy the Dip in Badger Meter (BMI)Zacks"
6,Here's Why Holley Inc. (HLLY) is Poised for a Turnaround After Losing -18.96% in 4 WeeksZacks
7,"AB InBev (BUD) Keen on Premiumization Strategy, Stock to Gain"
8,"Down -11.3% in 4 Weeks, Here's Why Keurig Dr Pepper, Inc (KDP) Looks Ripe for a Turnaround"
9,"Down -37.74% in 4 Weeks, Here's Why Vera Therapeutics, Inc. (VERA) Looks Ripe for a TurnaroundZacks"
10,"Down -20.51% in 4 Weeks, Here's Why Insulet (PODD) Looks Ripe for a TurnaroundZacks"
11,Keurig Dr Pepper Inc.'s (NASDAQ:KDP) Fundamentals Look Pretty Strong: Could The Market Be Wrong About The Stock?
12,13 Best Food Stocks To Buy Now
13,Keurig Dr Pepper to Report Third Quarter 2023 Results and Host Conference Call
