,0
0,Kimberly-Clark (KMB) Earnings Expected to Grow: Should You Buy?
1,Kimberly-Clark Celebrates Hispanic Heritage Month
2,These 4 Measures Indicate That Kimberly-Clark (NYSE:KMB) Is Using Debt Reasonably Well
3,Will Kimberly-Clark (KMB) Beat Estimates Again in Its Next Earnings Report?
4,(KMB) Rises As Market Takes a Dip: Key Facts
5,These 3 High-Yield Stocks Have Increased Dividends for 50 Years
6,"Lisa Morden: ""Our Heritage Is Rooted in Building Sustainability Into Our Business Model"""
7,Kimberly-Clark to Announce Third Quarter 2023 Financial Results on October 24
8,The past three years for Kimberly-Clark (NYSE:KMB) investors has not been profitable
9,Kimberly-Clark (KMB) Increases Yet Falls Behind Market: What Investors Need to Know
