,0
0,What's in the Offing for Kinder Morgan's (KMI) Q3 Earnings?
1,"Calculating The Intrinsic Value Of Kinder Morgan, Inc. (NYSE:KMI)"
2,Could These 3 Ultra-High-Yield Stocks Help You Retire a Millionaire?
3,"Want $5,000 in Passive Income? Invest $10,000 Into These 3 High-Yield Dividend Stocks and Wait 7 Years"
4,Kinder Morgan (KMI) Earnings Expected to Grow: What to Know Ahead of Q3 Release
5,"Even With Oil at $85 a Barrel, These 3 High-Yield Energy Stocks Are Still Dirt-Cheap"
6,Kinder Morgan Announces Third Quarter ‘23 Earnings Webcast
7,Invest in These 3 Low-Beta Energy Stocks to Combat Volatility
8,There's Been No Shortage Of Growth Recently For Kinder Morgan's (NYSE:KMI) Returns On Capital
9,This 7%-Yielding Dividend Stock Is Becoming More Sustainable
