,0
0,This Stock's 6.6%-Yielding Dividend Remains on Rock-Solid Ground
1,"Kinder Morgan (KMI) Lags on Q3 Earnings, Revises Net Income View"
2,Q3 2023 Kinder Morgan Inc Earnings Call
3,"Kinder Morgan, Inc. (NYSE:KMI) Q3 2023 Earnings Call Transcript"
4,Investors in Kinder Morgan (NYSE:KMI) have seen decent returns of 66% over the past three years
5,Kinder Morgan (KMI) Q3 2023 Earnings Call Transcript
6,Kinder Morgan (KMI) Reports Q3 Earnings: What Key Metrics Have to Say
7,AT&T (T) Reports Q3 Earnings: What Key Metrics Have to SayZacks
8,Philip Morris (PM) Q3 Earnings: Taking a Look at Key Metrics Versus EstimatesZacks
9,Kinder Morgan Inc (KMI) Reports Q3 2023 Financial Results
10,Kinder Morgan (KMI) Q3 Earnings and Revenues Lag Estimates
11,Pool Corp. (POOL) Tops Q3 Earnings and Revenue EstimatesZacks
12,Philip Morris (PM) Q3 Earnings Beat EstimatesZacks
13,Kinder Morgan Reports Third Quarter 2023 Financial Results
