,0
0,Here’s Why CarMax (KMX) Shares Retreated in Q3
1,CarMax Celebrates 30-Year Anniversary by Ringing the NYSE Closing Bell October 10
2,Carvana's Turnaround Plan Seems to Be Missing 1 Key Detail
3,"Investors three-year losses continue as CarMax (NYSE:KMX) dips a further 4.2% this week, earnings continue to decline"
4,CarMax Inc (KMX) Q2 2024 Earnings: A Mixed Bag Amid Market Pressures
5,CarMax (KMX) Q2 2024 Earnings Call Transcript
6,Why Carvana Stock Lost 17% in September
7,CarMax Inc (KMX): A Deep Dive into Financial Metrics and Competitive Strengths
8,"CarMax, Inc. (NYSE:KMX) Q2 2024 Earnings Call Transcript"
9,"CarMax's (KMX) Q2 Earnings On Par With Estimates, Decline Y/Y"
