,0
0,Here's Why We Think Coca-Cola (NYSE:KO) Is Well Worth Watching
1,Warren Buffett's Billion-Dollar Dividend Duo: Apple and Coca-Cola Account For Over $1.6 Billion A Year In Income For Berkshire Hathaway
2,Coca-Cola Earnings Preview: ETFs in Focus
3,Can Coca-Cola (KO) Q3 Earnings Beat Countering Inflation Woes?
4,Is Trending Stock CocaCola Company (The) (KO) a Buy Now?Zacks
5,Brand Strength & Pricing to Aid Boston Beer's (SAM) Q3 EarningsZacks
6,Is Trending Stock CocaCola Company (The) (KO) a Buy Now?
7,Coca-Cola Board of Directors Declares Regular Quarterly Dividend
8,3 Dividend Stocks You Can Safely Hold for Decades
9,Want Passive Income? 2 Dividend Giants to Buy Right Now
10,1 Blue Chip Dividend Stock Near a 52-Week Low to Buy Hand Over Fist
11,Looking For Passive Income? This Dividend Portfolio Will Pay You Monthly
