,0
0,Why McDonald's stock has lost a few pounds
1,Looking For Passive Income? This Dividend Portfolio Will Pay You Monthly
2,53.7% of Warren Buffett's $344 Billion Berkshire Hathaway Portfolio Is Invested in These 2 Dividend Stocks
3,Coca-Cola (KO) Gains As Market Dips: What You Should Know
4,Why an iconic Coca-Cola soda could make a retail comeback
5,Coca-Cola & Beloved Local U.S. Pizzerias Are Offering Up Their Iconic Pizza In Exchange For Recycling A Bottle
6,Coca-Cola (KO) Reports Next Week: What to Know Ahead of the Release
7,Coca-Cola (KO) Gains As Market Dips: What You Should KnowZacks
8,Dow Inc. (DOW) Expected to Beat Earnings Estimates: Can the Stock Move Higher?Zacks
9,"Coca-Cola (KO), Pernod (PRNDY) to Debut Absolut & Sprite Cocktail"
10,2 Top Dividend Stocks You Can Buy and Hold Forever
11,Is Coca-Cola Stock a Buy Now?
