,0
0,Loews Corporation (NYSE:L) On An Uptrend: Could Fundamentals Be Driving The Stock?
1,"Loews Corporation to Release Third Quarter 2023 Results on October 30, 2023"
2,These 3 Insurance Stocks Trade Below Book and Pay Dividends
3,"Loews Stock Tops Buy Point, A Stone's Throw From All-Time High"
4,Loews (NYSE:L) shareholders have earned a 19% CAGR over the last three years
5,Is Now The Time To Put Loews (NYSE:L) On Your Watchlist?
6,Loews profit more than doubles as market rebound boosts investment returns
7,LOEWS CORPORATION REPORTS NET INCOME OF $360 MILLION FOR THE SECOND QUARTER OF 2023
8,"Loews Corporation to Release Second Quarter 2023 Results on July 31, 2023"
9,"With 59% institutional ownership, Loews Corporation (NYSE:L) is a favorite amongst the big guns"
