,0
0,Insider Buying: Director William Jurgensen Acquires 3000 Shares of Lamb Weston Holdings Inc
1,Best Growth Stocks to Buy for October 17th
2,Why This 1 Value Stock Could Be a Great Addition to Your Portfolio
3,Why Molson Coors Brewing (TAP) is a Top Value Stock for the Long-TermZacks
4,Why This 1 Momentum Stock Could Be a Great Addition to Your PortfolioZacks
5,Here's Why Lamb Weston (LW) is a Strong Growth Stock
6,Best Growth Stocks to Buy for October 17thZacks
7,Are You a Growth Investor? This 1 Stock Could Be the Perfect PickZacks
8,Best Growth Stocks to Buy for October 13th
9,Palo Alto Networks (PANW) Gains As Market Dips: What You Should KnowZacks
10,"Zacks Industry Outlook Highlights Palo Alto Networks, Datadog and PinterestZacks"
11,Hormel Sinks Amid 'Largest Wage Increases' In Meatpacker's History
12,Consumer Staples Stocks Are Taking a Hit
13,Lamb Weston's (LW) Latest Move to Boost Shareholders' Wealth
14,"Inter Parfums (IPAR) Blossoms on Solid Products, High Demand"
15,"Sysco (SYY) to Buy Edward Don, Recipe for Growth on Track"
