,0
0,Why McDonald's stock has lost a few pounds
1,Free meals for Israeli soldiers divide McDonald's franchises over Israel-Hamas war
2,Where Will McDonald's Stock Be in 1 Year?
3,This McDonald's menu item puts the Big Mac to shame
4,McDonald's' (NYSE:MCD) investors will be pleased with their favorable 66% return over the last five years
5,'A devastating financial blow': California's so-called 'draconian' fast-food bill is now law — here's why McDonald's franchisees say it'll cost small business owners $250K per year
6,McDonald's faces boycott after making a controversial move
7,BJ's Restaurants (BJRI) to Report Q3 Earnings: What's in Store?
8,FAT Brands (FAT) Gears Up for Q3 Earnings: What's in Store?
9,Simpson Manufacturing (SSD) to Post Q3 Earnings: What to Expect?Zacks
10,Factors Setting the Stage for Fifth Third's (FITB) Q3 EarningsZacks
11,"The Zacks Analyst Blog Highlights Bank OZK, McDonald's, RPM International, Lockheed Martin and A. O. Smith"
