,0
0,Bankrupt Rite Aid resolves drug supply dispute with McKesson
1,Bankrupt Rite Aid Settles With Drug Supplier McKesson to Avoid Shortages
2,PacBio's (PACB) New Offering to Boost WGS Data Analysis
3,3 Reasons to Add Integer Holdings (ITGR) Stock to Your Portfolio
4,Best Momentum Stocks to Buy for October 17th
5,"Zacks.com featured highlights Stride, Deckers Outdoor, Molina Healthcare and McKesson"
6,4 Stocks That Flaunt an Impressive Interest Coverage Ratio
7,15 Largest Pharmacy Chains in the World
8,QuidelOrtho (QDEL) Reports Solid Preliminary Q3 Revenues
9,Are You a Momentum Investor? This 1 Stock Could Be the Perfect Pick
10,Why Fastenal (FAST) is a Top Momentum Stock for the Long-TermZacks
11,Here's Why Martin Marietta (MLM) is a Strong Momentum StockZacks
