,0
0,Do You Think Mohawk (MHK) has Favorable Risk-Reward Characteristics?
1,Is Mohawk Industries (MHK) Too Good to Be True? A Comprehensive Analysis of a Potential Value Trap
2,"Mohawk Industries, Inc. Invites You to Join the Third Quarter 2023 Earnings Conference Call"
3,"An Intrinsic Calculation For Mohawk Industries, Inc. (NYSE:MHK) Suggests It's 47% Undervalued"
4,"Mohawk Highlights a Year of Progress in New 2022 Environmental, Social & Governance Report"
5,Do Options Traders Know Something About Mohawk (MHK) Stock We Don't?
6,"Strategic Initiatives Aid Mohawk (MHK), Inflation Hurts"
7,"Insider Sell: CEO Jeffrey Lorberbaum Sells 10,000 Shares of Mohawk Industries Inc"
8,"Is Mohawk Industries, Inc. (NYSE:MHK) Potentially Undervalued?"
9,Q2 2023 Mohawk Industries Inc Earnings Call
