,0
0,Unveiling the Investment Potential of MarketAxess Holdings Inc (MKTX): A Comprehensive Analysis
1,MarketAxess (MKTX) Soars 5.8%: Is Further Upside Left in the Stock?
2,"MarketAxess to Host Conference Call Announcing Third Quarter 2023 Financial Results on Wednesday, October 25, 2023"
3,"MarketAxess Holdings' (NASDAQ:MKTX) earnings have declined over three years, contributing to shareholders 56% loss"
4,MarketAxess (MKTX) Boosts Trading for Emerging Market Bonds
5,Unveiling MarketAxess Holdings (MKTX)'s True Worth: Is It Really Priced Right? A Comprehensive Guide
6,MarketAxess Announces Monthly Volume Statistics for September and Third Quarter 2023
7,MarketAxess Launches Open Trading® for Emerging Market Local Currency Bonds
8,MarketAxess Completes Acquisition of Pragma
9,1 Magnificent S&P 500 Dividend Stock to Buy and Hold Forever
