,0
0,12 Best Health Insurance Stocks to Buy
1,"Zacks.com featured highlights Stride, Deckers Outdoor, Molina Healthcare and McKesson"
2,Here's Why You Should Hold Centene (CNC) in Your Portfolio
3,4 Stocks That Flaunt an Impressive Interest Coverage Ratio
4,Unveiling Molina Healthcare's Value: Is It Priced Right? A Comprehensive Guide
5,Centene (CNC) Eyes Membership Growth With 2024 Expansion Plans
6,"If You Invested $1000 in Molina a Decade Ago, This is How Much It'd Be Worth Now"
7,Here's Why You Should Hold UnitedHealth Group (UNH) Stock Now
8,Molina Healthcare (NYSE:MOH) shareholders have earned a 19% CAGR over the last five years
9,Here's Why Investors Should Retain Humana (HUM) Stock Now
10,Why Humana (HUM) is a Top Growth Stock for the Long-TermZacks
11,Humana (HUM) Registers a Bigger Fall Than the Market: Important Facts to NoteZacks
