,0
0,Here's Why We Think MSCI (NYSE:MSCI) Might Deserve Your Attention Today
1,"EMERGING MARKETS-Most Latam currencies gain ahead of Fed minutes, Brazilian real flat"
2,Is iShares MSCI USA Value Factor ETF (VLUE) a Strong ETF Right Now?
3,Is SPDR S&P Biotech ETF (XBI) a Strong ETF Right Now?Zacks
4,Is ProShares S&P 500 Dividend Aristocrats ETF (NOBL) a Strong ETF Right Now?Zacks
5,Emerging-Market Stocks Sink to Lowest Since 1987 Relative to US Equities
6,MSCI to Advance Clarity in Carbon Markets With Acquisition of Trove Research
7,MSCI's (NYSE:MSCI) investors will be pleased with their stellar 258% return over the last five years
8,"MSCI Insiders Sell US$9.3m Of Stock, Possibly Signalling Caution"
9,India Small-Cap ETF (SMIN) Hits New 52-Week High
10,MSCI Schedules Earnings Call to Review Third Quarter 2023 Results
11,MSCI Completes Acquisition of Burgiss
