,0
0,Should You Invest in the iShares MSCI Europe Financials ETF (EUFN)?
1,Should You Invest in the First Trust NASDAQ Semiconductor ETF (FTXL)?Zacks
2,Should You Invest in the Invesco Building & Construction ETF (PKB)?Zacks
3,Here's Why We Think MSCI (NYSE:MSCI) Might Deserve Your Attention Today
4,"EMERGING MARKETS-Most Latam currencies gain ahead of Fed minutes, Brazilian real flat"
5,Is iShares MSCI USA Value Factor ETF (VLUE) a Strong ETF Right Now?
6,Is American Century U.S. Quality Value ETF (VALQ) a Strong ETF Right Now?Zacks
7,Is Pacer US Cash Cows 100 ETF (COWZ) a Strong ETF Right Now?Zacks
8,Emerging-Market Stocks Sink to Lowest Since 1987 Relative to US Equities
9,MSCI to Advance Clarity in Carbon Markets With Acquisition of Trove Research
10,MSCI's (NYSE:MSCI) investors will be pleased with their stellar 258% return over the last five years
11,"MSCI Insiders Sell US$9.3m Of Stock, Possibly Signalling Caution"
12,India Small-Cap ETF (SMIN) Hits New 52-Week High
13,MSCI Schedules Earnings Call to Review Third Quarter 2023 Results
