,0
0,Microsoft is now a gaming juggernaut
1,Microsoft would like to remind you that they are all-in on AITechCrunch
2,"What Microsoft-Activision deal means for PC, cloud gamingYahoo Finance Video"
3,"Microsoft Earnings Report To Focus On Cloud Computing, Generative AI"
4,"Earnings Calendar Spotlight: Microsoft, Meta, Amazon Headline Huge Week Of Tech Earnings"
5,Azure Cloud Strength to Aid Microsoft's (MSFT) Q1 Earnings
6,Microsoft Stockholders Want to See an AI Boost. Here’s When It Will Kick In.
7,"""Magnificent Seven"" Earnings Underway: ETFs in Spotlight"
8,"Zacks Investment Ideas feature highlights: Microsoft, Amazon and Alphabet"
9,Dow Jones Futures Fall With Market Rally Near Lows; This Fear Gauge Offers Hope
