,0
0,"Regional Bank Earnings Kick Off: U.S. Bank, Citizens, M&T"
1,M&T Bank Corporation (MTB) Beats Q3 Earnings and Revenue Estimates
2,Why M&T Bank (MTB) Might Surprise This Earnings SeasonZacks
3,Ally Financial (ALLY) Q3 Earnings Beat EstimatesZacks
4,M&T Bank beats profit estimates as higher rates boost interest income
5,M&T Bank Corporation (NYSE:MTB) announces third quarter 2023 results
6,M&T Bank Corporation Announces Series H Preferred Stock Quarterly Dividend
7,M&T Ranks No. 6 Among SBA Lenders Following Record-Breaking Year
8,What's in the Cards for M&T Bank (MTB) in Q3 Earnings?
9,M&T Bank Corporation (MTB) Beats Q3 Earnings and Revenue EstimatesZacks
10,Why M&T Bank (MTB) Might Surprise This Earnings SeasonZacks
11,"M&T Bank Commits $250,000 to Harrisburg University's Center for Innovation and Entrepreneurship"
12,M&T Bank Corporation (MTB) Reports Next Week: Wall Street Expects Earnings Growth
13,Why M&T Bank (MTB) Might Surprise This Earnings SeasonZacks
14,M&T Bank Corporation (MTB) Beats Q3 Earnings and Revenue EstimatesZacks
15,M&T BANK APPOINTS DAVID W. HOLLIS AS CHIEF HUMAN RESOURCES OFFICER
