,0
0,Nasdaq Bear Market: 3 Stocks to Buy at a Discount
1,Is Match Group (MTCH) Too Good to Be True? A Comprehensive Analysis of a Potential Value Trap
2,"2024 Dating Trends: Plenty of Fish Predicts Big Buzz for ""Rizz-Colored Glasses"" and ""Canon-Bailing"""
3,Match Group to Webcast Q3 2023 Earnings Conference Call
4,Why Match Group (MTCH) is Poised to Beat Earnings Estimates Again
5,15 Free Dating Sites for Serious Relationships
6,"Matchmaking, Break-Ups, and a Survivor"
7,Match Group's (MTCH) Tinder & Jonathan Bennett to Combat Fraud
8,Tinder Partners With Mean Girls Actor Jonathan Bennett To Help Users Avoid Online Fraudsters
9,Tinder Is Rolling Out a $500 Monthly Subscription: Here's What It Means for Match Group Stock
