,0
0,Mettler-Toledo International Inc. to Host Third Quarter 2023 Earnings Conference Call
1,Unveiling the Investment Potential of Mettler-Toledo International Inc (MTD): A Comprehensive ...
2,Unveiling Mettler-Toledo International (MTD)'s Value: Is It Really Priced Right? A ...
3,"If EPS Growth Is Important To You, Mettler-Toledo International (NYSE:MTD) Presents An Opportunity"
4,Calculating The Intrinsic Value Of Mettler-Toledo International Inc. (NYSE:MTD)
5,Here’s Why Mettler-Toledo International (MTD) Declined in Q2
6,Wolfgang Wienand to Join Mettler Toledo Board of Directors
7,"Mettler-Toledo International (NYSE:MTD) sheds 7.7% this week, as yearly returns fall more in line with earnings growth"
8,S&P 500 Gains and Losses Today: Oil Industry Stocks Advance as Oil Prices Climb
9,Mettler-Toledo International Inc. (NYSE:MTD) Q2 2023 Earnings Call Transcript
