,0
0,Norwegian Cruise Line Holdings to Hold Conference Call on Third Quarter 2023 Financial Results
1,"Norwegian Cruise Line Holdings Joins Global Maritime Forum to Support Shared Mission of Driving a Positive Change for the Industry, Environment and Society"
2,"Special Lounges, Single Staterooms: Cruises Fight for Solo Travelers"
3,Norwegian Cruise Line (NCLH) Suffers a Larger Drop Than the General Market: Key Insights
4,"NCL Corporation Ltd. Announces Pricing of $790,000,000 of Senior Secured Notes"
5,NCL Corporation Ltd. Announces Proposed Offering of Senior Secured Notes
6,Norwegian Cruise Line Holdings Ltd. Appoints José E. Cil to Board of Directors
7,Unraveling the Future of Norwegian Cruise Line Holdings Ltd (NCLH): A Deep Dive into Key Metrics
8,AMC Entertainment (AMC) Surges 11.6%: Is This an Indication of Further Gains?
9,Cruise Lines Pursue Greener Journeys Ahead of New Climate Rules
