,0
0,"Nasdaq, Inc. (NASDAQ:NDAQ) Q3 2023 Earnings Call Transcript"
1,Q3 2023 Nasdaq Inc Earnings Call
2,Nasdaq stock trades higher on earnings beat
3,Nasdaq Inc (NDAQ) Reports Solid Q3 2023 Results with Broad-Based Growth
4,Nasdaq Stock Rises More Than 5% After Earnings Beat
5,Is Nasdaq (NDAQ) Modestly Overvalued? A Comprehensive Analysis of Its Market Value
6,Nasdaq Sales Beat Estimates With Boost From ‘Marquee IPOs’
7,Nasdaq Announces Quarterly Dividend  of $0.22 Per Share
8,Nasdaq Reports Third Quarter 2023 Results; Broad-Based Growth Drives Solutions Businesses Revenue Acceleration
9,Is a Beat in Store for Nasdaq (NDAQ) This Earnings Season?
