,0
0,NextEra Energy (NEE) to Report Q3 Earnings: What's in Store?
1,3 Ultra High-Yield Dividend Stocks Down 22% to 73% to Buy on the Dip
2,CMS Energy (CMS) Earnings Expected to Grow: Should You Buy?
3,Ford Motor Company (F) Earnings Expected to Grow: What to Know Ahead of Next Week's ReleaseZacks
4,Boston Beer (SAM) Earnings Expected to Grow: Should You Buy?Zacks
5,NextEra Energy (NEE) Sees a More Significant Dip Than Broader Market: Some Facts to Know
6,12 Most Undervalued Dividend Stocks To Buy According To Analysts
7,3 No-Brainer Stocks to Buy With $100 Right Now
8,11 Best Green Stocks To Invest In 2023
9,Analysts Estimate NextEra Energy Partners (NEP) to Report a Decline in Earnings: What to Look Out for
10,NextEra Energy (NEE) to Report Q3 Earnings: What's in Store?Zacks
11,Analysts Estimate International Paper (IP) to Report a Decline in Earnings: What to Look Out forZacks
12,What's in Store for NextEra Energy Partners (NEP) in Q3 Earnings?
13,"The Zacks Analyst Blog Highlights NVIDIA, Procter & Gamble, NextEra Energy, Goldman Sachs and Prologis"
