,0
0,Newmont (NEM) Declares End of Strike at Mexico's Penasquito Mine
1,Newmont Announces End of Strike at Peñasquito Mine in Mexico
2,Newcrest Shareholders Approve Newmont’s $15 Billion Takeover
3,Newcrest investors strongly approve $17 billion Newmont takeover
4,UPDATE 2-Newcrest investors strongly approve $17 billion Newmont takeover
5,Newcrest Mining investors approve Newmont's $16.6 billion bid on proxy votes
6,CORRECTED-Newcrest investors to vote on A$26.2 bln Newmont takeover
7,Newmont (NEM) Shareholders Approve the Acquisition of Newcrest
8,10 Best Commodity ETFs
9,Newmont Corporation (NEM) Outperforms Broader Market: What You Need to Know
