,0
0,"NRG Energy, Inc. Announces Quarterly Dividend"
1,Are You Looking for a High-Growth Dividend Stock?
2,Why Hamilton Lane (HLNE) is a Top Dividend Stock for Your PortfolioZacks
3,American International Group (AIG) Could Be a Great ChoiceZacks
4,How to Boost Your Portfolio with Top Utilities Stocks Set to Beat Earnings
5,"New Customers, Florida Economy to Aid NextEra (NEE) Q3 Earnings"
6,15 Years of Reforesting and Recognizing Our Demand Response Customers
7,Direct Energy Releases New Electricity Plan for Texans with Solar Panels
8,NRG Energy Stock Shows Market Leadership With Jump To 81 RS Rating
9,Discover the Top 5 Benefits of Electric Cars for Families
10,Is NRG Energy (NRG) Too Good to Be True? A Comprehensive Analysis of a Potential Value Trap
11,Texas Grid Solicits Power Reserves to Avoid ‘Unacceptable’ Winter Risk
