,0
0,NetApp’s 2023 Data Complexity Report Reveals Urgent Need for Unified Data Storage
1,NetApp (NTAP) Teams Up With Equinix for a New BMaaS Solution
2,"NetApp Hosts Technology Sessions at 2023 INSIGHT Conference in Las Vegas, Nevada"
3,"With EPS Growth And More, NetApp (NASDAQ:NTAP) Makes An Interesting Case"
4,NetApp and Equinix Deliver Industry’s Most Comprehensive Bare Metal-as-a-Service Solution for Cloud Adjacent Experience
5,"NetApp Inc CEO George Kurian Sells 4,500 Shares"
6,NetApp and Ducati Corse Renew Partnership and Introduce Co-Engineered Data Management and Insights Solution
7,7 Tech Stocks That Also Pay You to Own Them
8,"Best Dividend Stocks: In Tech, NetApp Is A Conservative Play With A Dividend"
9,NetApp Inc (NTAP): A Deep Dive into its Dividend Performance and Sustainability
