,0
0,Analog Semiconductors Stocks Q2 Teardown: Impinj (NASDAQ:PI) Vs The Rest
1,Top Investors’ Stock Portfolio: 10 Mid-Cap Stocks To Buy
2,Wells Fargo Says Industrial Stocks Look Attractive Right Now; Here Are 2 Names to Consider
3,Why Investors Need to Take Advantage of These 2 Computer and Technology Stocks Now
4,How to Boost Your Portfolio with Top Medical Stocks Set to Beat EarningsZacks
5,How to Boost Your Portfolio with Top Auto-Tires-Trucks Stocks Set to Beat EarningsZacks
6,"The Zacks Analyst Blog Highlights Pinterest, On Semiconductor, Intel, Alphabet and Meta Platforms"
7,Analog Semiconductors Stocks Q2 In Review: Vishay Intertechnology (NYSE:VSH) Vs Peers
8,2 Colossal Growth Stocks to Buy Before the Big Bull Rally
9,Should You Investigate ON Semiconductor Corporation (NASDAQ:ON) At US$89.14?
10,Aehr Test Systems Stock Tumbles -- Time to Buy Yet?
11,Will ON Semiconductor Corp. (ON) Beat Estimates Again in Its Next Earnings Report?
