,0
0,Oracle Stock Falls After AI Event Highlighted Challenging Buildout
1,Why Oracle Stock Was Dropping Today
2,11 Best Technology Dividend Stocks To Buy
3,"SAP Earnings Beat, Software Maker Reaffirms Cloud Outlook"
4,Oracle Continues AI Momentum with NVIDIA AI Enterprise and DGX Cloud Availability in the Oracle Cloud Marketplace
5,Paylocity (PCTY) Launches Products for Workforce Engagement
6,Here's Why Oracle (ORCL) is a Strong Growth Stock
7,Oracle (ORCL) Stock Moves -0.72%: What You Should Know
8,"ORACLE'S ANNUAL MEETING OF STOCKHOLDERS TO BE HELD NOVEMBER 15, 2023"
9,Jim Cramer’s 10 Best AI Stocks
