,0
0,O'Reilly Automotive (ORLY) Earnings Expected to Grow: Should You Buy?
1,Boston Beer (SAM) Earnings Expected to Grow: Should You Buy?Zacks
2,Amazon (AMZN) Reports Next Week: Wall Street Expects Earnings GrowthZacks
3,Why O'Reilly Automotive (ORLY) is a Top Growth Stock for the Long-Term
4,Why Owens Corning (OC) is a Top Growth Stock for the Long-TermZacks
5,Are You a Growth Investor? This 1 Stock Could Be the Perfect PickZacks
6,Gabelli Funds 47th Annual Auto Symposium October 30th and October 31st
7,Why O'Reilly Automotive (ORLY) is Poised to Beat Earnings Estimates Again
8,1 Magnificent Nasdaq-100 Stock to Buy and Hold Forever
9,The Pros Got It Wrong: 7 Stocks to Buy Despite Recent Downgrades
10,Spotting Winners: O'Reilly (NASDAQ:ORLY) And Auto Parts Retailer Stocks In Q2
11,"O'Reilly upgraded, Yeti downgraded: Wall Street's top analyst calls"
12,America Movil racks up 2 upgrades on dirt-cheap valuation: 4 big analyst picks
13,"O’Reilly Automotive, Inc. Announces Dates for Its Third Quarter 2023 Earnings Release and Conference Call"
