,0
0,Otis Worldwide (OTIS) to Post Q3 Earnings: What's in Store?
1,Estimating The Intrinsic Value Of Otis Worldwide Corporation (NYSE:OTIS)
2,Otis Colleagues Rise Up To Meet 3 in ’23 Volunteer Challenge
3,Otis Named One of the World’s Best Employers
4,Otis Third Quarter 2023 Earnings Advisory
5,Otis Earns EcoVadis Gold Sustainability Rating for Second Consecutive Year
6,Construction Partners (ROAD) Stock Jumps 7.1%: Will It Continue to Soar?
7,Investors Heavily Search Salesforce Inc. (CRM): Here is What You Need to KnowZacks
8,Magic Software (MGIC) Stock Jumps 6.2%: Will It Continue to Soar?Zacks
9,"Otis Appoints Tracy Embree President, Otis Americas and Enrique Miñarro Viseras as President, Otis Europe, Middle East and Africa"
10,Otis Colleagues in Malaysia Host Kids Safety Ambassador Program
11,What Is Otis Worldwide Corporation's (NYSE:OTIS) Share Price Doing?
