,0
0,Paramount Global's (PARA) Teenage Mutant Ninja Game Returns
1,"The Score: Lockheed Martin, Paramount Global, JPMorgan Chase and More Stocks That Defined the Week"
2,"The Gaza Strip: What to Know, Maps and HistoryThe Wall Street Journal"
3,What Is Hamas? What to Know About the Militant Group Fighting IsraelThe Wall Street Journal
4,Paramount Global Declares Quarterly Cash Dividends
5,"Disney (DIS) Raises Prices for Disney+, Hulu Streaming Services"
6,"Superagent Ari Emanuel Takes Shots at Rival CAA, Paramount, Fox"
7,Hollywood writers ratify deal with studios to officially end historic strike
8,Paramount Global (PARA): A Deep Dive into Its Performance Potential
9,Paramount Honors 25 Years of MTV’s Staying Alive Foundation
10,"Hollywood strikes have cost the US economy 45,000 jobs since May"
11,Paramount Global an Underperform due to 'weak balance sheet': 4 big analyst cuts
