,0
0,PACCAR (PCAR) to Report Q3 Earnings: What's in the Cards?
1,3 Auto Stocks to Watch for Q3 Earnings Surprise
2,Ford Motor Company (F) Earnings Expected to Grow: What to Know Ahead of Next Week's Release
3,Nov Inc. (NOV) Earnings Expected to Grow: Should You Buy?Zacks
4,Boston Beer (SAM) Earnings Expected to Grow: Should You Buy?Zacks
5,Here's Why Paccar (PCAR) Fell More Than Broader Market
6,PCAR vs. FOXF: Which Stock Is the Better Value Option?
7,PACCAR (PCAR) to Report Q3 Earnings: What's in the Cards?Zacks
8,ALSN vs. RACE: Which Stock Is the Better Value Option?Zacks
9,Dow Jones Tech Titan Microsoft Eyes New Buy Point; Nvidia Stock Breaks Key Level On AI Chip Ban
10,Paccar (PCAR) Earnings Expected to Grow: Should You Buy?
11,PACCAR (PCAR) to Report Q3 Earnings: What's in the Cards?Zacks
12,Ford Motor Company (F) Earnings Expected to Grow: What to Know Ahead of Next Week's ReleaseZacks
13,Here's Why Paccar (PCAR) is a Strong Value Stock
14,Here's Why PPG Industries (PPG) is a Strong Value StockZacks
15,Are You a Value Investor? This 1 Stock Could Be the Perfect PickZacks
16,3 Reasons Why Growth Investors Shouldn't Overlook Paccar (PCAR)
17,Are Investors Undervaluing PACCAR (PCAR) Right Now?
18,Should Value Investors Buy Toyota Motor (TM) Stock?Zacks
19,Are Investors Undervaluing Fresenius Medical Care AG & Co. (FMS) Right Now?Zacks
