,0
0,Here's Why PG&E (NYSE:PCG) Has Caught The Eye Of Investors
1,PG&E's plan to bury power lines and prevent wildfires faces opposition because of high rates
2,"With Winter on the Approach, PG&E Offering Free Gas Appliance Safety Checks and Pilot Re-Lights"
3,Permanently Reducing Wildfire Risk: PG&E Hits Significant Milestone as 350 Miles of Trenching Completed on Path Toward 2023 Undergrounding Goal
4,PG&E Launches Microgrid Incentive Program with $79 Million in Project Funding
5,REFILE-UPDATE 1-California regulator proposes $45 mln penalty for PG&E over 2021 Dixie fire
6,California regulator proposes $45 million penalty for PG&E over 2021 Dixie fire
7,"Sink your Teeth into Savings, Bite Back at Vampire Appliances"
8,4 Stocks to Buy From the Promising Electric Power Industry
9,PG&E Corporation Schedules Third Quarter 2023 Earnings Release and Conference Call
