,0
0,Public Service Enterprise Group (NYSE:PEG) stock performs better than its underlying earnings growth over last five years
1,PSE&G Gains Approval to Continue Modernizing Its Gas System
2,Top 20 Renewable Energy Companies in USA by Revenue
3,Is Public Service Enterprise Group Incorporated's (NYSE:PEG) 18% ROE Better Than Average?
4,PSEG To Announce Third Quarter 2023 Financial Results On October 31
5,Kenneth Tanji appointed to Public Service Enterprise Group board
6,PSEG Elects Kenneth Y. Tanji to Board of Directors
7,Definitive Healthcare Welcomes Scott Stephenson to Board of Directors
8,Unveiling Public Service Enterprise Group (PEG)'s Value: Is It Really Priced Right? A ...
9,PSEG (PEG) Down 2.3% Since Last Earnings Report: Can It Rebound?
