,0
0,Why McDonald's stock has lost a few pounds
1,Looking For Passive Income? This Dividend Portfolio Will Pay You Monthly
2,3 Passive Income Stocks to Hold for the Next 20 Years
3,A Look Into PepsiCo's (NASDAQ:PEP) Impressive Returns On Capital
4,"The Zacks Analyst Blog Highlights PepsiCo, Lifeway Foods and NexPoint Residential"
5,Why an iconic Coca-Cola soda could make a retail comeback
6,"SunChips® Showcases Artwork from Underrepresented Artists in ""Art Seen"" Honors"
7,5 Safe Stocks to Buy Amid Plummeting U.S. Consumer Sentiment
8,Are Ozempic and Similar Treatments Impacting Food and Beverage Stocks? Here's What Pepsi's CFO Said About It
9,"PepsiCo, Inc. (NASDAQ:PEP) is largely controlled by institutional shareholders who own 74% of the company"
