,0
0,Bearish: Analysts Just Cut Their Pfizer Inc. (NYSE:PFE) Revenue and EPS estimates
1,20 Most Innovative States in the US
2,Why Pfizer Stock Slipped Today
3,Pfizer (PFE) Suffers a Larger Drop Than the General Market: Key Insights
4,Johnson & Johnson Was Saved By Its Focus On MedTech And Innovative Medicine
5,Is Pfizer Stock A Buy Or A Sell After Hitting The Reset Button On Its Covid Products?
6,Moderna (MRNA) Down Despite Maintaining COVID Jab Sales View
7,Nu Holdings and Tyson Foods have been highlighted as Zacks Bull and Bear of the Day
8,Johnson & Johnson (JNJ) Q3 Earnings and Revenues Surpass Estimates
9,J&J (JNJ) Beats Q3 Earnings & Sales Estimates Post Spin-OffZacks
10,Ally Financial (ALLY) Q3 Earnings Beat EstimatesZacks
11,Stocks Boosted by Lack of Bad News. Why That May Not Last.
