,0
0,Is Packaging Corporation of America (PKG) Stock Undervalued Right Now?
1,Investors in Packaging Corporation of America (NYSE:PKG) have seen impressive returns of 103% over the past five years
2,Sonoco (SON) Hurt by Volume Decline and Higher Expenses
3,"Zacks Industry Outlook Highlights Packaging Corporation of America, AptarGroup, Greif and Karat Packaging"
4,4 Packaging Stocks Poised to Counter Industry Challenges
5,Unpacking the Dividend Performance of Packaging Corp of America
6,Packaging Corporation of America Schedules Conference Call to Discuss Third Quarter 2023 Operating Results
7,Packaging Corporation of America (NYSE:PKG) Goes Ex-Dividend Soon
8,Should You Think About Buying Packaging Corporation of America (NYSE:PKG) Now?
9,Why Is Packaging Corp. (PKG) Down 5% Since Last Earnings Report?
