,0
0,Will Smoke-Free Products Fuel Philip Morris' (PM) Q3 Earnings?
1,What Awaits Philip Morris (PM) as It Queues for Q3 Earnings?
2,"Altria Stock: Buy, Sell, or Hold?"
3,PRESS DIGEST-British Business - Oct. 13
4,Philip Morris (PM) Dips More Than Broader Market: What You Should Know
5,Philip Morris (PM) Reports Next Week: Wall Street Expects Earnings Growth
6,Brown & Brown (BRO) Reports Next Week: Wall Street Expects Earnings GrowthZacks
7,What Awaits Philip Morris (PM) as It Queues for Q3 Earnings?Zacks
8,Philip Morris International to Host Webcast of 2023 Third-Quarter and September Year-to-Date Results
9,Philip Morris International (NYSE:PM) Could Be Struggling To Allocate Capital
10,2 Top Value Stocks to Buy in October
11,Philip Morris International (NYSE:PM) shareholders have earned a 11% CAGR over the last three years
