,0
0,Public Storage Recognized as the U.S. Self-Storage Sustainability Leader on the GRESB Benchmark
1,Top 100 Places Where the Rich People Own Real Estate
2,Public Storage to Release Third Quarter 2023 Earnings Results and Host Quarterly Conference Call
3,"WW upgraded, Macy's downgraded: Wall Street's top analyst calls"
4,"Zacks Value Trader Highlights: Equinix, Public Storage, Simon Property Groupt, Park Hotels & Resorts and Playa Hotels & Resorts"
5,"Zacks Market Edge Highlights: ALB, ZM, FTCH, JD and PYPLZacks"
6,Stocks on Sale: How Low Will They Go?Zacks
7,The Easy Way to Become a Landlord
8,"Enphase Energy upgraded, Brighthouse downgraded: Wall Street's top analyst calls"
9,Expansion Efforts to Aid Public Storage (PSA) Amid High Rates
10,3 High-Yield REITs to Buy Now
11,Public Storage (PSA) Concludes $2.2B Simply Self Storage Buyout
