,0
0,"PayPal’s app can now track your packages, even if you didn't check out with its service"
1,Paypal (PYPL) Rises As Market Takes a Dip: Key Facts
2,"PayPal Holdings, Inc. (PYPL) is Attracting Investor Attention: Here is What You Should Know"
3,Here is What to Know Beyond Why Shopify Inc. (SHOP) is a Trending StockZacks
4,MicroStrategy Incorporated (MSTR) is Attracting Investor Attention: Here is What You Should KnowZacks
5,Why Investors Need to Take Advantage of These 2 Computer and Technology Stocks Now
6,Why Investors Need to Take Advantage of These 2 Medical Stocks NowZacks
7,Want Better Returns? Don't Ignore These 2 Basic Materials Stocks Set to Beat EarningsZacks
8,25 Most Productive Countries Per Capita
9,An Historic Investment Opportunity: 1 Solid Growth Stock to Buy Now Before It Soars 200% by 2030
10,3 Generational Wealth-Building Stocks That Can Set You Up for Life
11,My Top 16 Stocks to Buy Now
12,13 Best Blue Chip Stocks Under $100
13,Period Care Coalition Offers 'Tampon Tax Back' Refunds
