,0
0,Carnival Cruise Line has some funny advice for cruisers
1,Why Royal Caribbean (RCL) Dipped More Than Broader Market Today
2,Royal Caribbean (RCL) Reports Next Week: Wall Street Expects Earnings Growth
3,Why Royal Caribbean (RCL) Dipped More Than Broader Market TodayZacks
4,Boston Beer (SAM) Earnings Expected to Grow: Should You Buy?Zacks
5,Carnival Cruise Line listens to its customers on key change
6,"Special Lounges, Single Staterooms: Cruises Fight for Solo Travelers"
7,Time for CRUZ ETF as Cruise Industry's Prices Surge?
8,ROYAL CARIBBEAN GROUP TO HOLD CONFERENCE CALL ON THIRD QUARTER 2023 EARNINGS
9,Royal Caribbean (RCL) Reports Next Week: Wall Street Expects Earnings GrowthZacks
10,Why Royal Caribbean (RCL) Dipped More Than Broader Market TodayZacks
11,16 Best Vacations for Seniors with Limited Mobility
12,Royal Caribbean (RCL) Stock Moves -0.37%: What You Should Know
13,G-III Apparel (GIII) is Marching Ahead of Industry: Here's Why
