,0
0,"Dow Jones Leader JPMorgan, Chip Giant Nvidia Eye Buy Points"
1,2 Healthcare Stocks Near 52-Week Highs Still Worth Buying
2,Regeneron to Showcase Progress from Innovative Oncology Portfolio in Several Difficult-to-Treat Cancers at ESMO
3,AI Stocks AVGO And ANET Lead 5 Resilient Names Near Buy Points
4,"Regeneron Bulls, Bears Clash: Will Biotech Get Eylea Mojo Back?"
5,"Down 45%, Is Intellia a Buy?"
6,14 Best Cancer Stocks To Buy Now
7,Investing in Regeneron Pharmaceuticals (NASDAQ:REGN) five years ago would have delivered you a 118% gain
8,Will Regeneron (REGN) Beat Estimates Again in Its Next Earnings Report?
9,"The Zacks Analyst Blog Highlights Novavax, ALX Oncology, Regeneron Pharmaceuticals, Intellia and Moderna"
