,0
0,Steven Madden (SHOO) Stock Gains 15% in a Year: Here's Why
1,Here's Why Ralph Lauren (RL) is a Strong Value Stock
2,Why This 1 Value Stock Could Be a Great Addition to Your PortfolioZacks
3,Why RPM International (RPM) is a Top Value Stock for the Long-TermZacks
4,G-III Apparel (GIII) is Marching Ahead of Industry: Here's Why
5,Ralph Lauren (NYSE:RL) shareholders have earned a 18% CAGR over the last three years
6,A Beacon in Affordable Luxury: Kendra Scott CEO Tom Nolan Elevates the Jewelry Unicorn and Its Customers
7,30 Richest Zip Codes in the US
8,G-III Apparel (GIII) Stock Soars More Than 80% YTD: Here's Why
9,Ralph Lauren is Expanding in Canada with Digital Commerce Launch and First Luxury Store Opening
10,"Ralph Lauren (RL) Prioritizes Digital Investment, Stock to Gain"
11,Why Ralph Lauren (RL) is a Top Value Stock for the Long-Term
12,Why This 1 Value Stock Could Be a Great Addition to Your PortfolioZacks
13,Why RPM International (RPM) is a Top Value Stock for the Long-TermZacks
