,0
0,ResMed (RMD) Earnings Expected to Grow: What to Know Ahead of Next Week's Release
1,Ford Motor Company (F) Earnings Expected to Grow: What to Know Ahead of Next Week's ReleaseZacks
2,Boston Beer (SAM) Earnings Expected to Grow: Should You Buy?Zacks
3,MedTech Earnings in the Age of Ozempic May Not Be That Bad
4,ResMed (RMD) Gains From Strong Device Sales Amid Macro Woes
5,"ResMed to Report First Quarter Fiscal 2024 Earnings on October 26, 2023"
6,ResMed (RMD): Is the Stock Significantly Undervalued? An In-Depth Analysis
7,Here's Why Investors Should Retain ResMed (RMD) Stock for Now
8,Weight-Loss Drugs Divide Wall Street on Medical Device Stocks
9,ResMed (RMD) Stock Jumps 3.8%: Will It Continue to Soar?
10,ResMed Inc (RMD): A Deep Dive into Financial Metrics and Competitive Strengths
11,ResMed (RMD)'s Hidden Bargain: An In-Depth Look at the 25% Margin of Safety Based on its Valuation
