,0
0,"Deutsche Bank downgrades SolarEdge, Sunrun, Sunnova"
1,"Some SolarEdge Technologies, Inc. (NASDAQ:SEDG) Analysts Just Made A Major Cut To Next Year's Estimates"
2,5 Things to Know Before Markets OpenInvestopedia
3,"These Stocks Are Moving the Most Today: SolarEdge, Enphase, American Express, Regions, Knight-Swift, HPE, and MoreBarrons.com"
4,Consumers of key energy source experience unexpected setback
5,SolarEdge's Challenges Deeper Than Previously Suggested
6,Solar-Power Stocks Tumble After SolarEdge Warns of Slowing Installations
7,"Stocks to Watch Friday: American Express, Enphase Energy, Tesla, SolarEdgeThe Wall Street Journal"
8,5 Things to Know Before Markets OpenInvestopedia
9,"These Stocks Are Moving the Most Today: SolarEdge, Enphase, American Express, Regions, Knight-Swift, HPE, and More"
10,5 Things to Know Before Markets OpenInvestopedia
11,Solar-Power Stocks Tumble After SolarEdge Warns of Slowing InstallationsThe Wall Street Journal
12,Why Solar Power Stocks Flamed Out on Friday
13,"SolarEdge Slashes Its Guidance as Demand in Europe Slows, and Shares PlungeInvestopedia"
14,SolarEdge Falls Nearly 30%; Major Warning About Demand In Europe Sinks Solar StocksInvestor's Business Daily
15,SolarEdge Revenue Drop Is ‘Warning Shot’ for Home Panel Industry
16,"Stocks to Watch Friday: American Express, Enphase Energy, Tesla, SolarEdge"
17,Markets Slump at Midday Amid Rising Worries About Fighting in the Middle East
