,0
0,Schlumberger (SLB) Ascends But Remains Behind Market: Some Facts to Note
1,Schlumberger (SLB) Reports Next Week: Wall Street Expects Earnings Growth
2,Schlumberger (SLB) Ascends But Remains Behind Market: Some Facts to NoteZacks
3,Brown & Brown (BRO) Reports Next Week: Wall Street Expects Earnings GrowthZacks
4,Institutional investors are Schlumberger Limited's (NYSE:SLB) biggest bettors and were rewarded after last week's US$4.2b market cap gain
5,"SLB, AWS and Shell Collaborate to Accelerate OSDU® Data Platform Adoption"
6,SLB (SLB): A Deep Dive into Its Performance Potential
7,Schlumberger Limited (SLB) Is a Trending Stock: Facts to Know Before Betting on It
8,SLB (SLB): A Smart Investment or a Value Trap? An In-Depth Exploration
9,Schlumberger Limited's (NYSE:SLB) Stock's On An Uptrend: Are Strong Financials Guiding The Market?
10,"SLB Launches First-of-Its-Kind, Easy-to-Install Methane Measurement Instrument"
11,Schlumberger (SLB) Gains As Market Dips: What You Should Know
