,0
0,"Synopsys (SNPS) to Provide IP, EDA Solutions for Arm Technology"
1,Arm and Synopsys Strengthen Partnership to Accelerate Custom Silicon on Advanced Nodes
2,"Cadence, Synopsys Offer 'Strong Growth, Low Cyclicality' Amid Chip Industry Unrest: Analyst"
3,Is Synopsys (SNPS) Outperforming Other Computer and Technology Stocks This Year?
4,(SNPS) Advances While Market Declines: Some Information for Investors
5,"Insider Sell: Sudhindra Kankanwadi Sells 12,355 Shares of Synopsys Inc (SNPS)"
6,Synopsys (SNPS) Laps the Stock Market: Here's Why
7,New Synopsys Research Reveals Vast Majority of Organizations Report DevOps Delays Due to Critical Security Issues
8,Synopsys: Relentless Inflows Send Shares Soaring
9,Synopsys (SNPS) Registers a Bigger Fall Than the Market: Important Facts to Note
