,0
0,Steel Dynamics Announces Leadership Appointments
1,Steel Dynamics (STLD) to Post Q3 Earnings: What's in the Offing?
2,Steel Dynamics (STLD) Rises Higher Than Market: Key Facts
3,Earnings Preview: Steel Dynamics (STLD) Q3 Earnings Expected to Decline
4,Steel Dynamics (STLD) Stock Moves -0.09%: What You Should Know
5,Steel Dynamics Stock Earns Relative Strength Rating Upgrade; Hits Key Threshold
6,Nucor (NUE) and Helion Partner on 500 MW Fusion Power Plant
7,Steel Dynamics Announces Third Quarter 2023 Earnings Conference Call and Webcast
8,"If You Invested $10,000 in U.S. Steel 10 Years Ago, This Is How Much You Would Have Today"
9,Steel Dynamics Inc (STLD): A Deep Dive into Its Dividend Performance and Sustainability
