,0
0,Retirement Stock Portfolio: 12 Consumer Stocks To Consider
1,"Sysco (SYY) Displays Bright Prospects, Headwinds Persist"
2,Sysco's (SYY) Upcoming Facility to Help Meet Growing Demand
3,Best Dividend Aristocrats According to Analysts
4,"Sysco Breaks Ground on New Facility in Mesa, Arizona"
5,"Sysco (SYY) to Buy Edward Don, Recipe for Growth on Track"
6,Shareholders in Sysco (NYSE:SYY) are in the red if they invested a year ago
7,Sysco Announces Plans to Acquire Leading Equipment & Supplies Distributor Edward Don & Company
8,Sysco to Release First Quarter Fiscal Year 2024 Financial Results on October 31
9,Unwrapping Sysco Corp's Dividend Performance: A Comprehensive Analysis
