,0
0,Why Molson Coors Brewing (TAP) is a Top Value Stock for the Long-Term
1,Why This 1 Value Stock Could Be a Great Addition to Your PortfolioZacks
2,Are You a Value Investor? This 1 Stock Could Be the Perfect PickZacks
3,"Coca-Cola (KO), Pernod (PRNDY) to Debut Absolut & Sprite Cocktail"
4,Will Molson Coors (TAP) Beat Estimates Again in Its Next Earnings Report?
5,Will UPS (UPS) Beat Estimates Again in Its Next Earnings Report?Zacks
6,Will AutoNation (AN) Beat Estimates Again in Its Next Earnings Report?Zacks
7,"Zacks Industry Outlook Highlights AnheuserBusch InBev, Constellation Brands, Brown-Forman, Molson Coors and Boston Beer"
8,Solid Demand Trends to Aid Procter & Gamble's (PG) Q1 Earnings
9,Should You Buy Procter & Gamble (PG) Ahead of Earnings?Zacks
10,Microsoft (MSFT) to Report Q1 Earnings: What's in the Cards?Zacks
11,5 Alcohol Industry Stocks Poised to Counter Adverse Trends
12,Here's Why Molson Coors (TAP) is Marching Ahead of Its Industry
13,Molson Coors Beverage Company to Webcast 2023 Third Quarter Earnings Conference Call
14,Molson Coors Steps Up Stock Buybacks as Bud Light Boycott Aids Business
15,S&P 500 Gains and Losses Today: Clorox Shares Dip After Warning of Cyberattack's Impact
