,0
0,Teledyne FLIR Defense Unveils New Black Hornet 4 Personal Reconnaissance System at AUSA Conference
1,Why Teledyne Technologies Incorporated (NYSE:TDY) Could Be Worth Watching
2,Teledyne Technologies (TDY) Inks Deal to Buy Xena Networks
3,Teledyne to Acquire Xena Networks
4,Teledyne FLIR Introduces New Portable Chemical Detector Designed for Rapid Narcotics Analysis
5,AAR (AIR) Beats Q1 Earnings and Revenue Estimates
6,Delta Air Lines (DAL) Beats Q3 Earnings and Revenue EstimatesZacks
7,UnitedHealth Group (UNH) Q3 Earnings and Revenues Surpass EstimatesZacks
8,The 3 Most Undervalued Robotics Stocks to Buy in September 2023
9,Insider Sell: Director VON SCHACK WESLEY W Sells 376 Shares of Teledyne Technologies Inc
10,Insider Sell: Director Jane Sherburne Sells 2000 Shares of Teledyne Technologies Inc
11,Why This 1 Momentum Stock Could Be a Great Addition to Your Portfolio
12,Are You a Momentum Investor? This 1 Stock Could Be the Perfect PickZacks
13,Here's Why FedEx (FDX) is a Strong Momentum StockZacks
