,0
0,Home Depot's organized crime bust shows how hard it is to fight retail 'shrink'
1,Target’s Operations Chief to Retire in February
2,4 Stocks That Moved the Market in September
3,Don’t Shop at Target on This Day of the Week
4,Better Stock Buy: Walmart vs. Target
5,Target remote jobs: What type of work and how much does it pay?
6,"Target Stock Jumps On Unusual Upgrade, Heads For Strongest Week Since June"
7,"Target upgraded, Beyond Meat downgraded: Wall Street's top analyst calls"
8,"Midday movers: Delta Air Lines, Walgreens Boots Alliance, Ford and more"
9,"Zacks Industry Outlook Highlights Costco Wholesale, The TJX Companies, Target and Ross Stores"
