,0
0,Are You Missing Out on This Monster Telecom's New Dividend Raise?
1,"T-Mobile Customers, Watch Your Bill. Some Users Get Put on Pricier Plans."
2,Global Report Names T-Mobile the Best in the Entire Friggin’ World for 5G Availability
3,Is AT&T a Buy?
4,T-Mobile Spooks the Competition with More Third-Party Network Wins
5,T-Mobile US and Deutsche Telekom Global Carrier Complete Testing of World’s First 5G Standalone Roaming Program with AIS and Sunrise
6,This Stock Just Reached a Record High Dividend Yield of 8.83%. Should You Buy It Before It's Too Late?
7,3 Warren Buffett Dividend Growth Stocks to Buy Now and Hold Forever
8,Investing in T-Mobile US (NASDAQ:TMUS) five years ago would have delivered you a 106% gain
9,T-Mobile Expands 5G Network Coverage in Virginia
