,0
0,The 7.3% return this week takes Targa Resources' (NYSE:TRGP) shareholders three-year gains to 457%
1,Targa Resources Corp. Announces Quarterly Dividend and Timing of Third Quarter 2023 Earnings Webcast
2,"Zacks Industry Outlook Highlights Targa Resources, Sunoco and CrossAmerica Partners"
3,3 Stocks to Watch From the Refining & Marketing MLP Industry
4,Targa Resources Corp. Releases Sustainability Report
5,Unveiling Targa Resources (TRGP)'s Value: Is It Really Priced Right? A Comprehensive Guide
6,Strength Seen in Sunoco LP (SUN): Can Its 8.3% Jump Turn into More Strength?
7,"Targa Resources Corp. to Participate in Wolfe Research Utilities, Midstream and Clean Energy Conference"
8,Targa Resources Corp. to Participate in Investor Conferences
9,A Look At The Fair Value Of Targa Resources Corp. (NYSE:TRGP)
