,0
0,Trimble Opens Two Technology Labs at The Ohio State University to Advance the Next Generation of Agriculture and Construction Talent
1,Trimble Third Quarter 2023 Earnings Call and Webcast
2,16 Best Stocks to Buy and Hold for the Next 15 Years According to Cathie Wood’s Portfolio
3,"Insider Sell: Trimble Inc's President & CEO Robert Painter Sells 2,500 Shares"
4,1 Hot Growth Stock to Buy Hand Over Fist
5,Trimble Announces FedRAMP Authorized Status for e-Builder Enterprise Government Edition
6,"Trimble (TRMB), Mincon Team Up to Boost Construction Business"
7,Buy AGCO Stock. It’s Ready to Take On Deere.
8,Trimble and Mincon Offer Trimble Ready Drilling and Piling Solution for Solar Industry
9,"Walgreens leadership, Trimble-AGCO deal, Carnival earnings: Trending tickers"
