,0
0,16 Best Stocks to Buy and Hold for the Next 15 Years According to Cathie Wood’s Portfolio
1,"Insider Sell: Trimble Inc's President & CEO Robert Painter Sells 2,500 Shares"
2,1 Hot Growth Stock to Buy Hand Over Fist
3,Trimble Announces FedRAMP Authorized Status for e-Builder Enterprise Government Edition
4,"Trimble (TRMB), Mincon Team Up to Boost Construction Business"
5,Buy AGCO Stock. It’s Ready to Take On Deere.
6,Trimble and Mincon Offer Trimble Ready Drilling and Piling Solution for Solar Industry
7,"Walgreens leadership, Trimble-AGCO deal, Carnival earnings: Trending tickers"
8,"AGCO, Trimble joint venture to expand 'mixed fleet' mindsets: CEO"
9,AGCO Corp (AGCO) to Buy Trimble Assets to Boost Portfolio
