,0
0,"What Does Tyson Foods, Inc.'s (NYSE:TSN) Share Price Indicate?"
1,Tyson Foods (TSN) & Protix to Build Insect Ingredient Facility
2,"UPDATE 1-Tyson Foods workers, activists protest child labor in US meat sector"
3,Nu Holdings and Tyson Foods have been highlighted as Zacks Bull and Bear of the Day
4,Tyson Foods Announces Partnership with Protix for More Sustainable Protein Production
5,Bear of the Day: Tyson Foods (TSN)
6,"Tyson Foods workers, activists protest child labor in US meat sector"
7,Tyson Foods (TSN) Sees a More Significant Dip Than Broader Market: Some Facts to Know
8,Protect Your Portfolio With These 7 Ironclad Dividend Stocks
9,"16 Places to Retire for $1,000 A Month"
