,0
0,United Parcel Service (UPS) Expected to Beat Earnings Estimates: Can the Stock Move Higher?
1,Earnings Preview: United States Steel (X) Q3 Earnings Expected to DeclineZacks
2,Nov Inc. (NOV) Earnings Expected to Grow: Should You Buy?Zacks
3,Sitting on Cash? These 2 Stocks Are Great Buys.
4,United Parcel Service (UPS) Advances But Underperforms Market: Key Facts
5,UPS’ 2024 rate changes look similar to FedEx’s
6,Will UPS (UPS) Beat Estimates Again in Its Next Earnings Report?
7,"Is United Parcel Service, Inc.'s (NYSE:UPS) ROE Of 50% Impressive?"
8,The Only 3 Stocks Bill Gates and Warren Buffett Both Own
9,How To Trade An Unbalanced Iron Condor On UPS Stock
10,20 Low-Cost Franchises with High Profits
11,Here’s How the Wage Agreement Will Impact United Parcel Service (UPS)
