,0
0,Analysts Estimate Phillips 66 (PSX) to Report a Decline in Earnings: What to Look Out for
1,Phillips 66 (PSX) Dips More Than Broader Market: What You Should KnowZacks
2,Analysts Estimate International Paper (IP) to Report a Decline in Earnings: What to Look Out forZacks
3,Here's Why Valero Energy (VLO) Fell More Than Broader Market
4,Valero Energy (VLO) Earnings Expected to Grow: Should You Buy?
5,Nov Inc. (NOV) Earnings Expected to Grow: Should You Buy?Zacks
6,Ford Motor Company (F) Earnings Expected to Grow: What to Know Ahead of Next Week's ReleaseZacks
7,Factors Likely to Determine the Fate of EQT in Q3 Earnings
8,Is a Beat in Store for Hess Corporation (HES) in Q3 Earnings?
9,Earnings Estimates Moving Higher for Hess (HES): Time to Buy?Zacks
10,Dow (DOW) Warms Up to Q3 Earnings: What's in the Cards?Zacks
11,Is a Beat in Store for Range Resources (RRC) in Q3 Earnings?
12,Can Lower Transactions Affect Western Union's (WU) Q3 Earnings?Zacks
13,Boyd Gaming (BYD) to Post Q3 Earnings: What's in the Offing?Zacks
14,Is a Beat in Store for Matador Resources (MTDR) in Q3 Earnings?
15,Should Value Investors Buy PBF Energy (PBF) Stock?
16,Should Value Investors Buy American Eagle Outfitters (AEO) Stock?Zacks
17,Should Value Investors Buy PlayAGS (AGS) Stock?Zacks
18,Why The 33% Return On Capital At Valero Energy (NYSE:VLO) Should Have Your Attention
19,Valero Energy (VLO) Stock Moves -0.14%: What You Should Know
