,0
0,Analysts Estimate Verizon Communications (VZ) to Report a Decline in Earnings: What to Look Out for
1,Verizon Communications (VZ) Surpasses Market Returns: Some Facts Worth KnowingZacks
2,Dow Inc. (DOW) Expected to Beat Earnings Estimates: Can the Stock Move Higher?Zacks
3,"Verizon is hiring 1,800 additional technicians to support broadband expansion"
4,Verizon Business wins big at 2023 MEF Excellence Awards
5,Is AT&T a Buy?
6,Verizon Communications (VZ) Surpasses Market Returns: Some Facts Worth Knowing
7,Analysts Estimate Verizon Communications (VZ) to Report a Decline in Earnings: What to Look Out forZacks
8,Is Verizon A Buy Amid Progress In 5G Network Buildout?Investor's Business Daily
9,Is Verizon A Buy Amid Progress In 5G Network Buildout?
10,Analysts Estimate Verizon Communications (VZ) to Report a Decline in Earnings: What to Look Out forZacks
11,Verizon Communications (VZ) Surpasses Market Returns: Some Facts Worth KnowingZacks
12,Should Passive Income Investors Avoid AT&T Stock and Verizon Stock Because of a Whopping $256 Billion in Debt?
13,This Stock Just Reached a Record High Dividend Yield of 8.83%. Should You Buy It Before It's Too Late?
14,"With 64% institutional ownership, Verizon Communications Inc. (NYSE:VZ) is a favorite amongst the big guns"
15,"After More Than Four Years, Has 5G Lived Up to Expectations?"
