,0
0,Unveiling Waters (WAT)'s Value: Is It Really Priced Right? A Comprehensive Guide
1,Waters Corporation Schedules Third Quarter 2023 Earnings Conference Call
2,Waters (WAT) Boosts Mass Spectrometry Clientele With Latest Move
3,Waters Corporation Collaborates with University of San Agustin to Establish the Philippines' First Mass Spectrometry Imaging Center
4,Waters ZetaStar Instrument Boosts Speed and Sensitivity of Light Scattering Measurements for Biological Therapies
5,Unveiling the Investment Potential of Waters Corp (WAT): A Comprehensive Analysis of Financial ...
6,Waters Launches New Walk-up Solutions that Further Simplify the Analysis of Biologic Drug Product and Cell Culture Media
7,"At US$281, Is Waters Corporation (NYSE:WAT) Worth Looking At Closely?"
8,Robo-Lab Stocks: 3 Robotics Companies Changing the Research Game
9,Waters Corporation to Present at the Bank of America Global Healthcare Conference 2023
