,0
0,WEC Energy Group declares quarterly dividend
1,WEC Energy Group (WEC): A Closer Look at Its Modest Undervaluation
2,Top 20 Renewable Energy Companies in USA by Revenue
3,PAM vs. WEC: Which Stock Is the Better Value Option?
4,Investors Met With Slowing Returns on Capital At WEC Energy Group (NYSE:WEC)
5,Why Is WEC Energy (WEC) Down 4.8% Since Last Earnings Report?
6,FE or WEC: Which Is the Better Value Stock Right Now?
7,3 Dividend Stocks That Should Pay You the Rest of Your Life
8,Investing in WEC Energy Group (NYSE:WEC) five years ago would have delivered you a 46% gain
9,WEC Energy Group's Corporate Responsibility Report highlights sustainable progress for an enduring enterprise
