,0
0,Waste Management (WM) Earnings Expected to Grow: What to Know Ahead of Next Week's Release
1,3 Anti-AI Stocks for Old-Fashioned Investors
2,WM Sets Date for Third Quarter Earnings Release Conference Call
3,16 $100K Jobs No One Wants
4,13 Best Stocks To Invest In According to AI
5,Waste Management Inc (WM): A Deep Dive into Dividend Performance and Sustainability
6,Jim Cramer Recommended These 10 Stocks
7,"Should Income Investors Look At Waste Management, Inc. (NYSE:WM) Before Its Ex-Dividend?"
8,7 Cash Cow Stocks for Recession-Resilient Dividends
9,Waste Management (WM) Down 4% Since Last Earnings Report: Can It Rebound?
