,0
0,Albemarle (ALB) Withdraws Offer to Acquire Liontown Resources
1,Barrick (GOLD) Reports Strong Preliminary Q3 Sales & Production
2,Newmont (NEM) Shareholders Approve the Acquisition of Newcrest
3,Newmont Corporation (NEM) Earnings Expected to Grow: Should You Buy?Zacks
4,Newmont (NEM) to Report Q3 Earnings: What's in the Offing?Zacks
5,L.B. Foster (FSTR) Shares Up 31% in 3 Months: Here's Why
6,Barrick (GOLD) to Explore New Discoveries in the Loulo Region
7,Here's Why You Should Invest in Koppers (KOP) Stock Now
8,American Vanguard (AVD) Expands in Latin America With Punto Verde
9,Should You Still Buy the S&P 500's Best-Performing September Stocks?
10,Worthington (WOR) Expands Mexican Facility to Meet EV Demand
11,Barrick (GOLD) to Invest $2 Billion in Zambia Mine Expansion
