,0
0,5 Large-Cap Stocks to Buy on the Dip for Q4 2023
1,5 Medical Product Stocks to Buy Amid Industry Recovery
2,Unveiling Zimmer Biomet Holdings (ZBH)'s Value: Is It Really Priced Right? A Comprehensive Guide
3,Zimmer Biomet Announces Webcast and Conference Call of Third Quarter 2023 Financial Results
4,15 Stocks Dumb Money’s Steve Cohen Is Betting On Now
5,Here's Why You Should Retain Zimmer Biomet (ZBH) for Now
6,Zimmer Biomet (ZBH) Gains From ROSA Sales Growth Amid FX Woes
7,"Are Zimmer Biomet Holdings, Inc.'s (NYSE:ZBH) Mixed Financials Driving The Negative Sentiment?"
8,Why This 1 Value Stock Could Be a Great Addition to Your Portfolio
9,Dexcom Says It Won't Be The Biggest Loser In The Weight-Loss Battle — And Shares Soar
