,0
0,Regional Bank Stocks' Gains Belie Their Q3 Results
1,Regional banks still have a profitability problem
2,"Zions Bancorporation to Present at the BancAnalysts Association of Boston, Inc."
3,"Zions (ZION) Falls Despite Q3 Earnings Beat, Costs Rise Y/Y"
4,"Zions Bancorporation, National Association (NASDAQ:ZION) Q3 2023 Earnings Call Transcript"
5,Q3 2023 Zions Bancorporation NA Earnings Call
6,"Zions Bancorp NA (ZION) Reports 3Q23 Earnings: Net Earnings of $168 Million, Diluted EPS of $1.13"
7,"Las Vegas Sands, Zions Bancorp, Equifax: Trending Stocks"
8,Zions Bancorp misses profit estimates on lower interest income
9,"Zions Shares Decline as Deposit, Borrowing Costs Soar Tenfold"
