title,score,id,subreddit,url,num_comments,body,created
"Daily Discussion Thread - December 1st, 2023",0,18895od,RobinHood,https://www.reddit.com/r/RobinHood/comments/18895od/daily_discussion_thread_december_1st_2023/,1,"## Join Robinhood and  get a free share!

Thinking of opening a Robinhood account? Use one of [our referral links](https://www.reddit.com/r/RobinHood/comments/iod4de/welcome_to_rrobinhood_free_stock_referral_thread/) and you'll get a free share!

## Important Links

  - /r/Robinhood Discord Server: https://discord.gg/Robinhood
  - Google: https://google.com/
  - Investopedia: https://investopedia.com/
  - Learning material from the SEC: https://investor.gov/
  - Robinhood support: https://robinhood.com/us/en/support/
  - Contact Robinhood: https://robinhood.com/contact

--

^Standard ^disclaimer: ^The ^content ^in ^this ^thread ^is ^for ^information ^and ^illustrative ^purposes ^only ^and ^should ^not ^be ^regarded ^as ^investment ^advice ^or ^as ^a ^recommendation ^of ^any ^particular ^security ^or ^course ^of ^action. ^Opinions ^expressed ^herein ^are ^the ^opinions ^of ^the ^poster ^and ^are ^subject ^to ^change ^without ^notice. ^Reasonable ^people ^may ^disagree ^about ^the ^opinions ^expressed ^herein. ^In ^the ^event ^any ^of ^the ^assumptions ^used ^herein ^do ^not ^prove ^to ^be ^true, ^results ^are ^likely ^to ^vary ^substantially. ^All ^investments ^entail ^risks. ^There ^is ^no ^guarantee ^that ^investment ^strategies ^will ^achieve ^the ^desired ^results ^under ^all ^market ^conditions ^and ^each ^investor ^should ^evaluate ^their ^ability ^to ^invest ^for ^a ^long ^term ^especially ^during ^periods ^of ^a ^market ^downturn. ^Have ^a ^nice ^day.",1701428408.0
"Stock Market Recap for Friday, December 1, 2023",2,188mw89,RobinHood,https://i.redd.it/7eczpqok3r3c1.png,0,,1701465952.0
[M26] thoughts on allocation?,7,1889me3,RobinHood,https://www.reddit.com/gallery/1889me3,4,"Been hoarding cash for the past year, finally felt safe enough to deploy some of that cash into investments. Still holding 3k in two separate checking accounts. Got 8500 in cash in RH. Will max out roth on January 1st [7k]. Thinking on leaving 1500 for the 5% yield so that the 5 dollars per month for gold pays itself off. Will contribute 500-1000 dollars a month to the taxable account until middle of the year (graduating and getting a job). From now i am thinking on investing only on VOO. Should I sell off all the BS stocks I bought or just leave them alone?",1701430124.0
Please give Guidance to a beginner?,1,188l2m6,RobinHood,https://www.reddit.com/r/RobinHood/comments/188l2m6/please_give_guidance_to_a_beginner/,0,I was curious what max loss meant for a call and puts? Does it mean if I don’t break even or make profit then I have to pay that max amount?,1701461198.0
Rate My Portfolio - r/StockMarket Quarterly Thread October 2023,11,16ww7oo,StockMarket,https://www.reddit.com/r/StockMarket/comments/16ww7oo/rate_my_portfolio_rstockmarket_quarterly_thread/,59,"Please use this thread to discuss your portfolio, learn of other stock tickers, and help out users by giving constructive criticism.  


Please share either a screenshot of your portfolio or more preferably a list of stock tickers with % of overall portfolio [using a table.](https://www.reddit.com/r/YouShouldKnow/comments/y37p6/ysk_how_to_make_a_table_on_reddit/)

Also include the following to make feedback easier:  


* Investing Strategy: Trading, Short-term, Swing, Long-term Investor etc.
* Investing timeline: 1-7 days (day trading), 1-3 months (short), 12+ months (long-term)",1696150943.0
JPow speaks today,51,188baqd,StockMarket,https://i.redd.it/dvifuedmlo3c1.png,8,The market: Up an escalator or down a mountain?,1701435613.0
should I buy into TakeTwo Interactive ahead of the GTA VI trailer?!,15,188jrm6,StockMarket,https://i.redd.it/uibmydpcfq3c1.jpg,22,,1701457718.0
What triggered this late surge?,271,1880rmj,StockMarket,https://i.redd.it/jehh73iril3c1.jpeg,173,What triggered the late rally today?,1701398330.0
Investing in the Energy Transition: November 2023 Recap,1,188lk4j,StockMarket,https://greenstocksresearch.com/november-2023-monthly-recap/,0,,1701462494.0
Industry Leading AI-Powered Data Analytics Platform Able to Enhance Clinic Revenue by 20%: MedBright AI (MBAI.c MBAIF),9,188juig,investing_discussion,/r/pennystocks/comments/187vzsc/industry_leading_aipowered_data_analytics/,0,,1701457943.0
Investing 101 Help,1,188c485,investing_discussion,https://www.reddit.com/r/investing_discussion/comments/188c485/investing_101_help/,4,"Hi guys! I‘ve got some money saved up and have finally realized that I need to invest to keep up with inflation, but am soo terribly lost. I have invested some in the S&P 500 to hold on long-term.
I was also thinking of investing in bonds before rates drop again. How do I invest in bonds? And what type/maturity what y’all recommend?

Also, how do I go about finding valuable stocks with potential? I was also considering investing in stocks that pay out dividends. Does anyone have recs for dividend stocks? 

Would really appreciate any help/guidance! Even if you can’t provide specific advice, if you could point me to a course that I could learn from, that would be great. Thanks!",1701438042.0
Anyone keeping up with CNRSF?,32,187pnqs,investing_discussion,https://www.reddit.com/r/investing_discussion/comments/187pnqs/anyone_keeping_up_with_cnrsf/,1,"Canadian North Resources Inc.'s Q3 2023 update is impressive. They completed a substantial drilling program, hitting major mineral intersections and expanding their Ferguson Lake project's mineralized horizon by over 3,000 meters. With strong financial support of over $8 million raised, the company is well-positioned for growth in the mineral exploration sector.  
  
Highlighted Main Points  
Successful Drilling Program: Completed a massive 20,000-meter drilling program with significant mineralized intersections.  
Financial Support: Raised over $8 million through various means, indicating strong investor confidence.  
Project Expansion: Expanded the Ferguson Lake project's mineralized horizon by over 3,000 meters, showcasing potential resources.  


TLDR:  
Canadian North Resources Inc.'s Q3 report highlights major drilling success and an expanded mineralized horizon at the Ferguson Lake project. With substantial financial support, the company is set for potential growth and development in the mineral exploration sector. https://finance.yahoo.com/news/canadian-north-resources-inc-reports-130000090.html",1701369541.0
What to Pair with VOO (Financial Advice),1,188aqts,investing_discussion,/r/dividends/comments/1888pzq/what_to_pair_with_voo_financial_advice/,0,,1701433829.0
Lump sum (LS) vs dollar cost averaging (DCA),1,188a9jz,investing_discussion,https://www.reddit.com/r/investing_discussion/comments/188a9jz/lump_sum_ls_vs_dollar_cost_averaging_dca/,1,"I guess this is a never-ending holy war but here are my two cents nobody seems to mention.  
  
The main argument for LS is that statistically it's more profitable to always be in the market and never bet against it. Doing DCA you're prolonging the time each of your money batch stays out of the market. Partially you're betting against the market doing this. It's been proven by a number of researches that LS wins in much more cases than DCA.  
  
However, nobody seems to mention the distribution of risk.  
  
With LS there's a small chance of getting terrible results, such as putting all your money into the market on a peak right before an economic depression which can last decades.  
  
With DCA there's a chance of getting negative returns too but their magnitude is much smaller.  
  
When you're doing DCA you are reducing the chances of getting better results but also you're reducing the chances of getting terrible results. I consider this as paying a fee against terrible outcomes, just like insurance.  
  
Is my reasoning fair or am I missing something?",1701432246.0
Read Warren Buffett’s annual letter to Berkshire Hathaway shareholders,7,11c4z2b,Investments,https://www.cnbc.com/2023/02/25/read-warren-buffetts-annual-letter-to-berkshire-hathaway-shareholders.html?__source=androidappshare,1,,1677384668.0
Former US Senator Mark Begich Joins Alaska Energy Metals (AEMC.v AKEMF) Board of Directors,6,187vbvu,Investments,https://www.reddit.com/r/Investments/comments/187vbvu/former_us_senator_mark_begich_joins_alaska_energy/,0,"**Adding to its already highly accomplished and diverse group across corporate governance, geology, mining, engineering and government affairs, Alaska Energy Metals' (AEMC.v AKEMF) has appointed Former US Senator Mark Begich to its Board of Directors.**

Seasoned entrepreneur and public servant Begich brings a wealth of experience to the realm of business growth strategy, having served as the mayor of Anchorage for 6 years and representing Alaska in the US Senate from 2009 to 2015. 

Notably, the Washingtonian named Begich as one of Washington DC's 500 Most Influential People of 2023, outside the government who play big roles in Washington's policy debates.

Beigch commented: 

>""Recognizing the pivotal role that the mining industry plays in shaping America's energy future, particularly in a global landscape focused on advancing in this domain, I am eager to share my insights. I am committed to collaborating with my esteemed fellow board members, collectively steering strategic decisions that will shape the trajectory and growth of AEMC in this crucial sector. I look forward to contributing meaningfully to our shared journey of success and progress,” 

**With a strategic focus on contributing to the global shift toward green technology, AEMC is poised to become a key player in the nickel market, an essential metal in advancing sustainable and renewable energy solutions.** 

AEMC's Nikolai Nickel Project boasts a resource exceeding 1.5B pounds of nickel, 372M pounds of copper, 115M pounds of cobalt as detailed in the Maiden NI 43-101 Mineral Resource Estimate and is ""quickly evolving into one of the largest nickel resources on the continent"".

https://preview.redd.it/cvquq4rcbk3c1.png?width=1280&format=png&auto=webp&s=7375a9eac001571f82db32e35c82eed5060b27df

On track to hit a resource growth target of reaching multiple billions of pounds of in situ 0.35% NiEq within 18 months, AEMC is advancing the project an aggressive, multi-drill approach, including up to 4 drill rigs moving next season. 

Full News Release: [https://alaskaenergymetals.com/news/mark-begich-appointed-to-board/](https://alaskaenergymetals.com/news/mark-begich-appointed-to-board/) 

Posted on Behalf of Alaska Energy Metals Corp. ",1701383735.0
"FDA Approves Zepbound, the Latest Weight-Loss Drug: The Kiplinger Letter",1,187zk8t,Investments,https://www.kiplinger.com/investing/economy/fda-approves-zepbound-weight-loss-drug-the-kiplinger-letter,0,,1701394877.0
Autonomix,2,187krfa,Investments,https://www.reddit.com/r/Investments/comments/187krfa/autonomix/,0,"Recently discovered the Autonomix Offering Circular [https://www.sec.gov/Archives/edgar/data/1617867/000168316823007193/autonomix\_253g2.htm#a\_012](https://www.sec.gov/Archives/edgar/data/1617867/000168316823007193/autonomix_253g2.htm#a_012)

$150 minimum, anyone else gone in on this? 

&#x200B;",1701357012.0
PMET's Latest Lithium Discovery Ignites Quebec's James Bay Region + A Lithium Junior in Close Proximity Worth the Watchlist: Arctic Fox Lithium (AFX.c),6,18748av,Investments,https://www.reddit.com/r/Investments/comments/18748av/pmets_latest_lithium_discovery_ignites_quebecs/,0,"**Unveiling the latest breakthrough in Quebec's James Bay Region, Patriot Battery Metals (PMET, 1.30B mcap) encountered \~100m of near-continuous-bearing pegmatite at its Corvette Lithium Property.** 

Home to the largest lithium pegmatite mineral resource in the Americas and boasting a maiden mineral resource estimate of 109.2M tonnes at 1.42% lithium oxide, this discovery solidified the region's stature as a key hub for active lithium projects. 

**Furthermore, this positive development augments the potential for the entire district, benefitting Canadian junior Arctic Fox Lithium (AFX.c) which holds three lithium projects located in close proximity to PMET's groundbreaking find.**

https://preview.redd.it/enxb2gz7md3c1.png?width=2282&format=png&auto=webp&s=7b78defd5f70c4a7afd83b0e510f52034ed3fd97

As detailed by President & CEO, Harry Chew, AFX successfully wrapped its Phase 1 exploration program at all three of its projects: [https://youtu.be/Xr0ziOpW9EM?si=wxPCrJVC-v\_YU2Sq](https://youtu.be/Xr0ziOpW9EM?si=wxPCrJVC-v_YU2Sq)

The incoming assays are poised to strengthen AFX's position in the industry as, once received, the results will be used to plan for its second phase of exploration on these properties.

AFX's Delta Lake, Kana Lake and Pontax North Projects all have favourable regional geological settings, close proximity to LCT pegmatite occurrences and deposits, and the potential for LCT pegmatites with multiple preliminary targets already outlined.

Demonstrating their immense potential, AFX's Delta Lake and Pontax North Projects are both located in close proximity Allkem (AKE, 8.5B Market Cap) as well as Critical Elements Lithium (CRE, 359.35M Market Cap) Rose Property where excellent lithium grades were returned, identifying several lithium-tantalum pegmatite trends including two kilometre long trends hosting multiple lithium, caesium and tantalum anomalies. 

Most notable, however, is AFX's Kana Lake which, situated the closest to PMET's Corvette Project and CV5 Pegmatite, has over 10 pegmatites including one substantial formation reaching over 500 meters and extending for over 2 kilometres, exhibiting substantial potential for new discoveries and growth. 

https://preview.redd.it/72r12um9md3c1.jpg?width=1600&format=pjpg&auto=webp&s=f8a42d5fe8e7d0ddb30fb728681836680c7069ab

On track to further delineate its resources, AFX could face a similar trajectory to the success that PMET experienced based on its proximity. 

Latest News Release: [https://www.juniorminingnetwork.com/junior-miner-news/press-releases/3000-cse/afx/150984-arctic-fox-completes-successful-phase-1-exploration-program.html](https://www.juniorminingnetwork.com/junior-miner-news/press-releases/3000-cse/afx/150984-arctic-fox-completes-successful-phase-1-exploration-program.html)

Posted on behalf of Arctic Fox Lithium Corp. ",1701302683.0
