title,score,id,subreddit,url,num_comments,body,created
"Weekend Discussion Thread for the Weekend of December 02, 2023",13,188mca2,wallstreetbets,https://www.reddit.com/r/wallstreetbets/comments/188mca2/weekend_discussion_thread_for_the_weekend_of/,813,"# Come hang with us on [Discord](https://discord.gg/wsbverse)

Check our [Earnings Thread](https://reddit.com/r/wallstreetbets/about/sticky?num=2) and [Rules](https://www.reddit.com/r/wallstreetbets/wiki/contentguide). DM the [mod inbox](https://www.reddit.com/message/compose/?to=/r/wallstreetbets)",1701464508.0
"Most Anticipated Earnings Releases for the week beginning December 4th, 2023",289,187wmuu,wallstreetbets,https://i.redd.it/i5q50ii3lk3c1.jpg,152,,1701387008.0
Disney lost market cap after’s Elon’s F**k you to Disney’s Bob iger in interview,2059,188fzwf,wallstreetbets,https://24stocknews.com/disney-lost-market-cap-afters-elons-fk-you-to-disneys-bob-iger-in-interview/,623,,1701448069.0
Elon phones a friend,22918,1884rxo,wallstreetbets,https://v.redd.it/b8mveeb6km3c1,997,,1701410935.0
BABA today hit a new 52-week low. This is ridiculous.,378,188hg9t,wallstreetbets,https://www.reddit.com/r/wallstreetbets/comments/188hg9t/baba_today_hit_a_new_52week_low_this_is_ridiculous/,264,"This is a giant of modern economy. The king of eCommerce and hundreds of different ventures, from entertainement to supply chain and fintech. It is trading at 180 pathetic billion dollars, when the direct peers (US Tech) are above 2 trillion USD valuation.",1701451795.0
"AMA November 30, 2023 with 3Commas - We turn TradingView charts into deal-seeking automated bots",9,186r1et,CryptoCurrency,https://www.reddit.com/r/CryptoCurrency/comments/186r1et/ama_november_30_2023_with_3commas_we_turn/,33,"&#x200B;

https://preview.redd.it/teqz32vsof3c1.png?width=1800&format=png&auto=webp&s=cb2583c24cd839cbed321ab4d12db2b7910e9eb8

I'm Irakli Guntaishvili, a Product Owner at 3Commas. As one of the leading cryptocurrency trade automation platforms, we're excited to introduce our latest innovation: the Signal Bot (beta). Signal Bot makes it easier to create a killer bot that can do more than just Grid or DCA strategies by simplifying the incorporation of TradingView alerts and signals directly into the bot. It receives alerts from TradingView and opens positions, offering users the ability to manage these positions by increasing or decreasing them as needed.

I'm here to address any inquiries you may have about automating crypto trading strategies, ranging from simple to complex, using signals from market intelligence platforms like TradingView. While my primary focus is on TradingView users, given that our latest bot, the Signal Bot, is tailored to their needs, I believe this conversation will be intriguing for anyone, including those who are not currently using TradingView or automated bot trading. It might serve as inspiration for you to explore these avenues further.

Signal Bot is primarily targeted at experienced crypto traders, but if you’re already using TradingView for your stock trading moves or for crypto market intelligence, you might find the transition to trading crypto with Signal Bot to not be the big leap it is for others. 

**What is 3Commas?** 

3Commas is a software platform that allows traders to automate their strategies at scale by using bots and other tools. Basically, our bots do all the chartwatching and buy/sell actions for you according to the conditions and parameters you decide. Our multi-pair bots can watch 200 coin pairs at the same time, hunting for deals that meet your conditions, with assistance from signals and indicators either set up by you or delivered via a trusted 3rd party such as TradingView. 

Between Signal Bot, DCA Bot, Grid Bot, and Smart Trade, almost any trading strategy you can dream up, including extremely complex maneuvers, can be executed with 3Commas trade facilitation tools. 

We are not a brokerage, and we do not have custody of client funds at any time. Our software works by creating an encrypted API connection between your 3Commas account and your account on cryptocurrency exchanges such as Coinbase, Binance, Kraken, OKX, etc. and sending commands to execute actions allowed by those exchanges. 

Start time: 16:00 UTC/GMT, November 30, 2023

End time: 18:00 UTC/GMT, December 2, 2023

Useful links:  
[https://3commas.io/](https://3commas.io/)

[Introducing Signal Bot Part I](https://3commas.io/blog/signal-bot)

[Introducing Signal Bot Part II](https://3commas.io/blog/signal-bot-vision-roadmap-part2)",1701269107.0
Moons update: Reddit has officially renounced the Moons contract,433,187tg7a,CryptoCurrency,https://www.reddit.com/r/CryptoCurrency/comments/187tg7a/moons_update_reddit_has_officially_renounced_the/,785,"[See here for our previous update.](https://www.reddit.com/r/CryptoCurrency/s/nJWBq3jGFN)   

The admins have officially [renounced the Moons contract](https://nova.arbiscan.io/tx/0x48fece81ba5ee6feef5b4d4caf8b832e6ba0cae7ea007fc3106d4aa82c2764db#eventlog) and they also [burned their remaining 98,000 Moons.](https://nova.arbiscan.io/tx/0x48fece81ba5ee6feef5b4d4caf8b832e6ba0cae7ea007fc3106d4aa82c2764db)  

This is a significant milestone as the community now has assurance that there will be no further changes to Moons’ contract in the future. This was the preferred option as it allows for Moons to easily retain existing exchange listings, there’s no need for a new token to be deployed, and the supply is now capped at \~83,000,000 Moons. 

The mod team will continue to work on bringing back and improving features such as memberships, governance and tipping. We are also exploring restarting distribution, though exactly how that will work remains to be seen.  

We will share all major updates here, but if you’re interested in joining the discussion on the future of Moons then head on over to r/CryptoCurrencyMeta!",1701379092.0
"IRS Slaps FTX With Massive $24 Billion Tax Bill, Crypto Exchange Responds",505,188f7kq,CryptoCurrency,https://bitcoinist.com/irs-ftx-24-billion-tax-bill-crypto/,91,,1701446059.0
Investors Lose 98.7% in Cristiano Ronaldo Endorsed NFT as He Faces $1 Billion Lawsuit in US,160,188h27y,CryptoCurrency,https://www.essentiallysports.com/soccer-football-news-investors-lose-ninety-eight-seven-in-cristiano-ronaldo-launched-nft-as-al-nassr-star-faces-one-billion-lawsuit-for-binance-endorsement/,71,,1701450794.0
"MicroStrategy Buys 16,130 More Bitcoin For $593M",231,188cbxa,CryptoCurrency,https://www.coinfeeds.io/daily/microstrategy-buys-more-bitcoin,106,,1701438640.0
"Daily General Discussion and Advice Thread - December 01, 2023",0,18889gw,investing,https://www.reddit.com/r/investing/comments/18889gw/daily_general_discussion_and_advice_thread/,35,"Have a general question?  Want to offer some commentary on markets?  Maybe you would just like to throw out a neat fact that doesn't warrant a self post?  Feel free to post here! 

If your question is ""I have $10,000, what do I do?"" or other ""advice for my personal situation"" questions, you should include relevant information, such as the following:

* How old are you? What country do you live in?  
* Are you employed/making income? How much?  
* What are your objectives with this money? (Buy a house? Retirement savings?)  
* What is your time horizon? Do you need this money next month? Next 20yrs?  
* What is your risk tolerance? (Do you mind risking it at blackjack or do you need to know its 100% safe?)  
* What are you current holdings? (Do you already have exposure to specific funds and sectors? Any other assets?)  
* Any big debts (include interest rate) or expenses?  
* And any other relevant financial information will be useful to give you a proper answer.  

Please consider consulting our FAQ first - https://www.reddit.com/r/investing/wiki/faq
And our [side bar](https://www.reddit.com/r/investing/about/sidebar) also has useful resources.  

If you are new to investing - please refer to Wiki - [Getting Started](https://www.reddit.com/r/investing/wiki/index/gettingstarted/)

The reading list in the wiki has a list of books ranging from light reading to advanced topics depending on your knowledge level. Link here - [Reading List](https://www.reddit.com/r/investing/wiki/readinglist)

Check the resources in the sidebar.

Be aware that these answers are just opinions of Redditors and should be used as a starting point for your research. You should strongly consider seeing a registered investment adviser if you need professional support before making any financial decisions!",1701424870.0
"Powell keeps more hikes on table, throws cold water on rate-cut talk",178,188g1gm,investing,https://www.reddit.com/r/investing/comments/188g1gm/powell_keeps_more_hikes_on_table_throws_cold/,70,"[https://finance.yahoo.com/news/powell-premature-to-conclude-fed-rate-hikes-are-over-or-speculate-when-cuts-could-begin-160003194.html](https://finance.yahoo.com/news/powell-premature-to-conclude-fed-rate-hikes-are-over-or-speculate-when-cuts-could-begin-160003194.html)

Federal Reserve **Powell** offered a new warning to investors who believe the Fed is finished raising rates and will soon pivot to cutting, saying the central bank needs to see more evidence that inflation is on its way back to the Fed’s 2% target.

The Fed remains cautious that if consumer spending remains strong, inflation may start picking up again in 2024. 

Also New York Fed President **John Williams** said that inflation remains too high and the Fed’s work is not nearly done.",1701448188.0
Pfizer halted trial of obesity drug due to side effects. Stock drops about 6%,66,188e38s,investing,https://www.reddit.com/r/investing/comments/188e38s/pfizer_halted_trial_of_obesity_drug_due_to_side/,28,"All,

https://www.marketwatch.com/story/pfizers-stock-falls-4-after-saying-it-will-not-move-to-phase-3-trial-of-weight-loss-drug-as-twice-daily-formation-3813e092

Pfizer is already sitting right next to it's 52 week lows. I wonder how much of the news is already priced in.

Considering that covid vaccine / antiviral revenues would pretty much become insignificant in 1-2 years and now obesity drug tests are discontinued, it explains the huge drop in Pfizer's stock. However, rest of its portfolio is still going strong and it's sitting on plenty of cash.

I have a small position that I recently opened and am wanting to buy more. What are some things that I should look for or research further before putting more money in?",1701443130.0
Dad might be getting scammed.,193,188474e,investing,https://www.reddit.com/r/investing/comments/188474e/dad_might_be_getting_scammed/,141,"Hi everyone,

Recently my dad found this website online that (https://avrmxinvestment.net/) invests money for you. My gut feeling is telling me this is not legit but he’s saying he’s made some profit that they promise. Now, I’m not too familiar with all this so it’d be helpful if someone can confirm or deny my suspicions? 

They’re based out of Costa Rica as well and he’s planning on putting 1k in tonight after putting in a couple hundred before. 

Any insights would be helpful as I try to convince him not to do this lol.",1701408979.0
Investing in T-Bills in 2024...What's the prediction?,8,188howt,investing,https://www.reddit.com/r/investing/comments/188howt/investing_in_tbills_in_2024whats_the_prediction/,19,"I've been investing the majority of my savings in T-Bills in 2023. This was my first time I've held my money in any other account than my savings. I've held my funds in the short term 4 week bills- 8 week bills.

I'm curious about others opinions on what 2024 is going to look like with T-Bills. I'm afraid the rates are going to go down, and I'm debating on whether I should start reinvesting my T-Bills in longer term T-Bills. I'm also thinking about possibly investing in a longer term Bond (10 year) to lock in a decent rate.

Do we think there's any chance the rates are going to rise? I'm thinking they may stay the same or lower. I know some people are predicting the Fed to Lower rates in early 2024, where some believe they Fed may hang tight until end of 2024.

What do you think?",1701452398.0
Rate My Portfolio - r/Stocks Quarterly Thread December 2023,1,18888ww,stocks,https://www.reddit.com/r/stocks/comments/18888ww/rate_my_portfolio_rstocks_quarterly_thread/,4,"Please use this thread to discuss your portfolio, learn of other stock tickers, and help out users by giving constructive criticism.

Why quarterly?  Public companies report earnings quarterly; many investors take this as an opportunity to rebalance their portfolios.  We highly recommend you do some reading:  A list of [relevant posts & book recommendations.](https://www.reddit.com/r/stocks/wiki/index#wiki_relevant_posts_.26amp.3B_book_recommendations)

You can find stocks on your own by using a scanner like your broker's or [Finviz.](https://finviz.com/screener.ashx)  To help further, here's a list of [relevant websites.](https://www.reddit.com/r/stocks/wiki/index#wiki_relevant_websites.2Fapps)

If you don't have a broker yet, see our [list of brokers](https://www.reddit.com/r/stocks/wiki/index#wiki_brokers_for_investing) or search old posts.  If you haven't started investing or trading yet, then setup your [paper trading.](https://www.reddit.com/r/stocks/wiki/index#wiki_is_there_a_way_to_practice.3F)

Be aware of [Business Cycle Investing](https://eresearch.fidelity.com/eresearch/markets_sectors/sectors/si_business_cycle.jhtml?tab=sibusiness) which Fidelity issues updates to the state of global business cycles every 1 to 3 months (note: Fidelity changes their links often, so search for it since their take on it is enlightening).  [Investopedia's take on the Business Cycle](https://www.investopedia.com/articles/investing/061316/business-cycle-investing-ratios-use-each-cycle.asp) and their [video.](https://www.investopedia.com/video/play/business-cycle/)

If you need help with a falling stock price, check out Investopedia's [The Art of Selling A Losing Position](https://www.investopedia.com/articles/02/022002.asp) and their [list of biases.](https://www.investopedia.com/articles/stocks/08/capital-losses.asp)

Here's a list of all the [previous portfolio stickies.](https://www.reddit.com/r/stocks/search?q=author%3Aautomoderator+title%3A%22Rate+My+Portfolio%22&restrict_sr=on&sort=new&t=all)",1701424824.0
"r/Stocks Daily Discussion & Fundamentals Friday Dec 01, 2023",11,1888pez,stocks,https://www.reddit.com/r/stocks/comments/1888pez/rstocks_daily_discussion_fundamentals_friday_dec/,339,"This is the daily discussion, so anything stocks related is fine, but the theme for today is on fundamentals, but if fundamentals aren't your thing then just ignore the theme and/or [post your arguments against fundamentals here](https://www.reddit.com/r/stocks/search?q=author%3Aautomoderator+%22r%2Fstocks+semiannual+arguments+against+TA%22&restrict_sr=on&include_over_18=on&sort=new&t=all) and not in the current post.

Some helpful day to day links, including news:

* [Finviz](https://finviz.com/quote.ashx?t=spy) for charts, fundamentals, and aggregated news on individual stocks
* [Bloomberg market news](https://www.bloomberg.com/markets)
* StreetInsider news:
  * [Market Check](https://www.streetinsider.com/Market+Check) - Possibly why the market is doing what it's doing including sudden spikes/dips
  * [Reuters aggregated](https://www.streetinsider.com/Reuters) - Global news

-----

Most fundamentals are updated every 3 months due to the fact that corporations release earnings reports every quarter, so traders are always speculating at what those earnings will say, and investors may change the size of their holdings based on those reports.  Expect a lot of volatility around earnings, but it usually doesn't matter if you're holding long term, but keep in mind the importance of earnings reports because a trend of declining earnings or a decline in some other fundamental will drive the stock down over the long term as well.

See the following word cloud and click through for the wiki:

[Market Cap - Shares Outstanding - Volume - Dividend - EPS - P/E Ratio - EPS Q/Q - PEG - Sales Q/Q - Return on Assets (ROA) - Return on Equity (ROE) - BETA - SMA - quarterly earnings](https://www.reddit.com/r/stocks/wiki/fundamentals-themed-post)

If you have a basic question, for example ""what is EBITDA,"" then google ""investopedia EBITDA"" and click the Investopedia article on it; do this for everything until you have a more in depth question or just want to share what you learned.

Useful links:

* [Investopedia page](https://www.investopedia.com/fundamental-analysis-4689757/) on fundamental analysis including [Discounted Cash Flow](https://www.investopedia.com/university/dcf/) analysis; see [definition here](https://www.investopedia.com/terms/d/dcf.asp) and read [their PDF on the topic.](http://i.investopedia.com/inv/pdf/tutorials/fundamentalanalysis_intro.pdf)
* [FINVIZ](https://finviz.com/quote.ashx?t=aapl) for fundamental data, charts, and aggregated news
* [Earnings Whisper](https://www.earningswhispers.com/stocks/aapl) for earnings details

See our past [daily discussions here.](https://www.reddit.com/r/stocks/search?q=author%3Aautomoderator+%22r%2Fstocks+daily+discussion%22&restrict_sr=on&sort=new&t=all)  Also links for:  [Technicals](https://www.reddit.com/r/stocks/search?q=author%3Aautomoderator+title%3Atechnicals&restrict_sr=on&include_over_18=on&sort=new&t=all) Tuesday, [Options Trading](https://www.reddit.com/r/stocks/search?q=author%3Aautomoderator+title%3Aoptions&restrict_sr=on&include_over_18=on&sort=new&t=all) Thursday, and [Fundamentals](https://www.reddit.com/r/stocks/search?q=author%3Aautomoderator+title%3Afundamentals&restrict_sr=on&include_over_18=on&sort=new&t=all) Friday.",1701426609.0
Apple TV Plus and Paramount Plus reportedly discussing cheap bundle plan to take on Netflix,95,188i79a,stocks,https://www.reddit.com/r/stocks/comments/188i79a/apple_tv_plus_and_paramount_plus_reportedly/,46,"https://www.techradar.com/streaming/apple-tv-plus-and-paramount-plus-reportedly-discussing-cheap-bundle-plan-to-take-on-netflix

According to the Wall Street Journal (WSJ), two of the world's most underrated streamers have held talks about creating a cost-effective bundle to put a stop to Netflix's dominance of the streaming landscape. People familiar with the discussions reportedly told the WSJ that Apple TV Plus and Paramount Plus aren't just looking to end Netflix's reign as the world's best streaming service. Per the US outlet's sources, the duo are also said to want to offer their services as a joint enterprise in a bid to save people money. Indeed, the two companies are believed to have had meaningful dialog about offering said bundle at a cheaper price than subscribing to both streamers separately – a deal that would surely pique the interest of customers operating on a budget.

If the WSJ's report is correct – the outlet is keen to stress talks are still in the early stages – the potential bundling of Paramount Plus and Apple TV Plus into a single package could have a big impact on the wider streaming industry. For one, the world's eight biggest streamers have all raised their prices over the past 12 months – some, such as Disney Plus and Max, have done so twice in less than a year in the US. That's placed undue pressure on people who are subscribed to multiple services, with many forced to choose which one (or, at a push two) to stay with as the cost of living continues to bite.

The bundling of Paramount and Apple's platforms, then, would be seen as a significant move. Like their rivals, the pair have increased their subscription fees in 2023 – Apple TV Plus' major price hike was particularly irksome to me – and, while each one has some great content to offer customers, their back catalogs aren't on a par with Netflix, Prime Video, or even Hulu. Apple TV Plus' library only consists of first-party (albeit mostly terrific) offerings, while Paramount Plus doesn't have the strength in depth from first and third-party perspectives to compete with the world's most popular services.",1701453708.0
When do you sell a stock?,58,188kezw,stocks,https://www.reddit.com/r/stocks/comments/188kezw/when_do_you_sell_a_stock/,90,"I currently hold Royal Caribbean and am up 220% as well as Palantir and I am up 140%. How do you when to sell? I mean I know I can make a profit now but if I sell and use my profits to buy VOO, am I going to regret it if I could have been up 300%?

Edit: thank you to everyone who posted. I didn’t think about taking my original investment out and then keeping the gains running. Thank you for that suggestion!",1701459465.0
"let's be real. if a megacap stock drops 50%, 99% of y'all wouldn't touch it",766,187wwg2,stocks,https://www.reddit.com/r/stocks/comments/187wwg2/lets_be_real_if_a_megacap_stock_drops_50_99_of/,355,"It's intriguing how recent market trends, like META's dramatic drop and subsequent recovery, reflect investor psychology more than rational analysis. Earlier this year, META was trading at a 75% discount from its all-time high, and the general sentiment was overwhelmingly negative, akin to buying Blockbuster stock in 2006.

However, following its near 300% rise from that low point, perceptions have shifted drastically. This flip-flop in attitude underlines a critical aspect of investing: market sentiment is often driven by emotion rather than fundamentals. If META, or any big name for that matter, dropped by 50% again, history suggests that the majority of investors would shy away, not jump in.

This pattern is a classic example of the behavioral economics at play in the stock market, where fear and greed often override logical decision-making. It's why individual stock picking, especially based on market dips, can be so risky and unpredictable. It demonstrates the value of a more diversified, steady approach, like investing in index funds, which is likely a more suitable strategy for the majority of investors.",1701387693.0
